[dai@asrockcentos8 ~]$ sudo tcpdump -i lo -A dst port 5432
dropped privs to tcpdump
tcpdump: verbose output suppressed, use -v or -vv for full protocol decode
listening on lo, link-type EN10MB (Ethernet), capture size 262144 bytes
00:20:13.172592 IP asrockcentos8.38840 > asrockcentos8.postgres: Flags [S], seq 1793193255, win 43690, options [mss 65495,sackOK,TS val 2679839699 ecr 0,nop,wscale 7], length 0
E..<+.@.@..U...........8j..'...................
............
00:20:13.172613 IP asrockcentos8.38840 > asrockcentos8.postgres: Flags [.], ack 804984686, win 342, options [nop,nop,TS val 2679839699 ecr 2679839699], length 0
E..4+.@.@..\...........8j..(/..n...V.......
........
00:20:13.173762 IP asrockcentos8.38840 > asrockcentos8.postgres: Flags [P.], seq 0:8, ack 1, win 342, options [nop,nop,TS val 2679839700 ecr 2679839699], length 8
E..<,.@.@..S...........8j..(/..n...V.......
.............../
00:20:13.173793 IP asrockcentos8.38840 > asrockcentos8.postgres: Flags [.], ack 2, win 342, options [nop,nop,TS val 2679839700 ecr 2679839700], length 0
E..4,.@.@..Z...........8j..0/..o...V.......
........
00:20:13.174523 IP asrockcentos8.38840 > asrockcentos8.postgres: Flags [P.], seq 8:122, ack 2, win 342, options [nop,nop,TS val 2679839701 ecr 2679839700], length 114
E...,.@.@..............8j..0/..o...V.......
...........r....user.user1.database.postgres.client_encoding.UTF8.DateStyle.ISO.TimeZone.Asia/Tokyo.extra_float_digits.2..
00:20:13.175245 IP asrockcentos8.38840 > asrockcentos8.postgres: Flags [P.], seq 122:132, ack 11, win 342, options [nop,nop,TS val 2679839702 ecr 2679839701], length 10
E..>,.@.@..N...........8j.../..x...V.......
........p...    pass.
00:20:13.183785 IP asrockcentos8.38840 > asrockcentos8.postgres: Flags [P.], seq 132:174, ack 334, win 350, options [nop,nop,TS val 2679839710 ecr 2679839704], length 42
E..^,.@.@..-...........8j.../......^.......
........P.....BEGIN...B............E... .....S....
00:20:13.183918 IP asrockcentos8.38840 > asrockcentos8.postgres: Flags [P.], seq 174:237, ack 361, win 350, options [nop,nop,TS val 2679839710 ecr 2679839710], length 63
E..s,.@.@..............8j.../......^.......
........P...".SET extra_float_digits = 3...B............E...    .....S....
00:20:13.188124 IP asrockcentos8.38840 > asrockcentos8.postgres: Flags [P.], seq 237:321, ack 386, win 350, options [nop,nop,TS val 2679839715 ecr 2679839715], length 84
E...,.@.@..............8j.../......^.......
........P...7.SET application_name = 'PostgreSQL JDBC Driver'...B............E...       .....S....
00:20:13.188203 IP asrockcentos8.38840 > asrockcentos8.postgres: Flags [P.], seq 321:364, ack 456, win 350, options [nop,nop,TS val 2679839715 ecr 2679839715], length 43
E.._,.@.@..)...........8j..i/..5...^.......
........P.....COMMIT...B............E...        .....S....
00:20:13.191503 IP asrockcentos8.38840 > asrockcentos8.postgres: Flags [P.], seq 364:408, ack 484, win 350, options [nop,nop,TS val 2679839718 ecr 2679839715], length 44
E..`,.@.@..'...........8j.../..Q...^.......
........P........B............D....P.E...       .....S....
00:20:13.191629 IP asrockcentos8.38840 > asrockcentos8.postgres: Flags [P.], seq 408:484, ack 510, win 350, options [nop,nop,TS val 2679839718 ecr 2679839718], length 76
E...,   @.@..............8j.../..k...^.......
........P...(.SHOW TRANSACTION ISOLATION LEVEL...B............D....P.E...       .....S....
00:20:13.196184 IP asrockcentos8.38840 > asrockcentos8.postgres: Flags [P.], seq 484:572, ack 608, win 350, options [nop,nop,TS val 2679839723 ecr 2679839718], length 88
E...,
@.@..............8j.../......^.......
........P...,.select * from item where id = $1.......B................12..D....P.E...   .....S....
00:20:13.236994 IP asrockcentos8.38840 > asrockcentos8.postgres: Flags [.], ack 708, win 350, options [nop,nop,TS val 2679839764 ecr 2679839723], length 0
E..4,.@.@..P...........8j..d/..1...^.......
........
00:20:13.294497 IP asrockcentos8.38844 > asrockcentos8.postgres: Flags [S], seq 4234623114, win 43690, options [mss 65495,sackOK,TS val 2679839821 ecr 0,nop,wscale 7], length 0
E..<..@.@..|...........8.g8....................
...M........
00:20:13.294515 IP asrockcentos8.38844 > asrockcentos8.postgres: Flags [.], ack 3442637310, win 342, options [nop,nop,TS val 2679839821 ecr 2679839821], length 0
E..4..@.@..............8.g8..2y....V.......
...M...M
00:20:13.294604 IP asrockcentos8.38844 > asrockcentos8.postgres: Flags [P.], seq 0:8, ack 1, win 342, options [nop,nop,TS val 2679839821 ecr 2679839821], length 8
E..<..@.@..z...........8.g8..2y....V.......
...M...M......./
00:20:13.294935 IP asrockcentos8.38844 > asrockcentos8.postgres: Flags [.], ack 2, win 342, options [nop,nop,TS val 2679839821 ecr 2679839821], length 0
E..4..@.@..............8.g8..2y....V.......
...M...M
00:20:13.294960 IP asrockcentos8.38844 > asrockcentos8.postgres: Flags [P.], seq 8:122, ack 2, win 342, options [nop,nop,TS val 2679839821 ecr 2679839821], length 114
E.....@.@..............8.g8..2y....V.......
...M...M...r....user.user1.database.postgres.client_encoding.UTF8.DateStyle.ISO.TimeZone.Asia/Tokyo.extra_float_digits.2..
00:20:13.295291 IP asrockcentos8.38844 > asrockcentos8.postgres: Flags [P.], seq 122:132, ack 11, win 342, options [nop,nop,TS val 2679839822 ecr 2679839822], length 10
E..>..@.@..u...........8.g9..2z....V.......
...N...Np...    pass.
00:20:13.296728 IP asrockcentos8.38844 > asrockcentos8.postgres: Flags [P.], seq 132:174, ack 334, win 350, options [nop,nop,TS val 2679839823 ecr 2679839823], length 42
E..^..@.@..T...........8.g9..2{K...^.......
...O...OP.....BEGIN...B............E... .....S....
00:20:13.296805 IP asrockcentos8.38844 > asrockcentos8.postgres: Flags [P.], seq 174:237, ack 361, win 350, options [nop,nop,TS val 2679839823 ecr 2679839823], length 63
E..s..@.@..>...........8.g99.2{f...^.......
...O...OP...".SET extra_float_digits = 3...B............E...    .....S....
00:20:13.296888 IP asrockcentos8.38844 > asrockcentos8.postgres: Flags [P.], seq 237:321, ack 386, win 350, options [nop,nop,TS val 2679839823 ecr 2679839823], length 84
E.....@.@..(...........8.g9x.2{....^.......
...O...OP...7.SET application_name = 'PostgreSQL JDBC Driver'...B............E...       .....S....
00:20:13.296946 IP asrockcentos8.38844 > asrockcentos8.postgres: Flags [P.], seq 321:364, ack 456, win 350, options [nop,nop,TS val 2679839823 ecr 2679839823], length 43
E.._..@.@..P...........8.g9..2{....^.......
...O...OP.....COMMIT...B............E...        .....S....
00:20:13.297303 IP asrockcentos8.38858 > asrockcentos8.postgres: Flags [S], seq 947054225, win 43690, options [mss 65495,sackOK,TS val 2679839824 ecr 0,nop,wscale 7], length 0
E..< X@.@..............88r.....................
...P........
00:20:13.297316 IP asrockcentos8.38858 > asrockcentos8.postgres: Flags [.], ack 955520077, win 342, options [nop,nop,TS val 2679839824 ecr 2679839824], length 0
E..4 Y@.@..............88r..8..M...V.......
...P...P
00:20:13.297386 IP asrockcentos8.38858 > asrockcentos8.postgres: Flags [P.], seq 0:8, ack 1, win 342, options [nop,nop,TS val 2679839824 ecr 2679839824], length 8
E..< Z@.@..............88r..8..M...V.......
...P...P......./
00:20:13.297691 IP asrockcentos8.38858 > asrockcentos8.postgres: Flags [.], ack 2, win 342, options [nop,nop,TS val 2679839824 ecr 2679839824], length 0
E..4 [@.@..............88r..8..N...V.......
...P...P
00:20:13.297712 IP asrockcentos8.38858 > asrockcentos8.postgres: Flags [P.], seq 8:122, ack 2, win 342, options [nop,nop,TS val 2679839824 ecr 2679839824], length 114
E... \@.@..............88r..8..N...V.......
...P...P...r....user.user1.database.postgres.client_encoding.UTF8.DateStyle.ISO.TimeZone.Asia/Tokyo.extra_float_digits.2..
00:20:13.297979 IP asrockcentos8.38858 > asrockcentos8.postgres: Flags [P.], seq 122:132, ack 11, win 342, options [nop,nop,TS val 2679839824 ecr 2679839824], length 10
E..> ]@.@..............88r..8..W...V.......
...P...Pp...    pass.
00:20:13.299315 IP asrockcentos8.38858 > asrockcentos8.postgres: Flags [P.], seq 132:174, ack 334, win 350, options [nop,nop,TS val 2679839826 ecr 2679839826], length 42
E..^ ^@.@..............88r..8......^.......
...R...RP.....BEGIN...B............E... .....S....
00:20:13.299391 IP asrockcentos8.38858 > asrockcentos8.postgres: Flags [P.], seq 174:237, ack 361, win 350, options [nop,nop,TS val 2679839826 ecr 2679839826], length 63
E..s _@.@..............88r.@8......^.......
...R...RP...".SET extra_float_digits = 3...B............E...    .....S....
00:20:13.299482 IP asrockcentos8.38858 > asrockcentos8.postgres: Flags [P.], seq 237:321, ack 386, win 350, options [nop,nop,TS val 2679839826 ecr 2679839826], length 84
E... `@.@..............88r..8......^.......
...R...RP...7.SET application_name = 'PostgreSQL JDBC Driver'...B............E...       .....S....
00:20:13.299537 IP asrockcentos8.38858 > asrockcentos8.postgres: Flags [P.], seq 321:364, ack 456, win 350, options [nop,nop,TS val 2679839826 ecr 2679839826], length 43
E.._ a@.@..............88r..8......^.......
...R...RP.....COMMIT...B............E...        .....S....
00:20:13.299819 IP asrockcentos8.38868 > asrockcentos8.postgres: Flags [S], seq 2641765271, win 43690, options [mss 65495,sackOK,TS val 2679839826 ecr 0,nop,wscale 7], length 0
E..<g@@.@.P............8.v#....................
...R........
00:20:13.299832 IP asrockcentos8.38868 > asrockcentos8.postgres: Flags [.], ack 252672273, win 342, options [nop,nop,TS val 2679839826 ecr 2679839826], length 0
E..4gA@.@.P............8.v#...y....V.......
...R...R
00:20:13.299889 IP asrockcentos8.38868 > asrockcentos8.postgres: Flags [P.], seq 0:8, ack 1, win 342, options [nop,nop,TS val 2679839826 ecr 2679839826], length 8
E..<gB@.@.P............8.v#...y....V.......
...R...R......./
00:20:13.300151 IP asrockcentos8.38868 > asrockcentos8.postgres: Flags [.], ack 2, win 342, options [nop,nop,TS val 2679839827 ecr 2679839827], length 0
E..4gC@.@.P............8.v#...y....V.......
...S...S
00:20:13.300173 IP asrockcentos8.38868 > asrockcentos8.postgres: Flags [P.], seq 8:122, ack 2, win 342, options [nop,nop,TS val 2679839827 ecr 2679839827], length 114
E...gD@.@.O............8.v#...y....V.......
...S...S...r....user.user1.database.postgres.client_encoding.UTF8.DateStyle.ISO.TimeZone.Asia/Tokyo.extra_float_digits.2..
00:20:13.300418 IP asrockcentos8.38868 > asrockcentos8.postgres: Flags [P.], seq 122:132, ack 11, win 342, options [nop,nop,TS val 2679839827 ecr 2679839827], length 10
E..>gE@.@.P............8.v$...y....V.......
...S...Sp...    pass.
00:20:13.301711 IP asrockcentos8.38868 > asrockcentos8.postgres: Flags [P.], seq 132:174, ack 334, win 350, options [nop,nop,TS val 2679839828 ecr 2679839828], length 42
E..^gF@.@.O............8.v$...z^...^.......
...T...TP.....BEGIN...B............E... .....S....
00:20:13.301773 IP asrockcentos8.38868 > asrockcentos8.postgres: Flags [P.], seq 174:237, ack 361, win 350, options [nop,nop,TS val 2679839828 ecr 2679839828], length 63
E..sgG@.@.O............8.v$F..zy...^.......
...T...TP...".SET extra_float_digits = 3...B............E...    .....S....
00:20:13.301840 IP asrockcentos8.38868 > asrockcentos8.postgres: Flags [P.], seq 237:321, ack 386, win 350, options [nop,nop,TS val 2679839828 ecr 2679839828], length 84
E...gH@.@.O............8.v$...z....^.......
...T...TP...7.SET application_name = 'PostgreSQL JDBC Driver'...B............E...       .....S....
00:20:13.301891 IP asrockcentos8.38868 > asrockcentos8.postgres: Flags [P.], seq 321:364, ack 456, win 350, options [nop,nop,TS val 2679839828 ecr 2679839828], length 43
E.._gI@.@.O............8.v$...z....^.......
...T...TP.....COMMIT...B............E...        .....S....
00:20:13.302164 IP asrockcentos8.38870 > asrockcentos8.postgres: Flags [S], seq 3964370611, win 43690, options [mss 65495,sackOK,TS val 2679839829 ecr 0,nop,wscale 7], length 0
E..<..@.@..T...........8.K~....................
...U........
00:20:13.302174 IP asrockcentos8.38870 > asrockcentos8.postgres: Flags [.], ack 1229776681, win 342, options [nop,nop,TS val 2679839829 ecr 2679839829], length 0
E..4..@.@..[...........8.K~.IL.)...V.......
...U...U
00:20:13.302223 IP asrockcentos8.38870 > asrockcentos8.postgres: Flags [P.], seq 0:8, ack 1, win 342, options [nop,nop,TS val 2679839829 ecr 2679839829], length 8
E..<..@.@..R...........8.K~.IL.)...V.......
...U...U......./
00:20:13.302466 IP asrockcentos8.38870 > asrockcentos8.postgres: Flags [.], ack 2, win 342, options [nop,nop,TS val 2679839829 ecr 2679839829], length 0
E..4..@.@..Y...........8.K~.IL.*...V.......
...U...U
00:20:13.302482 IP asrockcentos8.38870 > asrockcentos8.postgres: Flags [P.], seq 8:122, ack 2, win 342, options [nop,nop,TS val 2679839829 ecr 2679839829], length 114
E.....@.@..............8.K~.IL.*...V.......
...U...U...r....user.user1.database.postgres.client_encoding.UTF8.DateStyle.ISO.TimeZone.Asia/Tokyo.extra_float_digits.2..
00:20:13.302727 IP asrockcentos8.38870 > asrockcentos8.postgres: Flags [P.], seq 122:132, ack 11, win 342, options [nop,nop,TS val 2679839829 ecr 2679839829], length 10
E..>..@.@..M...........8.K..IL.3...V.......
...U...Up...    pass.
00:20:13.304037 IP asrockcentos8.38870 > asrockcentos8.postgres: Flags [P.], seq 132:174, ack 334, win 350, options [nop,nop,TS val 2679839831 ecr 2679839830], length 42
E..^..@.@..,...........8.K.8IL.v...^.......
...W...VP.....BEGIN...B............E... .....S....
00:20:13.304101 IP asrockcentos8.38870 > asrockcentos8.postgres: Flags [P.], seq 174:237, ack 361, win 350, options [nop,nop,TS val 2679839831 ecr 2679839831], length 63
E..s..@.@..............8.K.bIL.....^.......
...W...WP...".SET extra_float_digits = 3...B............E...    .....S....
00:20:13.304167 IP asrockcentos8.38870 > asrockcentos8.postgres: Flags [P.], seq 237:321, ack 386, win 350, options [nop,nop,TS val 2679839831 ecr 2679839831], length 84
E.....@.@..............8.K..IL.....^.......
...W...WP...7.SET application_name = 'PostgreSQL JDBC Driver'...B............E...       .....S....
00:20:13.304218 IP asrockcentos8.38870 > asrockcentos8.postgres: Flags [P.], seq 321:364, ack 456, win 350, options [nop,nop,TS val 2679839831 ecr 2679839831], length 43
E.._..@.@..(...........8.K..IL.....^.......
...W...WP.....COMMIT...B............E...        .....S....
00:20:13.304466 IP asrockcentos8.38878 > asrockcentos8.postgres: Flags [S], seq 414079378, win 43690, options [mss 65495,sackOK,TS val 2679839831 ecr 0,nop,wscale 7], length 0
E..<.c@.@..............8..Y....................
...W........
00:20:13.304476 IP asrockcentos8.38878 > asrockcentos8.postgres: Flags [.], ack 3225201132, win 342, options [nop,nop,TS val 2679839831 ecr 2679839831], length 0
E..4.d@.@..............8..Y..<.....V.......
...W...W
00:20:13.304524 IP asrockcentos8.38878 > asrockcentos8.postgres: Flags [P.], seq 0:8, ack 1, win 342, options [nop,nop,TS val 2679839831 ecr 2679839831], length 8
E..<.e@.@..............8..Y..<.....V.......
...W...W......./
00:20:13.304763 IP asrockcentos8.38878 > asrockcentos8.postgres: Flags [.], ack 2, win 342, options [nop,nop,TS val 2679839831 ecr 2679839831], length 0
E..4.f@.@..............8..Y..<.....V.......
...W...W
00:20:13.304779 IP asrockcentos8.38878 > asrockcentos8.postgres: Flags [P.], seq 8:122, ack 2, win 342, options [nop,nop,TS val 2679839831 ecr 2679839831], length 114
E....g@.@..............8..Y..<.....V.......
...W...W...r....user.user1.database.postgres.client_encoding.UTF8.DateStyle.ISO.TimeZone.Asia/Tokyo.extra_float_digits.2..
00:20:13.305027 IP asrockcentos8.38878 > asrockcentos8.postgres: Flags [P.], seq 122:132, ack 11, win 342, options [nop,nop,TS val 2679839832 ecr 2679839832], length 10
E..>.h@.@..............8..Z..<.....V.......
...X...Xp...    pass.
00:20:13.306309 IP asrockcentos8.38878 > asrockcentos8.postgres: Flags [P.], seq 132:174, ack 334, win 350, options [nop,nop,TS val 2679839833 ecr 2679839833], length 42
E..^.i@.@..............8..Z..<.9...^.......
...Y...YP.....BEGIN...B............E... .....S....
00:20:13.306369 IP asrockcentos8.38878 > asrockcentos8.postgres: Flags [P.], seq 174:237, ack 361, win 350, options [nop,nop,TS val 2679839833 ecr 2679839833], length 63
E..s.j@.@..............8..ZA.<.T...^.......
...Y...YP...".SET extra_float_digits = 3...B............E...    .....S....
00:20:13.306440 IP asrockcentos8.38878 > asrockcentos8.postgres: Flags [P.], seq 237:321, ack 386, win 350, options [nop,nop,TS val 2679839833 ecr 2679839833], length 84
E....k@.@..............8..Z..<.m...^.......
...Y...YP...7.SET application_name = 'PostgreSQL JDBC Driver'...B............E...       .....S....
00:20:13.306494 IP asrockcentos8.38878 > asrockcentos8.postgres: Flags [P.], seq 321:364, ack 456, win 350, options [nop,nop,TS val 2679839833 ecr 2679839833], length 43
E.._.l@.@..............8..Z..<.....^.......
...Y...YP.....COMMIT...B............E...        .....S....
00:20:13.306739 IP asrockcentos8.38894 > asrockcentos8.postgres: Flags [S], seq 2198466660, win 43690, options [mss 65495,sackOK,TS val 2679839833 ecr 0,nop,wscale 7], length 0
E..<..@.@..............8.       .d...................
...Y........
00:20:13.306748 IP asrockcentos8.38894 > asrockcentos8.postgres: Flags [.], ack 2499437165, win 342, options [nop,nop,TS val 2679839833 ecr 2679839833], length 0
E..4..@.@..............8.       .e..bm...V.......
...Y...Y
00:20:13.306796 IP asrockcentos8.38894 > asrockcentos8.postgres: Flags [P.], seq 0:8, ack 1, win 342, options [nop,nop,TS val 2679839833 ecr 2679839833], length 8
E..<..@.@..............8.       .e..bm...V.......
...Y...Y......./
00:20:13.307022 IP asrockcentos8.38894 > asrockcentos8.postgres: Flags [.], ack 2, win 342, options [nop,nop,TS val 2679839834 ecr 2679839834], length 0
E..4..@.@..............8.       .m..bn...V.......
...Z...Z
00:20:13.307051 IP asrockcentos8.38894 > asrockcentos8.postgres: Flags [P.], seq 8:122, ack 2, win 342, options [nop,nop,TS val 2679839834 ecr 2679839834], length 114
E.....@.@..............8.       .m..bn...V.......
...Z...Z...r....user.user1.database.postgres.client_encoding.UTF8.DateStyle.ISO.TimeZone.Asia/Tokyo.extra_float_digits.2..
00:20:13.307310 IP asrockcentos8.38894 > asrockcentos8.postgres: Flags [P.], seq 122:132, ack 11, win 342, options [nop,nop,TS val 2679839834 ecr 2679839834], length 10
E..>..@.@..............8.       ....bw...V.......
...Z...Zp...    pass.
00:20:13.308608 IP asrockcentos8.38894 > asrockcentos8.postgres: Flags [P.], seq 132:174, ack 334, win 350, options [nop,nop,TS val 2679839835 ecr 2679839835], length 42
E..^..@.@..t...........8.       ....c....^.......
...[...[P.....BEGIN...B............E... .....S....
00:20:13.308671 IP asrockcentos8.38894 > asrockcentos8.postgres: Flags [P.], seq 174:237, ack 361, win 350, options [nop,nop,TS val 2679839835 ecr 2679839835], length 63
E..s..@.@..^...........8.       ....c....^.......
...[...[P...".SET extra_float_digits = 3...B............E...    .....S....
00:20:13.308737 IP asrockcentos8.38894 > asrockcentos8.postgres: Flags [P.], seq 237:321, ack 386, win 350, options [nop,nop,TS val 2679839835 ecr 2679839835], length 84
E.....@.@..H...........8.       .R..c....^.......
...[...[P...7.SET application_name = 'PostgreSQL JDBC Driver'...B............E...       .....S....
00:20:13.308784 IP asrockcentos8.38894 > asrockcentos8.postgres: Flags [P.], seq 321:364, ack 456, win 350, options [nop,nop,TS val 2679839835 ecr 2679839835], length 43
E.._..@.@..p...........8.       ....d4...^.......
...[...[P.....COMMIT...B............E...        .....S....
00:20:13.309128 IP asrockcentos8.38896 > asrockcentos8.postgres: Flags [S], seq 3224176300, win 43690, options [mss 65495,sackOK,TS val 2679839836 ecr 0,nop,wscale 7], length 0
E..<ND@.@.i............8.-.....................
...\........
00:20:13.309141 IP asrockcentos8.38896 > asrockcentos8.postgres: Flags [.], ack 2271655871, win 342, options [nop,nop,TS val 2679839836 ecr 2679839836], length 0
E..4NE@.@.i............8.-...f.....V.......
...\...\
00:20:13.309203 IP asrockcentos8.38896 > asrockcentos8.postgres: Flags [P.], seq 0:8, ack 1, win 342, options [nop,nop,TS val 2679839836 ecr 2679839836], length 8
E..<NF@.@.i............8.-...f.....V.......
...\...\......./
00:20:13.309423 IP asrockcentos8.38896 > asrockcentos8.postgres: Flags [.], ack 2, win 342, options [nop,nop,TS val 2679839836 ecr 2679839836], length 0
E..4NG@.@.i............8.-...f.....V.......
...\...\
00:20:13.309439 IP asrockcentos8.38896 > asrockcentos8.postgres: Flags [P.], seq 8:122, ack 2, win 342, options [nop,nop,TS val 2679839836 ecr 2679839836], length 114
E...NH@.@.h............8.-...f.....V.......
...\...\...r....user.user1.database.postgres.client_encoding.UTF8.DateStyle.ISO.TimeZone.Asia/Tokyo.extra_float_digits.2..
00:20:13.309681 IP asrockcentos8.38896 > asrockcentos8.postgres: Flags [P.], seq 122:132, ack 11, win 342, options [nop,nop,TS val 2679839836 ecr 2679839836], length 10
E..>NI@.@.i............8.-.'.f.....V.......
...\...\p...    pass.
00:20:13.310997 IP asrockcentos8.38896 > asrockcentos8.postgres: Flags [P.], seq 132:174, ack 334, win 350, options [nop,nop,TS val 2679839838 ecr 2679839837], length 42
E..^NJ@.@.h............8.-.1.f.....^.......
...^...]P.....BEGIN...B............E... .....S....
00:20:13.311058 IP asrockcentos8.38896 > asrockcentos8.postgres: Flags [P.], seq 174:237, ack 361, win 350, options [nop,nop,TS val 2679839838 ecr 2679839838], length 63
E..sNK@.@.h............8.-.[.f.'...^.......
...^...^P...".SET extra_float_digits = 3...B............E...    .....S....
00:20:13.311120 IP asrockcentos8.38896 > asrockcentos8.postgres: Flags [P.], seq 237:321, ack 386, win 350, options [nop,nop,TS val 2679839838 ecr 2679839838], length 84
E...NL@.@.h............8.-...f.@...^.......
...^...^P...7.SET application_name = 'PostgreSQL JDBC Driver'...B............E...       .....S....
00:20:13.311186 IP asrockcentos8.38896 > asrockcentos8.postgres: Flags [P.], seq 321:364, ack 456, win 350, options [nop,nop,TS val 2679839838 ecr 2679839838], length 43
E.._NM@.@.h............8.-...f.....^.......
...^...^P.....COMMIT...B............E...        .....S....
00:20:13.311469 IP asrockcentos8.38904 > asrockcentos8.postgres: Flags [S], seq 4108472626, win 43690, options [mss 65495,sackOK,TS val 2679839838 ecr 0,nop,wscale 7], length 0
E..<..@.@..M...........8..Q2...................
...^........
00:20:13.311481 IP asrockcentos8.38904 > asrockcentos8.postgres: Flags [.], ack 30477329, win 342, options [nop,nop,TS val 2679839838 ecr 2679839838], length 0
E..4..@.@..T...........8..Q3.......V.......
...^...^
00:20:13.311536 IP asrockcentos8.38904 > asrockcentos8.postgres: Flags [P.], seq 0:8, ack 1, win 342, options [nop,nop,TS val 2679839838 ecr 2679839838], length 8
E..<..@.@..K...........8..Q3.......V.......
...^...^......./
00:20:13.311748 IP asrockcentos8.38904 > asrockcentos8.postgres: Flags [.], ack 2, win 342, options [nop,nop,TS val 2679839838 ecr 2679839838], length 0
E..4..@.@..R...........8..Q;.......V.......
...^...^
00:20:13.311762 IP asrockcentos8.38904 > asrockcentos8.postgres: Flags [P.], seq 8:122, ack 2, win 342, options [nop,nop,TS val 2679839838 ecr 2679839838], length 114
E....   @.@..............8..Q;.......V.......
...^...^...r....user.user1.database.postgres.client_encoding.UTF8.DateStyle.ISO.TimeZone.Asia/Tokyo.extra_float_digits.2..
00:20:13.311984 IP asrockcentos8.38904 > asrockcentos8.postgres: Flags [P.], seq 122:132, ack 11, win 342, options [nop,nop,TS val 2679839838 ecr 2679839838], length 10
E..>.
@.@..F...........8..Q........V.......
...^...^p...    pass.
00:20:13.313252 IP asrockcentos8.38904 > asrockcentos8.postgres: Flags [P.], seq 132:174, ack 334, win 350, options [nop,nop,TS val 2679839840 ecr 2679839840], length 42
E..^..@.@..%...........8..Q....^...^.......
...`...`P.....BEGIN...B............E... .....S....
00:20:13.313308 IP asrockcentos8.38904 > asrockcentos8.postgres: Flags [P.], seq 174:237, ack 361, win 350, options [nop,nop,TS val 2679839840 ecr 2679839840], length 63
E..s..@.@..............8..Q....y...^.......
...`...`P...".SET extra_float_digits = 3...B............E...    .....S....
00:20:13.313371 IP asrockcentos8.38904 > asrockcentos8.postgres: Flags [P.], seq 237:321, ack 386, win 350, options [nop,nop,TS val 2679839840 ecr 2679839840], length 84
E.....@.@..............8..R .......^.......
...`...`P...7.SET application_name = 'PostgreSQL JDBC Driver'...B............E...       .....S....
00:20:13.313418 IP asrockcentos8.38904 > asrockcentos8.postgres: Flags [P.], seq 321:364, ack 456, win 350, options [nop,nop,TS val 2679839840 ecr 2679839840], length 43
E.._..@.@..!...........8..Rt.......^.......
...`...`P.....COMMIT...B............E...        .....S....
00:20:13.313683 IP asrockcentos8.38914 > asrockcentos8.postgres: Flags [S], seq 209556870, win 43690, options [mss 65495,sackOK,TS val 2679839840 ecr 0,nop,wscale 7], length 0
E..<..@.@..v...........8.}.....................
...`........
00:20:13.313693 IP asrockcentos8.38914 > asrockcentos8.postgres: Flags [.], ack 276159686, win 342, options [nop,nop,TS val 2679839840 ecr 2679839840], length 0
E..4..@.@..}...........8.}...u.....V.......
...`...`
00:20:13.313746 IP asrockcentos8.38914 > asrockcentos8.postgres: Flags [P.], seq 0:8, ack 1, win 342, options [nop,nop,TS val 2679839840 ecr 2679839840], length 8
E..<..@.@..t...........8.}...u.....V.......
...`...`......./
00:20:13.313971 IP asrockcentos8.38914 > asrockcentos8.postgres: Flags [.], ack 2, win 342, options [nop,nop,TS val 2679839840 ecr 2679839840], length 0
E..4..@.@..{...........8.}...u.....V.......
...`...`
00:20:13.313988 IP asrockcentos8.38914 > asrockcentos8.postgres: Flags [P.], seq 8:122, ack 2, win 342, options [nop,nop,TS val 2679839840 ecr 2679839840], length 114
E.....@.@..............8.}...u.....V.......
...`...`...r....user.user1.database.postgres.client_encoding.UTF8.DateStyle.ISO.TimeZone.Asia/Tokyo.extra_float_digits.2..
00:20:13.314232 IP asrockcentos8.38914 > asrockcentos8.postgres: Flags [P.], seq 122:132, ack 11, win 342, options [nop,nop,TS val 2679839841 ecr 2679839841], length 10
E..>..@.@..o...........8.}...u.....V.......
...a...ap...    pass.
00:20:13.315518 IP asrockcentos8.38914 > asrockcentos8.postgres: Flags [P.], seq 132:174, ack 334, win 350, options [nop,nop,TS val 2679839842 ecr 2679839842], length 42
E..^..@.@..N...........8.}...u.....^.......
...b...bP.....BEGIN...B............E... .....S....
00:20:13.315575 IP asrockcentos8.38914 > asrockcentos8.postgres: Flags [P.], seq 174:237, ack 361, win 350, options [nop,nop,TS val 2679839842 ecr 2679839842], length 63
E..s..@.@..8...........8.}.5.u.....^.......
...b...bP...".SET extra_float_digits = 3...B............E...    .....S....
00:20:13.315638 IP asrockcentos8.38914 > asrockcentos8.postgres: Flags [P.], seq 237:321, ack 386, win 350, options [nop,nop,TS val 2679839842 ecr 2679839842], length 84
E.....@.@.."...........8.}.t.u.G...^.......
...b...bP...7.SET application_name = 'PostgreSQL JDBC Driver'...B............E...       .....S....
00:20:13.315682 IP asrockcentos8.38914 > asrockcentos8.postgres: Flags [P.], seq 321:364, ack 456, win 350, options [nop,nop,TS val 2679839842 ecr 2679839842], length 43
E.._..@.@..J...........8.}...u.....^.......
...b...bP.....COMMIT...B............E...        .....S....
00:20:13.336991 IP asrockcentos8.38844 > asrockcentos8.postgres: Flags [.], ack 484, win 350, options [nop,nop,TS val 2679839864 ecr 2679839823], length 0
E..4..@.@..z...........8.g9..2{....^.......
...x...O
00:20:13.339994 IP asrockcentos8.38858 > asrockcentos8.postgres: Flags [.], ack 484, win 350, options [nop,nop,TS val 2679839867 ecr 2679839826], length 0
E..4 b@.@..............88r..8..0...^.......
...{...R
00:20:13.341989 IP asrockcentos8.38868 > asrockcentos8.postgres: Flags [.], ack 484, win 350, options [nop,nop,TS val 2679839869 ecr 2679839828], length 0
E..4gJ@.@.P............8.v%...z....^.......
...}...T
00:20:13.344989 IP asrockcentos8.38870 > asrockcentos8.postgres: Flags [.], ack 484, win 350, options [nop,nop,TS val 2679839872 ecr 2679839831], length 0
E..4.   @.@..R...........8.K. IL.....^.......
.......W
00:20:13.346989 IP asrockcentos8.38878 > asrockcentos8.postgres: Flags [.], ack 484, win 350, options [nop,nop,TS val 2679839874 ecr 2679839833], length 0
E..4.m@.@..............8..Z..<.....^.......
.......Y
00:20:13.348991 IP asrockcentos8.38894 > asrockcentos8.postgres: Flags [.], ack 484, win 350, options [nop,nop,TS val 2679839876 ecr 2679839835], length 0
E..4..@.@..............8.       ....dP...^.......
.......[
00:20:13.351990 IP asrockcentos8.38896 > asrockcentos8.postgres: Flags [.], ack 484, win 350, options [nop,nop,TS val 2679839879 ecr 2679839838], length 0
E..4NN@.@.i............8.-...f.....^.......
.......^
00:20:13.353989 IP asrockcentos8.38904 > asrockcentos8.postgres: Flags [.], ack 484, win 350, options [nop,nop,TS val 2679839881 ecr 2679839840], length 0
E..4..@.@..K...........8..R........^.......
.......`
00:20:13.355989 IP asrockcentos8.38914 > asrockcentos8.postgres: Flags [.], ack 484, win 350, options [nop,nop,TS val 2679839883 ecr 2679839842], length 0
E..4..@.@..t...........8.}...u.....^.......
.......b





