[dai@asrockcentos8 ~]$ sudo tcpdump -i lo -A dst port 5432
dropped privs to tcpdump
tcpdump: verbose output suppressed, use -v or -vv for full protocol decode
listening on lo, link-type EN10MB (Ethernet), capture size 262144 bytes
23:50:52.760421 IP asrockcentos8.49970 > asrockcentos8.postgres: Flags [S], seq 784122627, win 43690, options [mss 65495,sackOK,TS val 2678079287 ecr 0,nop,wscale 7], length 0
E..<W.@.@._r.........2.8.......................
..?7........
23:50:52.760442 IP asrockcentos8.49970 > asrockcentos8.postgres: Flags [.], ack 374138495, win 342, options [nop,nop,TS val 2678079287 ecr 2678079287], length 0
E..4W.@.@._y.........2.8.....L.....V.......
..?7..?7
23:50:52.761601 IP asrockcentos8.49970 > asrockcentos8.postgres: Flags [P.], seq 0:8, ack 1, win 342, options [nop,nop,TS val 2678079288 ecr 2678079287], length 8
E..<W.@.@._p.........2.8.....L.....V.......
..?8..?7......./
23:50:52.761636 IP asrockcentos8.49970 > asrockcentos8.postgres: Flags [.], ack 2, win 342, options [nop,nop,TS val 2678079288 ecr 2678079288], length 0
E..4W.@.@._w.........2.8.....L.....V.......
..?8..?8
23:50:52.762385 IP asrockcentos8.49970 > asrockcentos8.postgres: Flags [P.], seq 8:125, ack 2, win 342, options [nop,nop,TS val 2678079289 ecr 2678079288], length 117
E...W.@.@._..........2.8.....L.....V.......
..?9..?8...u....user.postgres.database.postgres.client_encoding.UTF8.DateStyle.ISO.TimeZone.Asia/Tokyo.extra_float_digits.2..
23:50:52.765677 IP asrockcentos8.49970 > asrockcentos8.postgres: Flags [P.], seq 125:181, ack 26, win 342, options [nop,nop,TS val 2678079292 ecr 2678079289], length 56
E..lW.@.@._=.........2.8.....L.....V.......
..?<..?9p...7SCRAM-SHA-256....!n,,n=*,r=-/T_l+EE}y_D4d2:~YpsHM5.
23:50:52.783234 IP asrockcentos8.49970 > asrockcentos8.postgres: Flags [P.], seq 181:290, ack 119, win 342, options [nop,nop,TS val 2678079310 ecr 2678079292], length 109
E...W.@.@._..........2.8.....L.....V.......
..?N..?<p...lc=biws,r=-/T_l+EE}y_D4d2:~YpsHM5.9ZcF7sQDWGjQhO+ldJ2A8QNf,p=xpB6JHg/jbdSHCAu8FElHTIf06KWY8RmC6J175axWhs=
23:50:52.791187 IP asrockcentos8.49970 > asrockcentos8.postgres: Flags [P.], seq 290:332, ack 499, win 350, options [nop,nop,TS val 2678079318 ecr 2678079311], length 42
E..^W.@.@._I.........2.8...&.L.q...^.......
..?V..?OP.....BEGIN...B............E... .....S....
23:50:52.791326 IP asrockcentos8.49970 > asrockcentos8.postgres: Flags [P.], seq 332:395, ack 526, win 350, options [nop,nop,TS val 2678079318 ecr 2678079318], length 63
E..sW.@.@._3.........2.8...P.L.....^.......
..?V..?VP...".SET extra_float_digits = 3...B............E...    .....S....
23:50:52.791458 IP asrockcentos8.49970 > asrockcentos8.postgres: Flags [P.], seq 395:479, ack 551, win 350, options [nop,nop,TS val 2678079318 ecr 2678079318], length 84
E...W.@.@._..........2.8.....L.....^.......
..?V..?VP...7.SET application_name = 'PostgreSQL JDBC Driver'...B............E...       .....S....
23:50:52.791527 IP asrockcentos8.49970 > asrockcentos8.postgres: Flags [P.], seq 479:522, ack 621, win 350, options [nop,nop,TS val 2678079318 ecr 2678079318], length 43
E.._W.@.@._E.........2.8.....L.....^.......
..?V..?VP.....COMMIT...B............E...        .....S....
23:50:52.794812 IP asrockcentos8.49970 > asrockcentos8.postgres: Flags [P.], seq 522:566, ack 649, win 350, options [nop,nop,TS val 2678079321 ecr 2678079318], length 44
E..`W.@.@._C.........2.8.....L.....^.......
..?Y..?VP........B............D....P.E...       .....S....
23:50:52.794939 IP asrockcentos8.49970 > asrockcentos8.postgres: Flags [P.], seq 566:642, ack 675, win 350, options [nop,nop,TS val 2678079321 ecr 2678079321], length 76
E...W.@.@._".........2.8...:.L.!...^.......
..?Y..?YP...(.SHOW TRANSACTION ISOLATION LEVEL...B............D....P.E...       .....S....
23:50:52.799554 IP asrockcentos8.49970 > asrockcentos8.postgres: Flags [P.], seq 642:730, ack 773, win 350, options [nop,nop,TS val 2678079326 ecr 2678079321], length 88
E...W.@.@._..........2.8.....L.....^.......
..?^..?YP...,.select * from item where id = $1.......B................12..D....P.E...   .....S....
23:50:52.840998 IP asrockcentos8.49970 > asrockcentos8.postgres: Flags [.], ack 873, win 350, options [nop,nop,TS val 2678079368 ecr 2678079327], length 0
E..4W.@.@._l.........2.8.....L.....^.......
..?...?_
23:50:52.897834 IP asrockcentos8.49982 > asrockcentos8.postgres: Flags [S], seq 756453361, win 43690, options [mss 65495,sackOK,TS val 2678079424 ecr 0,nop,wscale 7], length 0
E..<..@.@..7.........>.8-......................
..?.........
23:50:52.897852 IP asrockcentos8.49982 > asrockcentos8.postgres: Flags [.], ack 2925639429, win 342, options [nop,nop,TS val 2678079424 ecr 2678079424], length 0
E..4..@.@..>.........>.8-....a.....V.......
..?...?.
23:50:52.897956 IP asrockcentos8.49982 > asrockcentos8.postgres: Flags [P.], seq 0:8, ack 1, win 342, options [nop,nop,TS val 2678079424 ecr 2678079424], length 8
E..<..@.@..5.........>.8-....a.....V.......
..?...?......../
23:50:52.898224 IP asrockcentos8.49982 > asrockcentos8.postgres: Flags [.], ack 2, win 342, options [nop,nop,TS val 2678079425 ecr 2678079425], length 0
E..4..@.@..<.........>.8-....a.....V.......
..?...?.
23:50:52.898249 IP asrockcentos8.49982 > asrockcentos8.postgres: Flags [P.], seq 8:125, ack 2, win 342, options [nop,nop,TS val 2678079425 ecr 2678079425], length 117
E.... @.@............>.8-....a.....V.......
..?...?....u....user.postgres.database.postgres.client_encoding.UTF8.DateStyle.ISO.TimeZone.Asia/Tokyo.extra_float_digits.2..
23:50:52.898710 IP asrockcentos8.49982 > asrockcentos8.postgres: Flags [P.], seq 125:181, ack 26, win 342, options [nop,nop,TS val 2678079425 ecr 2678079425], length 56
E..l.!@.@............>.8-..o.a.....V.......
..?...?.p...7SCRAM-SHA-256....!n,,n=*,r=4V"lq5h=k~`F~7@v=:CwMKB*
23:50:52.906446 IP asrockcentos8.49982 > asrockcentos8.postgres: Flags [P.], seq 181:290, ack 119, win 342, options [nop,nop,TS val 2678079433 ecr 2678079425], length 109
E...."@.@............>.8-....a.{...V.......
..?...?.p...lc=biws,r=4V"lq5h=k~`F~7@v=:CwMKB*VioMK7r0ouZ1K9ZJqf+BMdlZ,p=80XMkmfBPUy/p/CZqLtNDFHKvXc+hh8v1re0XCxgTQM=
23:50:52.907103 IP asrockcentos8.49982 > asrockcentos8.postgres: Flags [P.], seq 290:332, ack 499, win 350, options [nop,nop,TS val 2678079434 ecr 2678079433], length 42
E..^.#@.@............>.8-....a.....^.......
..?...?.P.....BEGIN...B............E... .....S....
23:50:52.907181 IP asrockcentos8.49982 > asrockcentos8.postgres: Flags [P.], seq 332:395, ack 526, win 350, options [nop,nop,TS val 2678079434 ecr 2678079434], length 63
E..s.$@.@............>.8-..>.a.....^.......
..?...?.P...".SET extra_float_digits = 3...B............E...    .....S....
23:50:52.907265 IP asrockcentos8.49982 > asrockcentos8.postgres: Flags [P.], seq 395:479, ack 551, win 350, options [nop,nop,TS val 2678079434 ecr 2678079434], length 84
E....%@.@............>.8-..}.a.+...^.......
..?...?.P...7.SET application_name = 'PostgreSQL JDBC Driver'...B............E...       .....S....
23:50:52.907328 IP asrockcentos8.49982 > asrockcentos8.postgres: Flags [P.], seq 479:522, ack 621, win 350, options [nop,nop,TS val 2678079434 ecr 2678079434], length 43
E.._.&@.@..
.........>.8-....a.q...^.......
..?...?.P.....COMMIT...B............E...        .....S....
23:50:52.907709 IP asrockcentos8.49998 > asrockcentos8.postgres: Flags [S], seq 3362349647, win 43690, options [mss 65495,sackOK,TS val 2678079434 ecr 0,nop,wscale 7], length 0
E..<w.@.@.@K.........N.8.ibO...................
..?.........
23:50:52.907721 IP asrockcentos8.49998 > asrockcentos8.postgres: Flags [.], ack 2291841976, win 342, options [nop,nop,TS val 2678079434 ecr 2678079434], length 0
E..4w   @.@.@R.........N.8.ibP.......V.......
..?...?.
23:50:52.907799 IP asrockcentos8.49998 > asrockcentos8.postgres: Flags [P.], seq 0:8, ack 1, win 342, options [nop,nop,TS val 2678079434 ecr 2678079434], length 8
E..<w
@.@.@I.........N.8.ibP.......V.......
..?...?......../
23:50:52.908034 IP asrockcentos8.49998 > asrockcentos8.postgres: Flags [.], ack 2, win 342, options [nop,nop,TS val 2678079435 ecr 2678079435], length 0
E..4w.@.@.@P.........N.8.ibX.......V.......
..?...?.
23:50:52.908056 IP asrockcentos8.49998 > asrockcentos8.postgres: Flags [P.], seq 8:125, ack 2, win 342, options [nop,nop,TS val 2678079435 ecr 2678079435], length 117
E...w.@.@.?..........N.8.ibX.......V.......
..?...?....u....user.postgres.database.postgres.client_encoding.UTF8.DateStyle.ISO.TimeZone.Asia/Tokyo.extra_float_digits.2..
23:50:52.908442 IP asrockcentos8.49998 > asrockcentos8.postgres: Flags [P.], seq 125:181, ack 26, win 342, options [nop,nop,TS val 2678079435 ecr 2678079435], length 56
E..lw.@.@.@..........N.8.ib........V.......
..?...?.p...7SCRAM-SHA-256....!n,,n=*,r=Y}(7VwGyIB(iHwZ>esfAmzp%
23:50:52.916089 IP asrockcentos8.49998 > asrockcentos8.postgres: Flags [P.], seq 181:290, ack 119, win 342, options [nop,nop,TS val 2678079443 ecr 2678079435], length 109
E...w.@.@.?..........N.8.ic........V.......
..?...?.p...lc=biws,r=Y}(7VwGyIB(iHwZ>esfAmzp%dxD0uGAK3I8F6EzKh94V8VVs,p=nLr1/AEXHArRaLdhGKfr40ZVTLNfZFwOOT8uX2+7rcU=
23:50:52.916594 IP asrockcentos8.49998 > asrockcentos8.postgres: Flags [P.], seq 290:332, ack 499, win 350, options [nop,nop,TS val 2678079443 ecr 2678079443], length 42
E..^w.@.@.@".........N.8.icr.......^.......
..?...?.P.....BEGIN...B............E... .....S....
23:50:52.916662 IP asrockcentos8.49998 > asrockcentos8.postgres: Flags [P.], seq 332:395, ack 526, win 350, options [nop,nop,TS val 2678079443 ecr 2678079443], length 63
E..sw.@.@.@..........N.8.ic........^.......
..?...?.P...".SET extra_float_digits = 3...B............E...    .....S....
23:50:52.916736 IP asrockcentos8.49998 > asrockcentos8.postgres: Flags [P.], seq 395:479, ack 551, win 350, options [nop,nop,TS val 2678079443 ecr 2678079443], length 84
E...w.@.@.?..........N.8.ic........^.......
..?...?.P...7.SET application_name = 'PostgreSQL JDBC Driver'...B............E...       .....S....
23:50:52.916790 IP asrockcentos8.49998 > asrockcentos8.postgres: Flags [P.], seq 479:522, ack 621, win 350, options [nop,nop,TS val 2678079443 ecr 2678079443], length 43
E.._w.@.@.@..........N.8.id/...$...^.......
..?...?.P.....COMMIT...B............E...        .....S....
23:50:52.917100 IP asrockcentos8.50010 > asrockcentos8.postgres: Flags [S], seq 679930787, win 43690, options [mss 65495,sackOK,TS val 2678079444 ecr 0,nop,wscale 7], length 0
E..<
.@.@............Z.8(......................
..?.........
23:50:52.917109 IP asrockcentos8.50010 > asrockcentos8.postgres: Flags [.], ack 919955321, win 342, options [nop,nop,TS val 2678079444 ecr 2678079444], length 0
E..4
.@.@............Z.8(...6.gy...V.......
..?...?.
23:50:52.917170 IP asrockcentos8.50010 > asrockcentos8.postgres: Flags [P.], seq 0:8, ack 1, win 342, options [nop,nop,TS val 2678079444 ecr 2678079444], length 8
E..<
.@.@............Z.8(...6.gy...V.......
..?...?......../
23:50:52.917428 IP asrockcentos8.50010 > asrockcentos8.postgres: Flags [.], ack 2, win 342, options [nop,nop,TS val 2678079444 ecr 2678079444], length 0
E..4
.@.@............Z.8(...6.gz...V.......
..?...?.
23:50:52.917450 IP asrockcentos8.50010 > asrockcentos8.postgres: Flags [P.], seq 8:125, ack 2, win 342, options [nop,nop,TS val 2678079444 ecr 2678079444], length 117
E...
.@.@..B.........Z.8(...6.gz...V.......
..?...?....u....user.postgres.database.postgres.client_encoding.UTF8.DateStyle.ISO.TimeZone.Asia/Tokyo.extra_float_digits.2..
23:50:52.917823 IP asrockcentos8.50010 > asrockcentos8.postgres: Flags [P.], seq 125:181, ack 26, win 342, options [nop,nop,TS val 2678079444 ecr 2678079444], length 56
E..l
.@.@..~.........Z.8(..!6.g....V.......
..?...?.p...7SCRAM-SHA-256....!n,,n=*,r=7#KC!3}d`'fyxmQM[2?^2f$K
23:50:52.925550 IP asrockcentos8.50010 > asrockcentos8.postgres: Flags [P.], seq 181:290, ack 119, win 342, options [nop,nop,TS val 2678079452 ecr 2678079444], length 109
E...
.@.@..H.........Z.8(..Y6.g....V.......
..?...?.p...lc=biws,r=7#KC!3}d`'fyxmQM[2?^2f$K5bkzjr5P+HZD1fb3ezEnMf+d,p=Ed9vb6ZXvCxkavdahO1OmkukzIDUdRXX4jtwN/QRiC4=
23:50:52.926048 IP asrockcentos8.50010 > asrockcentos8.postgres: Flags [P.], seq 290:332, ack 499, win 350, options [nop,nop,TS val 2678079453 ecr 2678079452], length 42
E..^
.@.@............Z.8(...6.ik...^.......
..?...?.P.....BEGIN...B............E... .....S....
23:50:52.926119 IP asrockcentos8.50010 > asrockcentos8.postgres: Flags [P.], seq 332:395, ack 526, win 350, options [nop,nop,TS val 2678079453 ecr 2678079453], length 63
E..s
.@.@..t.........Z.8(...6.i....^.......
..?...?.P...".SET extra_float_digits = 3...B............E...    .....S....
23:50:52.926189 IP asrockcentos8.50010 > asrockcentos8.postgres: Flags [P.], seq 395:479, ack 551, win 350, options [nop,nop,TS val 2678079453 ecr 2678079453], length 84
E...
.@.@..^.........Z.8(../6.i....^.......
..?...?.P...7.SET application_name = 'PostgreSQL JDBC Driver'...B............E...       .....S....
23:50:52.926246 IP asrockcentos8.50010 > asrockcentos8.postgres: Flags [P.], seq 479:522, ack 621, win 350, options [nop,nop,TS val 2678079453 ecr 2678079453], length 43
E.._
.@.@............Z.8(...6.i....^.......
..?...?.P.....COMMIT...B............E...        .....S....
23:50:52.926578 IP asrockcentos8.50012 > asrockcentos8.postgres: Flags [S], seq 3578849808, win 43690, options [mss 65495,sackOK,TS val 2678079453 ecr 0,nop,wscale 7], length 0
E..<..@.@............\.8.P.....................
..?.........
23:50:52.926592 IP asrockcentos8.50012 > asrockcentos8.postgres: Flags [.], ack 962354636, win 342, options [nop,nop,TS val 2678079453 ecr 2678079453], length 0
E..4..@.@............\.8.P..9\]....V.......
..?...?.
23:50:52.926650 IP asrockcentos8.50012 > asrockcentos8.postgres: Flags [P.], seq 0:8, ack 1, win 342, options [nop,nop,TS val 2678079453 ecr 2678079453], length 8
E..<..@.@............\.8.P..9\]....V.......
..?...?......../
23:50:52.926874 IP asrockcentos8.50012 > asrockcentos8.postgres: Flags [.], ack 2, win 342, options [nop,nop,TS val 2678079453 ecr 2678079453], length 0
E..4..@.@............\.8.P..9\]....V.......
..?...?.
23:50:52.926909 IP asrockcentos8.50012 > asrockcentos8.postgres: Flags [P.], seq 8:125, ack 2, win 342, options [nop,nop,TS val 2678079453 ecr 2678079453], length 117
E.....@.@..$.........\.8.P..9\]....V.......
..?...?....u....user.postgres.database.postgres.client_encoding.UTF8.DateStyle.ISO.TimeZone.Asia/Tokyo.extra_float_digits.2..
23:50:52.927295 IP asrockcentos8.50012 > asrockcentos8.postgres: Flags [P.], seq 125:181, ack 26, win 342, options [nop,nop,TS val 2678079454 ecr 2678079454], length 56
E..l..@.@..`.........\.8.P..9\]....V.......
..?...?.p...7SCRAM-SHA-256....!n,,n=*,r=:N)0P]udZWwJ]!5t<ssg3%#-
23:50:52.934896 IP asrockcentos8.50012 > asrockcentos8.postgres: Flags [P.], seq 181:290, ack 119, win 342, options [nop,nop,TS val 2678079461 ecr 2678079454], length 109
E.....@.@..*.........\.8.P..9\^B...V.......
..?...?.p...lc=biws,r=:N)0P]udZWwJ]!5t<ssg3%#-GTAIvwOcjbc+lRTk/iNzeyvG,p=sJElNVn45iHO9yoGv9CGEgYknZMwYc9bNIfp+ZQ+UQA=
23:50:52.935385 IP asrockcentos8.50012 > asrockcentos8.postgres: Flags [P.], seq 290:332, ack 499, win 350, options [nop,nop,TS val 2678079462 ecr 2678079462], length 42
E..^..@.@..l.........\.8.P.39\_....^.......
..?...?.P.....BEGIN...B............E... .....S....
23:50:52.935455 IP asrockcentos8.50012 > asrockcentos8.postgres: Flags [P.], seq 332:395, ack 526, win 350, options [nop,nop,TS val 2678079462 ecr 2678079462], length 63
E..s..@.@..V.........\.8.P.]9\_....^.......
..?...?.P...".SET extra_float_digits = 3...B............E...    .....S....
23:50:52.935528 IP asrockcentos8.50012 > asrockcentos8.postgres: Flags [P.], seq 395:479, ack 551, win 350, options [nop,nop,TS val 2678079462 ecr 2678079462], length 84
E.....@.@..@.........\.8.P..9\_....^.......
..?...?.P...7.SET application_name = 'PostgreSQL JDBC Driver'...B............E...       .....S....
23:50:52.935578 IP asrockcentos8.50012 > asrockcentos8.postgres: Flags [P.], seq 479:522, ack 621, win 350, options [nop,nop,TS val 2678079462 ecr 2678079462], length 43
E.._..@.@..h.........\.8.P..9\`8...^.......
..?...?.P.....COMMIT...B............E...        .....S....
23:50:52.935861 IP asrockcentos8.50020 > asrockcentos8.postgres: Flags [S], seq 3454752761, win 43690, options [mss 65495,sackOK,TS val 2678079462 ecr 0,nop,wscale 7], length 0
E..<..@.@..L.........d.8..W....................
..?.........
23:50:52.935873 IP asrockcentos8.50020 > asrockcentos8.postgres: Flags [.], ack 4091828644, win 342, options [nop,nop,TS val 2678079462 ecr 2678079462], length 0
E..4..@.@..S.........d.8..W...Y....V.......
..?...?.
23:50:52.935931 IP asrockcentos8.50020 > asrockcentos8.postgres: Flags [P.], seq 0:8, ack 1, win 342, options [nop,nop,TS val 2678079462 ecr 2678079462], length 8
E..<..@.@..J.........d.8..W...Y....V.......
..?...?......../
23:50:52.936152 IP asrockcentos8.50020 > asrockcentos8.postgres: Flags [.], ack 2, win 342, options [nop,nop,TS val 2678079463 ecr 2678079463], length 0
E..4.   @.@..Q.........d.8..X...Y....V.......
..?...?.
23:50:52.936169 IP asrockcentos8.50020 > asrockcentos8.postgres: Flags [P.], seq 8:125, ack 2, win 342, options [nop,nop,TS val 2678079463 ecr 2678079463], length 117
E....
@.@............d.8..X...Y....V.......
..?...?....u....user.postgres.database.postgres.client_encoding.UTF8.DateStyle.ISO.TimeZone.Asia/Tokyo.extra_float_digits.2..
23:50:52.936523 IP asrockcentos8.50020 > asrockcentos8.postgres: Flags [P.], seq 125:181, ack 26, win 342, options [nop,nop,TS val 2678079463 ecr 2678079463], length 56
E..l..@.@............d.8..Xw..Y....V.......
..?...?.p...7SCRAM-SHA-256....!n,,n=*,r=$G!!v:WYOJV~CFKr%msK\JF-
23:50:52.944072 IP asrockcentos8.50020 > asrockcentos8.postgres: Flags [P.], seq 181:290, ack 119, win 342, options [nop,nop,TS val 2678079471 ecr 2678079463], length 109
E.....@.@............d.8..X...Z....V.......
..?...?.p...lc=biws,r=$G!!v:WYOJV~CFKr%msK\JF-OL6ELXC+FeLelutVyD9k/FQV,p=8Y1rWa3QCNQGeZmPK/Q4iiupzoUmHr08z4ylDe4XZ+o=
23:50:52.944555 IP asrockcentos8.50020 > asrockcentos8.postgres: Flags [P.], seq 290:332, ack 499, win 350, options [nop,nop,TS val 2678079471 ecr 2678079471], length 42
E..^..@.@..#.........d.8..Y...[....^.......
..?...?.P.....BEGIN...B............E... .....S....
23:50:52.944620 IP asrockcentos8.50020 > asrockcentos8.postgres: Flags [P.], seq 332:395, ack 526, win 350, options [nop,nop,TS val 2678079471 ecr 2678079471], length 63
E..s..@.@............d.8..YF..[....^.......
..?...?.P...".SET extra_float_digits = 3...B............E...    .....S....
23:50:52.944690 IP asrockcentos8.50020 > asrockcentos8.postgres: Flags [P.], seq 395:479, ack 551, win 350, options [nop,nop,TS val 2678079471 ecr 2678079471], length 84
E.....@.@............d.8..Y...[....^.......
..?...?.P...7.SET application_name = 'PostgreSQL JDBC Driver'...B............E...       .....S....
23:50:52.944738 IP asrockcentos8.50020 > asrockcentos8.postgres: Flags [P.], seq 479:522, ack 621, win 350, options [nop,nop,TS val 2678079471 ecr 2678079471], length 43
E.._..@.@............d.8..Y...\....^.......
..?...?.P.....COMMIT...B............E...        .....S....
23:50:52.945000 IP asrockcentos8.50036 > asrockcentos8.postgres: Flags [S], seq 3665610691, win 43690, options [mss 65495,sackOK,TS val 2678079472 ecr 0,nop,wscale 7], length 0
E..<.&@.@..-.........t.8.|.....................
..?.........
23:50:52.945011 IP asrockcentos8.50036 > asrockcentos8.postgres: Flags [.], ack 3912994046, win 342, options [nop,nop,TS val 2678079472 ecr 2678079472], length 0
E..4.'@.@..4.........t.8.|...;.....V.......
..?...?.
23:50:52.945063 IP asrockcentos8.50036 > asrockcentos8.postgres: Flags [P.], seq 0:8, ack 1, win 342, options [nop,nop,TS val 2678079472 ecr 2678079472], length 8
E..<.(@.@..+.........t.8.|...;.....V.......
..?...?......../
23:50:52.945314 IP asrockcentos8.50036 > asrockcentos8.postgres: Flags [.], ack 2, win 342, options [nop,nop,TS val 2678079472 ecr 2678079472], length 0
E..4.)@.@..2.........t.8.|...;.....V.......
..?...?.
23:50:52.945330 IP asrockcentos8.50036 > asrockcentos8.postgres: Flags [P.], seq 8:125, ack 2, win 342, options [nop,nop,TS val 2678079472 ecr 2678079472], length 117
E....*@.@............t.8.|...;.....V.......
..?...?....u....user.postgres.database.postgres.client_encoding.UTF8.DateStyle.ISO.TimeZone.Asia/Tokyo.extra_float_digits.2..
23:50:52.945690 IP asrockcentos8.50036 > asrockcentos8.postgres: Flags [P.], seq 125:181, ack 26, win 342, options [nop,nop,TS val 2678079472 ecr 2678079472], length 56
E..l.+@.@............t.8.|.A.;.....V.......
..?...?.p...7SCRAM-SHA-256....!n,,n=*,r=!&Wu\OH?mh.1V-v*+3hwRi;(
23:50:52.947992 IP asrockcentos8.49982 > asrockcentos8.postgres: Flags [.], ack 649, win 350, options [nop,nop,TS val 2678079475 ecr 2678079434], length 0
E..4.'@.@..4.........>.8-....a.....^.......
..?...?.
23:50:52.953303 IP asrockcentos8.50036 > asrockcentos8.postgres: Flags [P.], seq 181:290, ack 119, win 342, options [nop,nop,TS val 2678079480 ecr 2678079472], length 109
E....,@.@............t.8.|.y.;.t...V.......
..?...?.p...lc=biws,r=!&Wu\OH?mh.1V-v*+3hwRi;(uCRLYG5w7ZT3wCS4FTKf/rbZ,p=UFp5NJnD3eVIBRe7VYb3vYOB1GHAqI/784vG4Qsrssw=
23:50:52.953774 IP asrockcentos8.50036 > asrockcentos8.postgres: Flags [P.], seq 290:332, ack 499, win 350, options [nop,nop,TS val 2678079480 ecr 2678079480], length 42
E..^.-@.@............t.8.|...;.....^.......
..?...?.P.....BEGIN...B............E... .....S....
23:50:52.953834 IP asrockcentos8.50036 > asrockcentos8.postgres: Flags [P.], seq 332:395, ack 526, win 350, options [nop,nop,TS val 2678079480 ecr 2678079480], length 63
E..s..@.@............t.8.|...;.....^.......
..?...?.P...".SET extra_float_digits = 3...B............E...    .....S....
23:50:52.953898 IP asrockcentos8.50036 > asrockcentos8.postgres: Flags [P.], seq 395:479, ack 551, win 350, options [nop,nop,TS val 2678079480 ecr 2678079480], length 84
E..../@.@............t.8.|.O.;.$...^.......
..?...?.P...7.SET application_name = 'PostgreSQL JDBC Driver'...B............E...       .....S....
23:50:52.953944 IP asrockcentos8.50036 > asrockcentos8.postgres: Flags [P.], seq 479:522, ack 621, win 350, options [nop,nop,TS val 2678079480 ecr 2678079480], length 43
E.._.0@.@............t.8.|...;.j...^.......
..?...?.P.....COMMIT...B............E...        .....S....
23:50:52.954202 IP asrockcentos8.50042 > asrockcentos8.postgres: Flags [S], seq 1397609813, win 43690, options [mss 65495,sackOK,TS val 2678079481 ecr 0,nop,wscale 7], length 0
E..<..@.@............z.8SM.U...................
..?.........
23:50:52.954212 IP asrockcentos8.50042 > asrockcentos8.postgres: Flags [.], ack 678665169, win 342, options [nop,nop,TS val 2678079481 ecr 2678079481], length 0
E..4..@.@............z.8SM.V(s.....V.......
..?...?.
23:50:52.954265 IP asrockcentos8.50042 > asrockcentos8.postgres: Flags [P.], seq 0:8, ack 1, win 342, options [nop,nop,TS val 2678079481 ecr 2678079481], length 8
E..<..@.@............z.8SM.V(s.....V.......
..?...?......../
23:50:52.954498 IP asrockcentos8.50042 > asrockcentos8.postgres: Flags [.], ack 2, win 342, options [nop,nop,TS val 2678079481 ecr 2678079481], length 0
E..4..@.@............z.8SM.^(s.....V.......
..?...?.
23:50:52.954513 IP asrockcentos8.50042 > asrockcentos8.postgres: Flags [P.], seq 8:125, ack 2, win 342, options [nop,nop,TS val 2678079481 ecr 2678079481], length 117
E.....@.@..X.........z.8SM.^(s.....V.......
..?...?....u....user.postgres.database.postgres.client_encoding.UTF8.DateStyle.ISO.TimeZone.Asia/Tokyo.extra_float_digits.2..
23:50:52.954854 IP asrockcentos8.50042 > asrockcentos8.postgres: Flags [P.], seq 125:181, ack 26, win 342, options [nop,nop,TS val 2678079481 ecr 2678079481], length 56
E..l..@.@............z.8SM..(s.....V.......
..?...?.p...7SCRAM-SHA-256....!n,,n=*,r=]ZMF+QO*2!UKVo:-B5)A9KlK
23:50:52.956989 IP asrockcentos8.49998 > asrockcentos8.postgres: Flags [.], ack 649, win 350, options [nop,nop,TS val 2678079484 ecr 2678079443], length 0
E..4w.@.@.@H.........N.8.idZ...@...^.......
..?...?.
23:50:52.962444 IP asrockcentos8.50042 > asrockcentos8.postgres: Flags [P.], seq 181:290, ack 119, win 342, options [nop,nop,TS val 2678079489 ecr 2678079481], length 109
E.....@.@..^.........z.8SM..(s.G...V.......
..@...?.p...lc=biws,r=]ZMF+QO*2!UKVo:-B5)A9KlKSdM96j3Vya6p8Uhfnd2x73ek,p=Ew4KVhtAEnd3GHEQhBZ99LhKWLGJyOnCkcTl22OR6jM=
23:50:52.962903 IP asrockcentos8.50042 > asrockcentos8.postgres: Flags [P.], seq 290:332, ack 499, win 350, options [nop,nop,TS val 2678079489 ecr 2678079489], length 42
E..^..@.@............z.8SM.x(s.....^.......
..@...@.P.....BEGIN...B............E... .....S....
23:50:52.962961 IP asrockcentos8.50042 > asrockcentos8.postgres: Flags [P.], seq 332:395, ack 526, win 350, options [nop,nop,TS val 2678079489 ecr 2678079489], length 63
E..s..@.@............z.8SM..(s.....^.......
..@...@.P...".SET extra_float_digits = 3...B............E...    .....S....
23:50:52.963029 IP asrockcentos8.50042 > asrockcentos8.postgres: Flags [P.], seq 395:479, ack 551, win 350, options [nop,nop,TS val 2678079490 ecr 2678079490], length 84
E.....@.@..t.........z.8SM..(s.....^.......
..@...@.P...7.SET application_name = 'PostgreSQL JDBC Driver'...B............E...       .....S....
23:50:52.963073 IP asrockcentos8.50042 > asrockcentos8.postgres: Flags [P.], seq 479:522, ack 621, win 350, options [nop,nop,TS val 2678079490 ecr 2678079490], length 43
E.._..@.@............z.8SM.5(s.=...^.......
..@...@.P.....COMMIT...B............E...        .....S....
23:50:52.963345 IP asrockcentos8.50058 > asrockcentos8.postgres: Flags [S], seq 353047604, win 43690, options [mss 65495,sackOK,TS val 2678079490 ecr 0,nop,wscale 7], length 0
E..<,.@.@..............8...4...................
..@.........
23:50:52.963357 IP asrockcentos8.50058 > asrockcentos8.postgres: Flags [.], ack 3993331964, win 342, options [nop,nop,TS val 2678079490 ecr 2678079490], length 0
E..4,.@.@..............8...5..h....V.......
..@...@.
23:50:52.963409 IP asrockcentos8.50058 > asrockcentos8.postgres: Flags [P.], seq 0:8, ack 1, win 342, options [nop,nop,TS val 2678079490 ecr 2678079490], length 8
E..<,.@.@..............8...5..h....V.......
..@...@......../
23:50:52.963664 IP asrockcentos8.50058 > asrockcentos8.postgres: Flags [.], ack 2, win 342, options [nop,nop,TS val 2678079490 ecr 2678079490], length 0
E..4,.@.@..............8...=..h....V.......
..@...@.
23:50:52.963680 IP asrockcentos8.50058 > asrockcentos8.postgres: Flags [P.], seq 8:125, ack 2, win 342, options [nop,nop,TS val 2678079490 ecr 2678079490], length 117
E...,.@.@..M...........8...=..h....V.......
..@...@....u....user.postgres.database.postgres.client_encoding.UTF8.DateStyle.ISO.TimeZone.Asia/Tokyo.extra_float_digits.2..
23:50:52.964052 IP asrockcentos8.50058 > asrockcentos8.postgres: Flags [P.], seq 125:181, ack 26, win 342, options [nop,nop,TS val 2678079491 ecr 2678079490], length 56
E..l,.@.@..............8......i....V.......
..@...@.p...7SCRAM-SHA-256....!n,,n=*,r=f*9jKb~.HQ!'Y/nbRHZ!w=$9
23:50:52.966989 IP asrockcentos8.50010 > asrockcentos8.postgres: Flags [.], ack 649, win 350, options [nop,nop,TS val 2678079494 ecr 2678079453], length 0
E..4
.@.@............Z.8(...6.j....^.......
..@...?.
23:50:52.971649 IP asrockcentos8.50058 > asrockcentos8.postgres: Flags [P.], seq 181:290, ack 119, win 342, options [nop,nop,TS val 2678079498 ecr 2678079491], length 109
E...,.@.@..S...........8......ir...V.......
..@
..@.p...lc=biws,r=f*9jKb~.HQ!'Y/nbRHZ!w=$9gz5NmFOi5Jk67teB9JomrQim,p=zuh4RiYWjkaSNIMMrW9QYqiR5sM7R2BdVo4NGnhW+Ys=
23:50:52.972117 IP asrockcentos8.50058 > asrockcentos8.postgres: Flags [P.], seq 290:332, ack 499, win 350, options [nop,nop,TS val 2678079499 ecr 2678079498], length 42
E..^,.@.@..............8...W..j....^.......
..@...@
P.....BEGIN...B............E... .....S....
23:50:52.972176 IP asrockcentos8.50058 > asrockcentos8.postgres: Flags [P.], seq 332:395, ack 526, win 350, options [nop,nop,TS val 2678079499 ecr 2678079499], length 63
E..s,.@.@..............8......k ...^.......
..@...@.P...".SET extra_float_digits = 3...B............E...    .....S....
23:50:52.972246 IP asrockcentos8.50058 > asrockcentos8.postgres: Flags [P.], seq 395:479, ack 551, win 350, options [nop,nop,TS val 2678079499 ecr 2678079499], length 84
E...,.@.@..i...........8......k"...^.......
..@...@.P...7.SET application_name = 'PostgreSQL JDBC Driver'...B............E...       .....S....
23:50:52.972287 IP asrockcentos8.50058 > asrockcentos8.postgres: Flags [P.], seq 479:522, ack 621, win 350, options [nop,nop,TS val 2678079499 ecr 2678079499], length 43
E.._,.@.@..............8......kh...^.......
..@...@.P.....COMMIT...B............E...        .....S....
23:50:52.972544 IP asrockcentos8.50066 > asrockcentos8.postgres: Flags [S], seq 1734313502, win 43690, options [mss 65495,sackOK,TS val 2678079499 ecr 0,nop,wscale 7], length 0
E..<.n@.@..............8g_.....................
..@.........
23:50:52.972554 IP asrockcentos8.50066 > asrockcentos8.postgres: Flags [.], ack 2418657615, win 342, options [nop,nop,TS val 2678079499 ecr 2678079499], length 0
E..4.o@.@..............8g_...).O...V.......
..@...@.
23:50:52.972606 IP asrockcentos8.50066 > asrockcentos8.postgres: Flags [P.], seq 0:8, ack 1, win 342, options [nop,nop,TS val 2678079499 ecr 2678079499], length 8
E..<.p@.@..............8g_...).O...V.......
..@...@......../
23:50:52.972841 IP asrockcentos8.50066 > asrockcentos8.postgres: Flags [.], ack 2, win 342, options [nop,nop,TS val 2678079499 ecr 2678079499], length 0
E..4.q@.@..............8g_.'.).P...V.......
..@...@.
23:50:52.972859 IP asrockcentos8.50066 > asrockcentos8.postgres: Flags [P.], seq 8:125, ack 2, win 342, options [nop,nop,TS val 2678079499 ecr 2678079499], length 117
E....r@.@..s...........8g_.'.).P...V.......
..@...@....u....user.postgres.database.postgres.client_encoding.UTF8.DateStyle.ISO.TimeZone.Asia/Tokyo.extra_float_digits.2..
23:50:52.973216 IP asrockcentos8.50066 > asrockcentos8.postgres: Flags [P.], seq 125:181, ack 26, win 342, options [nop,nop,TS val 2678079500 ecr 2678079500], length 56
E..l.s@.@..............8g_...).h...V.......
..@...@.p...7SCRAM-SHA-256....!n,,n=*,r=#D@*'!&xit&/\.Nfo6[:x>up
23:50:52.975989 IP asrockcentos8.50012 > asrockcentos8.postgres: Flags [.], ack 649, win 350, options [nop,nop,TS val 2678079503 ecr 2678079462], length 0
E..4..@.@............\.8.P..9\`T...^.......
..@...?.
23:50:52.980803 IP asrockcentos8.50066 > asrockcentos8.postgres: Flags [P.], seq 181:290, ack 119, win 342, options [nop,nop,TS val 2678079507 ecr 2678079500], length 109
E....t@.@..y...........8g_...).....V.......
..@...@.p...lc=biws,r=#D@*'!&xit&/\.Nfo6[:x>upk4zXMfRQIelwuK1TM3vsw1oc,p=JclRz4CJ/V6jfXZEXjWzPKyH+VfeEbxwf8+i7HnXVhY=
23:50:52.981223 IP asrockcentos8.50066 > asrockcentos8.postgres: Flags [P.], seq 290:332, ack 499, win 350, options [nop,nop,TS val 2678079508 ecr 2678079508], length 42
E..^.u@.@..............8g_.A.).A...^.......
..@...@.P.....BEGIN...B............E... .....S....
23:50:52.981279 IP asrockcentos8.50066 > asrockcentos8.postgres: Flags [P.], seq 332:395, ack 526, win 350, options [nop,nop,TS val 2678079508 ecr 2678079508], length 63
E..s.v@.@..............8g_.k.).\...^.......
..@...@.P...".SET extra_float_digits = 3...B............E...    .....S....
23:50:52.981342 IP asrockcentos8.50066 > asrockcentos8.postgres: Flags [P.], seq 395:479, ack 551, win 350, options [nop,nop,TS val 2678079508 ecr 2678079508], length 84
E....w@.@..............8g_...).u...^.......
..@...@.P...7.SET application_name = 'PostgreSQL JDBC Driver'...B............E...       .....S....
23:50:52.981418 IP asrockcentos8.50066 > asrockcentos8.postgres: Flags [P.], seq 479:522, ack 621, win 350, options [nop,nop,TS val 2678079508 ecr 2678079508], length 43
E.._.x@.@..............8g_...).....^.......
..@...@.P.....COMMIT...B............E...        .....S....
23:50:52.985990 IP asrockcentos8.50020 > asrockcentos8.postgres: Flags [.], ack 649, win 350, options [nop,nop,TS val 2678079513 ecr 2678079471], length 0
E..4..@.@..I.........d.8..Z...\,...^.......
..@...?.
23:50:52.993990 IP asrockcentos8.50036 > asrockcentos8.postgres: Flags [.], ack 649, win 350, options [nop,nop,TS val 2678079521 ecr 2678079480], length 0
E..4.1@.@..*.........t.8.|...;.....^.......
..@!..?.
23:50:53.003991 IP asrockcentos8.50042 > asrockcentos8.postgres: Flags [.], ack 649, win 350, options [nop,nop,TS val 2678079531 ecr 2678079490], length 0
E..4..@.@............z.8SM.`(s.Y...^.......
..@+..@.
23:50:53.012988 IP asrockcentos8.50058 > asrockcentos8.postgres: Flags [.], ack 649, win 350, options [nop,nop,TS val 2678079540 ecr 2678079499], length 0
E..4,.@.@..............8...?..k....^.......
..@4..@.
23:50:53.021989 IP asrockcentos8.50066 > asrockcentos8.postgres: Flags [.], ack 649, win 350, options [nop,nop,TS val 2678079549 ecr 2678079508], length 0
E..4.y@.@..............8g_.).).....^.......
..@=..@.







