[dai@asrockcentos8 ~]$ sudo tcpdump -i lo -A dst port 5432
dropped privs to tcpdump
tcpdump: verbose output suppressed, use -v or -vv for full protocol decode
listening on lo, link-type EN10MB (Ethernet), capture size 262144 bytes
00:24:56.763934 IP asrockcentos8.34620 > asrockcentos8.postgres: Flags [S], seq 2719093218, win 43690, options [mss 65495,sackOK,TS val 2680123290 ecr 0,nop,wscale 7], length 0
E..<e.@.@.Qo.........<.8.......................
..o.........
00:24:56.763955 IP asrockcentos8.34620 > asrockcentos8.postgres: Flags [.], ack 1076625364, win 342, options [nop,nop,TS val 2680123290 ecr 2680123290], length 0
E..4e.@.@.Qv.........<.8....@+.....V.......
..o...o.
00:24:56.765108 IP asrockcentos8.34620 > asrockcentos8.postgres: Flags [P.], seq 0:8, ack 1, win 342, options [nop,nop,TS val 2680123292 ecr 2680123290], length 8
E..<e.@.@.Qm.........<.8....@+.....V.......
..o...o......../
00:24:56.765139 IP asrockcentos8.34620 > asrockcentos8.postgres: Flags [.], ack 2, win 342, options [nop,nop,TS val 2680123292 ecr 2680123292], length 0
E..4e.@.@.Qt.........<.8....@+.....V.......
..o...o.
00:24:56.793428 IP asrockcentos8.34620 > asrockcentos8.postgres: Flags [P.], seq 8:343, ack 2, win 342, options [nop,nop,TS val 2680123320 ecr 2680123292], length 335
E...e.@.@.P$.........<.8....@+.....V.......
..o...o.....J...F..g...%.blF.r7F.
.853.*.W...o...|' ..~....z.JTs..a..^....N>.{.'.....>.......,.+...0.../.......$.(.#.'.k.g.
...     ...9.3.....=.<.5./................
.................................". .............       .
.................2.". .............     .
...................     ..............+........-.....3.&.$... .;./..jcq...1.H.@^U.3.Xu......=4
00:24:56.798462 IP asrockcentos8.34620 > asrockcentos8.postgres: Flags [P.], seq 343:711, ack 101, win 342, options [nop,nop,TS val 2680123325 ecr 2680123320], length 368
E...e.@.@.P..........<.8...:@,.8...V.......
..o...o.....k...g..g...%.blF.r7F.
.853.*.W...o...|' ..~....z.JTs..a..^....N>.{.'.....>.......,.+...0.../.......$.(.#.'.k.g.
...     ...9.3.....=.<.5./................
.................................". .............       .
.................2.". .............     .
...................     ..............+........-.....3.G.E...A.....P.....p.     ..;....E....k1k...........!a..-sR..w..S..,.ku.(....
00:24:56.799435 IP asrockcentos8.34620 > asrockcentos8.postgres: Flags [.], ack 1515, win 1365, options [nop,nop,TS val 2680123326 ecr 2680123326], length 0
E..4e.@.@.Qq.........<.8....@,.....U.......
..o...o.
00:24:56.803567 IP asrockcentos8.34620 > asrockcentos8.postgres: Flags [P.], seq 711:717, ack 1515, win 1365, options [nop,nop,TS val 2680123330 ecr 2680123326], length 6
E..:e.@.@.Qj.........<.8....@,.....U.......
..o...o.......
00:24:56.815274 IP asrockcentos8.34620 > asrockcentos8.postgres: Flags [P.], seq 717:807, ack 1515, win 1365, options [nop,nop,TS val 2680123342 ecr 2680123326], length 90
E...e.@.@.Q..........<.8....@,.....U.......
..o...o.....U^...l..ik.....9... oxy<"=..... ..En.R....J...VG..<k....A.....=..z.....d.....v........
00:24:56.816242 IP asrockcentos8.34620 > asrockcentos8.postgres: Flags [P.], seq 807:959, ack 1673, win 1365, options [nop,nop,TS val 2680123343 ecr 2680123342], length 152
E...e.@.@.P..........<.8...
@,.\...U.'.....
..o...o......>.D.#.YB.#I.F.o.=A.-.      U_.,.x.H..@`......6.^.8..8..p...y.r..D0TL.`g@.....c.}rf.....cH.V]......Q.v.........0fw...YG.6......9.WO.....>
....w.7A....P.V
00:24:56.817391 IP asrockcentos8.34620 > asrockcentos8.postgres: Flags [P.], seq 959:1007, ack 1704, win 1365, options [nop,nop,TS val 2680123344 ecr 2680123343], length 48
E..de.@.@.Q=.........<.8....@,.{...U.......
..o...o.....+..B.E...qX..."G.(..0..g....3.V.8RR..^z.gD.g
00:24:56.825316 IP asrockcentos8.34620 > asrockcentos8.postgres: Flags [P.], seq 1007:1087, ack 2049, win 1387, options [nop,nop,TS val 2680123352 ecr 2680123345], length 80
E...e.@.@.Q..........<.8....@,.....k.......
..o...o.....K1s..tj>..G.$...;...9.....q...@...K..\....%..M.5.......c....CCy....J.B.u!V..
00:24:56.825568 IP asrockcentos8.34620 > asrockcentos8.postgres: Flags [P.], seq 1087:1188, ack 2098, win 1387, options [nop,nop,TS val 2680123352 ecr 2680123352], length 101
E...e.@.@.Q..........<.8..."@,.....k.......
..o...o.....`X....I%..b....x.0.p.....X^..O.e...3..zj.8..2j...A.n.i...mnz.. ..G.>..9.p........<SF.R..B.%H\....
00:24:56.825826 IP asrockcentos8.34620 > asrockcentos8.postgres: Flags [P.], seq 1188:1310, ack 2145, win 1387, options [nop,nop,TS val 2680123352 ecr 2680123352], length 122
E...e.@.@.P..........<.8....@,.4...k.   .....
..o...o.....u.....'/......-.N.....Z..r......n9.%...j.r=n..r.c1._....S$..N.1K{....X.O.:#%.x..N......-.t.r..UB..j.LH..-A......@..EV.
00:24:56.825984 IP asrockcentos8.34620 > asrockcentos8.postgres: Flags [P.], seq 1310:1391, ack 2237, win 1387, options [nop,nop,TS val 2680123352 ecr 2680123352], length 81
E...e.@.@.Q..........<.8....@,.....k.......
..o...o.....L\-l.....@.G...
..a..*9..l)8.[.A.$..*...E7.l]..g..Z..B.....     do.'L..Y.......e.
00:24:56.829404 IP asrockcentos8.34620 > asrockcentos8.postgres: Flags [P.], seq 1391:1473, ack 2287, win 1387, options [nop,nop,TS val 2680123356 ecr 2680123353], length 82
E...e.@.@.Q..........<.8...R@,.....k.......
..o...o.....Mvs.....9...l...UI.....:...S.4.....%..4...Q..].2......~0`.g...5.q4.4!..M.b.V.|
00:24:56.829621 IP asrockcentos8.34620 > asrockcentos8.postgres: Flags [P.], seq 1473:1587, ack 2335, win 1387, options [nop,nop,TS val 2680123356 ecr 2680123356], length 114
E...e.@.@.P..........<.8....@,.....k.......
..o...o.....m..&M...Y.....k..`.....<G.{Q+..L.c...v.@.|...=..R_..[P^}z+.Y.......................J....p.s.........g...<.k..:
00:24:56.834407 IP asrockcentos8.34620 > asrockcentos8.postgres: Flags [P.], seq 1587:1713, ack 2455, win 1387, options [nop,nop,TS val 2680123361 ecr 2680123356], length 126
E...e.@.@.P..........<.8....@,  j...k.......
..o...o.....y2....Xp,....9el.b....w.r..@..@K.O |.....c...v.V..g....J    ...?..
....%...@.uV....C...... l..p......3.......6....fh..r...'d.
00:24:56.875994 IP asrockcentos8.34620 > asrockcentos8.postgres: Flags [.], ack 2577, win 1387, options [nop,nop,TS val 2680123403 ecr 2680123362], length 0
E..4e.@.@.Qe.........<.8....@,  ....k.......
..p...o.
00:24:56.932614 IP asrockcentos8.34636 > asrockcentos8.postgres: Flags [S], seq 1053667637, win 43690, options [mss 65495,sackOK,TS val 2680123459 ecr 0,nop,wscale 7], length 0
E..<..@.@............L.8>..5...................
..pC........
00:24:56.932633 IP asrockcentos8.34636 > asrockcentos8.postgres: Flags [.], ack 2525299839, win 342, options [nop,nop,TS val 2680123459 ecr 2680123459], length 0
E..4..@.@............L.8>..6.......V.......
..pC..pC
00:24:56.932730 IP asrockcentos8.34636 > asrockcentos8.postgres: Flags [P.], seq 0:8, ack 1, win 342, options [nop,nop,TS val 2680123459 ecr 2680123459], length 8
E..<..@.@............L.8>..6.......V.......
..pC..pC......./
00:24:56.933048 IP asrockcentos8.34636 > asrockcentos8.postgres: Flags [.], ack 2, win 342, options [nop,nop,TS val 2680123460 ecr 2680123460], length 0
E..4..@.@............L.8>..>.......V.......
..pD..pD
00:24:56.934534 IP asrockcentos8.34636 > asrockcentos8.postgres: Flags [P.], seq 8:343, ack 2, win 342, options [nop,nop,TS val 2680123461 ecr 2680123460], length 335
E.....@.@..I.........L.8>..>.......V.......
..pE..pD....J...F..`.W.B.:.#.......3(..RC"...r..... ...;.v....N...(....>.z.r.EO
..D..>.......,.+...0.../.......$.(.#.'.k.g.
...     ...9.3.....=.<.5./................
.................................". .............       .
.................2.". .............     .
...................     ..............+........-.....3.&.$... C{.,..c...i.\7..B.M.U.nKR.Q/..._
00:24:56.935597 IP asrockcentos8.34636 > asrockcentos8.postgres: Flags [P.], seq 343:711, ack 101, win 342, options [nop,nop,TS val 2680123462 ecr 2680123461], length 368
E.....@.@..'.........L.8>..........V.......
..pF..pE....k...g..`.W.B.:.#.......3(..RC"...r..... ...;.v....N...(....>.z.r.EO
..D..>.......,.+...0.../.......$.(.#.'.k.g.
...     ...9.3.....=.<.5./................
.................................". .............       .
.................2.". .............     .
...................     ..............+........-.....3.G.E...A.~9..P.....*..`..}].....y..G.. .m....     ...!.W'..}. .!.H.....L.....
00:24:56.936531 IP asrockcentos8.34636 > asrockcentos8.postgres: Flags [.], ack 1515, win 1365, options [nop,nop,TS val 2680123463 ecr 2680123463], length 0
E..4..@.@............L.8>.....
i...U.......
..pG..pG
00:24:56.938500 IP asrockcentos8.34636 > asrockcentos8.postgres: Flags [P.], seq 711:717, ack 1515, win 1365, options [nop,nop,TS val 2680123465 ecr 2680123463], length 6
E..:..@.@............L.8>.....
i...U.......
..pI..pG......
00:24:56.940588 IP asrockcentos8.34636 > asrockcentos8.postgres: Flags [P.], seq 717:807, ack 1515, win 1365, options [nop,nop,TS val 2680123467 ecr 2680123463], length 90
E.....@.@..:.........L.8>.....
i...U.......
..pK..pG....U~Dz....&.....A.H....t........o..Z..........."..d0....e....B...     .f_/..#..y..7.d.R       ....
00:24:56.940694 IP asrockcentos8.34636 > asrockcentos8.postgres: Flags [P.], seq 807:959, ack 1673, win 1365, options [nop,nop,TS val 2680123467 ecr 2680123467], length 152
E.....@.@............L.8>..].......U.'.....
..pK..pK.....\.(.J.......kv...7-h*.&..../fn~..P;9..Z._n..t...bL..WE...l...:..xh/..P....K.6Vs ...O[...y..X........QY......9.DE....UY...RL.L...SN...!k...&L+:XN...
00:24:56.941114 IP asrockcentos8.34636 > asrockcentos8.postgres: Flags [P.], seq 959:1007, ack 1704, win 1365, options [nop,nop,TS val 2680123468 ecr 2680123467], length 48
E..d..@.@..b.........L.8>......&...U.......
..pL..pK....+.....c...!.d4.. .v...7.]...0....1.=...j..cz
00:24:56.942670 IP asrockcentos8.34636 > asrockcentos8.postgres: Flags [P.], seq 1007:1087, ack 2049, win 1387, options [nop,nop,TS val 2680123469 ecr 2680123469], length 80
E.....@.@..A.........L.8>..%.......k.......
..pM..pM....K.qIM...%o......RP*....N.2.....}W.  ....:.J..Ta\.^.~(.=...A..d...d..'..#U..].
00:24:56.942828 IP asrockcentos8.34636 > asrockcentos8.postgres: Flags [P.], seq 1087:1188, ack 2098, win 1387, options [nop,nop,TS val 2680123469 ecr 2680123469], length 101
E.....@.@..+.........L.8>..u.......k.......
..pM..pM....`~t...-PN*...AJ3.....g....x.i..........[..=..,.A<..j.gq._,t"....._A).=.?....u.k...^.E.@..>QG....<
00:24:56.943000 IP asrockcentos8.34636 > asrockcentos8.postgres: Flags [P.], seq 1188:1310, ack 2145, win 1387, options [nop,nop,TS val 2680123470 ecr 2680123469], length 122
E.....@.@............L.8>..........k.   .....
..pN..pM....u....W..[\..(u.....B9.....>gx.....cM.N..............+.Sg....T.6.y`.>..RD.B6.N.4.Q.7.............]..~.....N&.&.&..M.B.s
00:24:56.943140 IP asrockcentos8.34636 > asrockcentos8.postgres: Flags [P.], seq 1310:1391, ack 2237, win 1387, options [nop,nop,TS val 2680123470 ecr 2680123470], length 81
E.....@.@..=.........L.8>..T...;...k.......
..pN..pN....L...=..V~..V..I.Z,S....a....\..d.t&......cV...@..c.{7.......L..(."D.x........
00:24:56.943579 IP asrockcentos8.34652 > asrockcentos8.postgres: Flags [S], seq 4206339368, win 43690, options [mss 65495,sackOK,TS val 2680123470 ecr 0,nop,wscale 7], length 0
E..<`r@.@.V..........\.8...(...................
..pN........
00:24:56.943592 IP asrockcentos8.34652 > asrockcentos8.postgres: Flags [.], ack 2652966550, win 342, options [nop,nop,TS val 2680123470 ecr 2680123470], length 0
E..4`s@.@.V..........\.8...).!.....V.......
..pN..pN
00:24:56.943671 IP asrockcentos8.34652 > asrockcentos8.postgres: Flags [P.], seq 0:8, ack 1, win 342, options [nop,nop,TS val 2680123470 ecr 2680123470], length 8
E..<`t@.@.V..........\.8...).!.....V.......
..pN..pN......./
00:24:56.943956 IP asrockcentos8.34652 > asrockcentos8.postgres: Flags [.], ack 2, win 342, options [nop,nop,TS val 2680123470 ecr 2680123470], length 0
E..4`u@.@.V..........\.8...1.!.....V.......
..pN..pN
00:24:56.945220 IP asrockcentos8.34652 > asrockcentos8.postgres: Flags [P.], seq 8:343, ack 2, win 342, options [nop,nop,TS val 2680123472 ecr 2680123470], length 335
E...`v@.@.U..........\.8...1.!.....V.......
..pP..pN....J...F.....=...B
E.v..
.....{N......8... .<>H9...
,..;Nu...={....>....c...>.......,.+...0.../.......$.(.#.'.k.g.
...     ...9.3.....=.<.5./................
.................................". .............       .
.................2.". .............     .
...................     ..............+........-.....3.&.$... .Z.RVe....B...<B  ....hd.v4...7Ax
00:24:56.946088 IP asrockcentos8.34652 > asrockcentos8.postgres: Flags [P.], seq 343:711, ack 101, win 342, options [nop,nop,TS val 2680123473 ecr 2680123472], length 368
E...`w@.@.Ut.........\.8.....!.....V.......
..pQ..pP....k...g.....=...B
E.v..
.....{N......8... .<>H9...
,..;Nu...={....>....c...>.......,.+...0.../.......$.(.#.'.k.g.
...     ...9.3.....=.<.5./................
.................................". .............       .
.................2.". .............     .
...................     ..............+........-.....3.G.E...A.^qk`5Cw.@N..3t...V.I.G.A...#s^..;C.....T.m./|..`...o.S+%2dL..=..
00:24:56.947004 IP asrockcentos8.34652 > asrockcentos8.postgres: Flags [.], ack 1515, win 1365, options [nop,nop,TS val 2680123474 ecr 2680123474], length 0
E..4`x@.@.V..........\.8.....!.....U.......
..pR..pR
00:24:56.948623 IP asrockcentos8.34652 > asrockcentos8.postgres: Flags [P.], seq 711:717, ack 1515, win 1365, options [nop,nop,TS val 2680123475 ecr 2680123474], length 6
E..:`y@.@.V..........\.8.....!.....U.......
..pS..pR......
00:24:56.950261 IP asrockcentos8.34652 > asrockcentos8.postgres: Flags [P.], seq 717:807, ack 1515, win 1365, options [nop,nop,TS val 2680123477 ecr 2680123474], length 90
E...`z@.@.V..........\.8.....!.....U.......
..pU..pR....U...|i......LZo.f_xiO=..RT7...+..;..l.....^...I%sR.#..L     .=>...G....BoJ..V~.a...O.A.z`.
00:24:56.950359 IP asrockcentos8.34652 > asrockcentos8.postgres: Flags [P.], seq 807:959, ack 1673, win 1365, options [nop,nop,TS val 2680123477 ecr 2680123477], length 152
E...`{@.@.VH.........\.8...P.!.....U.'.....
..pU..pU.....n..S5.\...gXU.3...$.@Q..nJ@..3.1()Z.z..Ko*a.u..I..."uw......I..;../2..K.K.)[i.....7....j..........Zo........w.l...Y..-......wL\.7h..<.... ..w\..|:.
00:24:56.950736 IP asrockcentos8.34652 > asrockcentos8.postgres: Flags [P.], seq 959:1007, ack 1704, win 1365, options [nop,nop,TS val 2680123477 ecr 2680123477], length 48
E..d`|@.@.V..........\.8.....!.=...U.......
..pU..pU....++.x...L    ~....]t. =....yw.....B.e(W.mkc.....
00:24:56.952194 IP asrockcentos8.34652 > asrockcentos8.postgres: Flags [P.], seq 1007:1087, ack 2049, win 1387, options [nop,nop,TS val 2680123479 ecr 2680123478], length 80
E...`}@.@.V..........\.8.....!.....k.......
..pW..pV....K.'7...h.....Vy.T...w##j...N"+.[p..R..{v.........M=..]9q..d...L.....D.....d.
00:24:56.952364 IP asrockcentos8.34652 > asrockcentos8.postgres: Flags [P.], seq 1087:1188, ack 2098, win 1387, options [nop,nop,TS val 2680123479 ecr 2680123479], length 101
E...`~@.@.Vx.........\.8...h.!.....k.......
..pW..pW....`.}TT..'...TB...-q...}...
4.T.K..L.).o.72.....2.W.R...Yw|.2S..-.mN.].n..............H'.....m.GpU/
00:24:56.952532 IP asrockcentos8.34652 > asrockcentos8.postgres: Flags [P.], seq 1188:1310, ack 2145, win 1387, options [nop,nop,TS val 2680123479 ecr 2680123479], length 122
E...`.@.@.Vb.........\.8.....!.....k.   .....
..pW..pW....u.[_.7K..}.`.       o..s.........lS..-.W..A4..|z.......o.....Tc\}..8.y......FK.D=.2.B..?.y..k.$L.n^..{....@\....^...3t......
00:24:56.952660 IP asrockcentos8.34652 > asrockcentos8.postgres: Flags [P.], seq 1310:1391, ack 2237, win 1387, options [nop,nop,TS val 2680123479 ecr 2680123479], length 81
E...`.@.@.V..........\.8...G.!.R...k.......
..pW..pW....L.b.v.o.@../=#.[P... .~..r...!Xb<c..6....hP...-...m!......'.Sb....F.i..}(....
00:24:56.953016 IP asrockcentos8.34662 > asrockcentos8.postgres: Flags [S], seq 3280771216, win 43690, options [mss 65495,sackOK,TS val 2680123480 ecr 0,nop,wscale 7], length 0
E..<$.@.@..{.........f.8.......................
..pX........
00:24:56.953030 IP asrockcentos8.34662 > asrockcentos8.postgres: Flags [.], ack 368110087, win 342, options [nop,nop,TS val 2680123480 ecr 2680123480], length 0
E..4$.@.@............f.8...........V.......
..pX..pX
00:24:56.953094 IP asrockcentos8.34662 > asrockcentos8.postgres: Flags [P.], seq 0:8, ack 1, win 342, options [nop,nop,TS val 2680123480 ecr 2680123480], length 8
E..<$.@.@..y.........f.8...........V.......
..pX..pX......./
00:24:56.953386 IP asrockcentos8.34662 > asrockcentos8.postgres: Flags [.], ack 2, win 342, options [nop,nop,TS val 2680123480 ecr 2680123480], length 0
E..4$.@.@............f.8...........V.......
..pX..pX
00:24:56.954598 IP asrockcentos8.34662 > asrockcentos8.postgres: Flags [P.], seq 8:343, ack 2, win 342, options [nop,nop,TS val 2680123481 ecr 2680123480], length 335
E...$.@.@..0.........f.8...........V.......
..pY..pX....J...F.....7.....E..D...^.
.xf........a\ .B3./..0v.S0'M......o..B.d. .....>.......,.+...0.../.......$.(.#.'.k.g.
...     ...9.3.....=.<.5./................
.................................". .............       .
.................2.". .............     .
...................     ..............+........-.....3.&.$... ....(]oP.#aV.<.{.s.A.A.@..^7...g
00:24:56.955458 IP asrockcentos8.34662 > asrockcentos8.postgres: Flags [P.], seq 343:711, ack 101, win 342, options [nop,nop,TS val 2680123482 ecr 2680123481], length 368
E...$.@.@............f.8.......k...V.......
..pZ..pY....k...g.....7.....E..D...^.
.xf........a\ .B3./..0v.S0'M......o..B.d. .....>.......,.+...0.../.......$.(.#.'.k.g.
...     ...9.3.....=.<.5./................
.................................". .............       .
.................2.". .............     .
...................     ..............+........-.....3.G.E...A....?.:..D...Q.........-+V......B.        ..U"H..e.y......*..9..hv.Pl|..
00:24:56.956348 IP asrockcentos8.34662 > asrockcentos8.postgres: Flags [.], ack 1515, win 1365, options [nop,nop,TS val 2680123483 ecr 2680123483], length 0
E..4$.@.@..}.........f.8...X.......U.......
..p[..p[
00:24:56.957925 IP asrockcentos8.34662 > asrockcentos8.postgres: Flags [P.], seq 711:717, ack 1515, win 1365, options [nop,nop,TS val 2680123484 ecr 2680123483], length 6
E..:$.@.@..v.........f.8...X.......U.......
..p\..p[......
00:24:56.959483 IP asrockcentos8.34662 > asrockcentos8.postgres: Flags [P.], seq 717:807, ack 1515, win 1365, options [nop,nop,TS val 2680123486 ecr 2680123483], length 90
E...$.@.@..!.........f.8...^.......U.......
..p^..p[....U.........K.y.l-....@...CA.B..2xk.Z!......\..43.N..E.U..j..NL..}.Q....z`..z.'.3XG.....
00:24:56.959582 IP asrockcentos8.34662 > asrockcentos8.postgres: Flags [P.], seq 807:959, ack 1673, win 1365, options [nop,nop,TS val 2680123486 ecr 2680123486], length 152
E...$.@.@............f.8...........U.'.....
..p^..p^.....b{6.......?....K..:...L%..D...8..1...cRr..V........X..#.9G9...A.j..B..Is..7.:.T/.6...H;v.6.q..Y~.5.....AD'.....#Fl..U..QIkC.;.IFf.nQ^...LX...<../.P
00:24:56.960061 IP asrockcentos8.34662 > asrockcentos8.postgres: Flags [P.], seq 959:1007, ack 1704, win 1365, options [nop,nop,TS val 2680123487 ecr 2680123486], length 48
E..d$.@.@..I.........f.8...P.......U.......
..p_..p^....+.....b...|?....$`.XO..hu...l...........~|.7
00:24:56.961465 IP asrockcentos8.34662 > asrockcentos8.postgres: Flags [P.], seq 1007:1087, ack 2049, win 1387, options [nop,nop,TS val 2680123488 ecr 2680123488], length 80
E...$.@.@..(.........f.8...........k.......
..p`..p`....K...9.'|../F....l.+.sz.....^g.bEHZ...j_Q.+J.P..?...ixO.cq...+P.@G7c...+.....
00:24:56.961610 IP asrockcentos8.34662 > asrockcentos8.postgres: Flags [P.], seq 1087:1188, ack 2098, win 1387, options [nop,nop,TS val 2680123488 ecr 2680123488], length 101
E...$.@.@............f.8.......8...k.......
..p`..p`....`>.k......o..;..Vu..D.C)....zX."T..W..=0}.....8...G....]...L...J..?...........^H.....W..W.zrV.;i.
00:24:56.961765 IP asrockcentos8.34662 > asrockcentos8.postgres: Flags [P.], seq 1188:1310, ack 2145, win 1387, options [nop,nop,TS val 2680123488 ecr 2680123488], length 122
E...$.@.@............f.8...5...g...k.   .....
..p`..p`....u.I..W9Tg....."dRPX.....U........].%.p..s.......5....v.....=...~....!..`.....|._55../0.q.%2.D...A.$`.]C<E.u..Qu.,...d^
00:24:56.961886 IP asrockcentos8.34662 > asrockcentos8.postgres: Flags [P.], seq 1310:1391, ack 2237, win 1387, options [nop,nop,TS val 2680123488 ecr 2680123488], length 81
E...$.@.@..$.........f.8...........k.......
..p`..p`....L6{..g..C.Q../j.D.;.yn."$...        _....Y.......   ..yBdjUY.....n:....n.|..G..[.(r...
00:24:56.962213 IP asrockcentos8.34670 > asrockcentos8.postgres: Flags [S], seq 3337629996, win 43690, options [mss 65495,sackOK,TS val 2680123489 ecr 0,nop,wscale 7], length 0
E..<..@.@..r.........n.8..1,...................
..pa........
00:24:56.962226 IP asrockcentos8.34670 > asrockcentos8.postgres: Flags [.], ack 770309583, win 342, options [nop,nop,TS val 2680123489 ecr 2680123489], length 0
E..4..@.@..y.........n.8..1--......V.......
..pa..pa
00:24:56.962284 IP asrockcentos8.34670 > asrockcentos8.postgres: Flags [P.], seq 0:8, ack 1, win 342, options [nop,nop,TS val 2680123489 ecr 2680123489], length 8
E..<..@.@..p.........n.8..1--......V.......
..pa..pa......./
00:24:56.962586 IP asrockcentos8.34670 > asrockcentos8.postgres: Flags [.], ack 2, win 342, options [nop,nop,TS val 2680123489 ecr 2680123489], length 0
E..4..@.@..w.........n.8..15-......V.......
..pa..pa
00:24:56.963700 IP asrockcentos8.34670 > asrockcentos8.postgres: Flags [P.], seq 8:343, ack 2, win 342, options [nop,nop,TS val 2680123490 ecr 2680123489], length 335
E.....@.@..'.........n.8..15-......V.......
..pb..pa....J...F....d.8.B.u...t .7...9.cb...   ..+.. ...m+a+.[...g1d
.My....|.h.nl....>.......,.+...0.../.......$.(.#.'.k.g.
...     ...9.3.....=.<.5./................
.................................". .............       .
.................2.". .............     .
...................     ..............+........-.....3.&.$... .../v.......M..{(..|V......&\.
.
00:24:56.964542 IP asrockcentos8.34670 > asrockcentos8.postgres: Flags [P.], seq 343:711, ack 101, win 342, options [nop,nop,TS val 2680123491 ecr 2680123490], length 368
E.....@.@............n.8..2.-..3...V.......
..pc..pb....k...g....d.8.B.u...t .7...9.cb...   ..+.. ...m+a+.[...g1d
.My....|.h.nl....>.......,.+...0.../.......$.(.#.'.k.g.
...     ...9.3.....=.<.5./................
.................................". .............       .
.................2.". .............     .
...................     ..............+........-.....3.G.E...A..M.
.......u.&.1......H....YC.........vD...4Nd.....5.A..z....;;f
00:24:56.965464 IP asrockcentos8.34670 > asrockcentos8.postgres: Flags [.], ack 1515, win 1365, options [nop,nop,TS val 2680123492 ecr 2680123492], length 0
E..4..@.@..t.........n.8..3.-......U.......
..pd..pd
00:24:56.966964 IP asrockcentos8.34670 > asrockcentos8.postgres: Flags [P.], seq 711:717, ack 1515, win 1365, options [nop,nop,TS val 2680123493 ecr 2680123492], length 6
E..:..@.@..m.........n.8..3.-......U.......
..pe..pd......
00:24:56.968391 IP asrockcentos8.34670 > asrockcentos8.postgres: Flags [P.], seq 717:807, ack 1515, win 1365, options [nop,nop,TS val 2680123495 ecr 2680123492], length 90
E.....@.@............n.8..3.-......U.......
..pg..pd....U.'..EC...s.J~..g..U..w...i.....K.....U.L.c.Z.8<.~.uG....l.....(..td5.s&7.h.NIrhLN .~.
00:24:56.968467 IP asrockcentos8.34670 > asrockcentos8.postgres: Flags [P.], seq 807:959, ack 1673, win 1365, options [nop,nop,TS val 2680123495 ecr 2680123495], length 152
E.....@.@............n.8..4T-..W...U.'.....
..pg..pg.....vs.\       +......L.>[..ct3.f...d..@...So.%.ya.ft`.D.....m....(....B.=..eE...3..)#,g79.m....=.-/.RU
......+
.%      k..p....7......m. .
........"+].....z..B..
00:24:56.968783 IP asrockcentos8.34670 > asrockcentos8.postgres: Flags [P.], seq 959:1007, ack 1704, win 1365, options [nop,nop,TS val 2680123495 ecr 2680123495], length 48
E..d..@.@..@.........n.8..4.-..v...U.......
..pg..pg....+(,.IgN#.B-M..IX.=N5....a../RU
..P.Wa& .....
00:24:56.970165 IP asrockcentos8.34670 > asrockcentos8.postgres: Flags [P.], seq 1007:1087, ack 2049, win 1387, options [nop,nop,TS val 2680123497 ecr 2680123496], length 80
E.....@.@............n.8..5.-......k.......
..pi..ph....K..`..4c.....3.w>_.....4.....3.~=V.....5.....HZ.-...........p..U....?L......
00:24:56.970291 IP asrockcentos8.34670 > asrockcentos8.postgres: Flags [P.], seq 1087:1188, ack 2098, win 1387, options [nop,nop,TS val 2680123497 ecr 2680123497], length 101
E.....@.@..     .........n.8..5l-......k.......
..pi..pi....`.h...{k.wd....s@..l^.=.?3..._....R".7...Gd...O(...q....C....l..u..f5..X'....VO.u....<A...b.....o
00:24:56.970424 IP asrockcentos8.34670 > asrockcentos8.postgres: Flags [P.], seq 1188:1310, ack 2145, win 1387, options [nop,nop,TS val 2680123497 ecr 2680123497], length 122
E.....@.@............n.8..5.-../...k.   .....
..pi..pi....u...D.)UT3..p}.^.F.HO.....vg.....K._X)......<.]...w./$.@.K...:M...m.-O.y:d..#s.....Z......iK.(.?..[...z.O:..Z}.#.%.
.-
00:24:56.970530 IP asrockcentos8.34670 > asrockcentos8.postgres: Flags [P.], seq 1310:1391, ack 2237, win 1387, options [nop,nop,TS val 2680123497 ecr 2680123497], length 81
E.....@.@............n.8..6K-......k.......
..pi..pi....L.yIu_.{..\..........)._.zg ........
.g.
.....-.!.E....(.}.....g)8\!.#d
.....
00:24:56.970860 IP asrockcentos8.34680 > asrockcentos8.postgres: Flags [S], seq 153537215, win 43690, options [mss 65495,sackOK,TS val 2680123497 ecr 0,nop,wscale 7], length 0
E..<..@.@............x.8        &.....................
..pi........
00:24:56.970875 IP asrockcentos8.34680 > asrockcentos8.postgres: Flags [.], ack 583963544, win 342, options [nop,nop,TS val 2680123497 ecr 2680123497], length 0
E..4..@.@............x.8        &.."......V.......
..pi..pi
00:24:56.970937 IP asrockcentos8.34680 > asrockcentos8.postgres: Flags [P.], seq 0:8, ack 1, win 342, options [nop,nop,TS val 2680123497 ecr 2680123497], length 8
E..<..@.@............x.8        &.."......V.......
..pi..pi......./
00:24:56.971236 IP asrockcentos8.34680 > asrockcentos8.postgres: Flags [.], ack 2, win 342, options [nop,nop,TS val 2680123498 ecr 2680123498], length 0
E..4..@.@............x.8        &.."......V.......
..pj..pj
00:24:56.972312 IP asrockcentos8.34680 > asrockcentos8.postgres: Flags [P.], seq 8:343, ack 2, win 342, options [nop,nop,TS val 2680123499 ecr 2680123498], length 335
E.....@.@..>.........x.8        &.."......V.......
..pk..pj....J...F..t..R0.j.}.+...|.#rg..heT4.9j8.F. ............>...Q.j.O<r.MY)..7Kz.>.......,.+...0.../.......$.(.#.'.k.g.
...     ...9.3.....=.<.5./................
.................................". .............       .
.................2.". .............     .
...................     ..............+........-.....3.&.$... H.j..K.1Al....W   ....\..g[:HD.v.b
00:24:56.973131 IP asrockcentos8.34680 > asrockcentos8.postgres: Flags [P.], seq 343:711, ack 101, win 342, options [nop,nop,TS val 2680123500 ecr 2680123499], length 368
E.....@.@............x.8        &.."......V.......
..pl..pk....k...g..t..R0.j.}.+...|.#rg..heT4.9j8.F. ............>...Q.j.O<r.MY)..7Kz.>.......,.+...0.../.......$.(.#.'.k.g.
...     ...9.3.....=.<.5./................
.................................". .............       .
.................2.". .............     .
...................     ..............+........-.....3.G.E...A."mU......Z...EK.]Y.....[..x.......$.x.<!.....)?.....Y...........
00:24:56.974058 IP asrockcentos8.34680 > asrockcentos8.postgres: Flags [.], ack 1515, win 1365, options [nop,nop,TS val 2680123501 ecr 2680123501], length 0
E..4..@.@............x.8        &.."......U.......
..pm..pm
00:24:56.975510 IP asrockcentos8.34680 > asrockcentos8.postgres: Flags [P.], seq 711:717, ack 1515, win 1365, options [nop,nop,TS val 2680123502 ecr 2680123501], length 6
E..:..@.@............x.8        &.."......U.......
..pn..pm......
00:24:56.976822 IP asrockcentos8.34680 > asrockcentos8.postgres: Flags [P.], seq 717:807, ack 1515, win 1365, options [nop,nop,TS val 2680123503 ecr 2680123501], length 90
E.....@.@../.........x.8        &.."......U.......
..po..pm....Uj.5..      ..S...u.......\.....v......NO.j.j..h....L..1_....^..S..<Dr.G>:l/.^. ..T..t.....
00:24:56.976898 IP asrockcentos8.34680 > asrockcentos8.postgres: Flags [P.], seq 807:959, ack 1673, win 1365, options [nop,nop,TS val 2680123503 ecr 2680123503], length 152
E.....@.@............x.8        &..".. ...U.'.....
..po..po......o......b..o....i..H.z..$-....FM.X.;....p....
[V..|b.".....VQ.+..:X.i..z.9..E....4b...2C..0....q.: .I.?..!o....8..=.....uty.z.....B.L.i...!...k....
00:24:56.977230 IP asrockcentos8.34680 > asrockcentos8.postgres: Flags [P.], seq 959:1007, ack 1704, win 1365, options [nop,nop,TS val 2680123504 ecr 2680123504], length 48
E..d..@.@..W.........x.8        &.."..?...U.......
..pp..pp....+...4D.....i...2.1=.        ...l`t....xxt.;.6..I.k.
00:24:56.978664 IP asrockcentos8.34680 > asrockcentos8.postgres: Flags [P.], seq 1007:1087, ack 2049, win 1387, options [nop,nop,TS val 2680123505 ecr 2680123505], length 80
E.....@.@..6.........x.8        &.."......k.......
..pq..pq....K]Q.qS.......@0....g<....#..H.....;.J...q.Yn..gB/h...YQ...a"Q......;...G.[Y.
00:24:56.978790 IP asrockcentos8.34680 > asrockcentos8.postgres: Flags [P.], seq 1087:1188, ack 2098, win 1387, options [nop,nop,TS val 2680123505 ecr 2680123505], length 101
E.....@.@.. .........x.8        &.."......k.......
..pq..pq....`C(c...^...4...W[.e...@PG.....zb.o_p        uIS.>GES"..Q."...=r>.&.....^.lBy.............`...A......m.Va
00:24:56.978928 IP asrockcentos8.34680 > asrockcentos8.postgres: Flags [P.], seq 1188:1310, ack 2145, win 1387, options [nop,nop,TS val 2680123505 ecr 2680123505], length 122
E.....@.@..
.........x.8    &.d"......k.    .....
..pq..pq....u0&.D*..K....Dh.Xnv...uE...v8H........u.....Hq...6..!.D.r..Q.b.T.;.G.,.....G0}5>.t.1
....DCl....r..~..b7.....{s...W8.d
00:24:56.979040 IP asrockcentos8.34680 > asrockcentos8.postgres: Flags [P.], seq 1310:1391, ack 2237, win 1387, options [nop,nop,TS val 2680123506 ecr 2680123505], length 81
E.....@.@..2.........x.8        &.."..T...k.......
..pr..pq....L..O....J.z..k.{.xs.Q0>....1..2....*.>...NL.w.9...!..}.3....z.......:.D..$JF.
00:24:56.979369 IP asrockcentos8.34690 > asrockcentos8.postgres: Flags [S], seq 2662892232, win 43690, options [mss 65495,sackOK,TS val 2680123506 ecr 0,nop,wscale 7], length 0
E..<..@.@..............8.......................
..pr........
00:24:56.979382 IP asrockcentos8.34690 > asrockcentos8.postgres: Flags [.], ack 1296092310, win 342, options [nop,nop,TS val 2680123506 ecr 2680123506], length 0
E..4..@.@..............8....M@.....V.......
..pr..pr
00:24:56.979444 IP asrockcentos8.34690 > asrockcentos8.postgres: Flags [P.], seq 0:8, ack 1, win 342, options [nop,nop,TS val 2680123506 ecr 2680123506], length 8
E..<..@.@..............8....M@.....V.......
..pr..pr......./
00:24:56.979714 IP asrockcentos8.34690 > asrockcentos8.postgres: Flags [.], ack 2, win 342, options [nop,nop,TS val 2680123506 ecr 2680123506], length 0
E..4..@.@..............8....M@.....V.......
..pr..pr
00:24:56.980834 IP asrockcentos8.34690 > asrockcentos8.postgres: Flags [P.], seq 8:343, ack 2, win 342, options [nop,nop,TS val 2680123507 ecr 2680123506], length 335
E.....@.@..9...........8....M@.....V.......
..ps..pr....J...F....47.x.....`T.._..-8~...JS./..`} I..?..............^A.....w:.yC...>.......,.+...0.../.......$.(.#.'.k.g.
...     ...9.3.....=.<.5./................
.................................". .............       .
.................2.". .............     .
...................     ..............+........-.....3.&.$... .O`[.....]..VY..{.V...)..d..=.->
00:24:56.981647 IP asrockcentos8.34690 > asrockcentos8.postgres: Flags [P.], seq 343:711, ack 101, win 342, options [nop,nop,TS val 2680123508 ecr 2680123507], length 368
E.....@.@..............8... M@.....V.......
..pt..ps....k...g....47.x.....`T.._..-8~...JS./..`} I..?..............^A.....w:.yC...>.......,.+...0.../.......$.(.#.'.k.g.
...     ...9.3.....=.<.5./................
.................................". .............       .
.................2.". .............     .
...................     ..............+........-.....3.G.E...A.6....Vx+/.R.<<.....BL..../....................#....u/..d.j)h.c..
00:24:56.982584 IP asrockcentos8.34690 > asrockcentos8.postgres: Flags [.], ack 1515, win 1365, options [nop,nop,TS val 2680123509 ecr 2680123509], length 0
E..4..@.@..............8....M@.....U.......
..pu..pu
00:24:56.983989 IP asrockcentos8.34636 > asrockcentos8.postgres: Flags [.], ack 2287, win 1387, options [nop,nop,TS val 2680123511 ecr 2680123470], length 0
E..4..@.@............L.8>......m...k.......
..pw..pN
00:24:56.984100 IP asrockcentos8.34690 > asrockcentos8.postgres: Flags [P.], seq 711:717, ack 1515, win 1365, options [nop,nop,TS val 2680123511 ecr 2680123509], length 6
E..:..@.@..............8....M@.....U.......
..pw..pu......
00:24:56.985495 IP asrockcentos8.34690 > asrockcentos8.postgres: Flags [P.], seq 717:807, ack 1515, win 1365, options [nop,nop,TS val 2680123512 ecr 2680123509], length 90
E.....@.@..*...........8....M@.....U.......
..px..pu....U..;...I.?U.......:...8..-...3
.q      .
..gc@l.`......`O.v.X..hlCcI]].j'....EB............
00:24:56.985569 IP asrockcentos8.34690 > asrockcentos8.postgres: Flags [P.], seq 807:959, ack 1673, win 1365, options [nop,nop,TS val 2680123512 ecr 2680123512], length 152
E.....@.@..............8....M@.....U.'.....
..px..px........h.2OT^wP..z..`w..#
m...._QN.i]W...n.\e.b*......B.$).......{.....65....;'B.9*s...W..?...@.kvp.=....n.....5m.q...V.[..V...@...6lj....w#...!.'...7.
00:24:56.985885 IP asrockcentos8.34690 > asrockcentos8.postgres: Flags [P.], seq 959:1007, ack 1704, win 1365, options [nop,nop,TS val 2680123512 ecr 2680123512], length 48
E..d..@.@..R...........8....M@.=...U.......
..px..px....+4v....]_.z.!..>........g^"x0..$.......*.HC.
00:24:56.987254 IP asrockcentos8.34690 > asrockcentos8.postgres: Flags [P.], seq 1007:1087, ack 2049, win 1387, options [nop,nop,TS val 2680123514 ecr 2680123514], length 80
E.....@.@..1...........8....M@.....k.......
..pz..pz....K8..J.g.>6.fJ..7.....fo..9.D...X{.>..n..u.@..........;.Vw.Y..a.....=..4.....
00:24:56.987372 IP asrockcentos8.34690 > asrockcentos8.postgres: Flags [P.], seq 1087:1188, ack 2098, win 1387, options [nop,nop,TS val 2680123514 ecr 2680123514], length 101
E.....@.@..............8....M@.....k.......
..pz..pz....`./U].Bc.y_.x, .n....m.z.2 F.|.c.{.).?,.{:...:z..cw41.E..*..L;.p...../..x......"Fu0......g6...e..
00:24:56.987497 IP asrockcentos8.34690 > asrockcentos8.postgres: Flags [P.], seq 1188:1310, ack 2145, win 1387, options [nop,nop,TS val 2680123514 ecr 2680123514], length 122
E.....@.@..............8...mM@.....k.   .....
..pz..pz....u1.,...
..tH...`...8+o.....3.V.g{...h....:......|.#.....4Z...a...c........l\...:.D....A..t.V5....T.eS..E....w.,.b.]5~.
00:24:56.987597 IP asrockcentos8.34690 > asrockcentos8.postgres: Flags [P.], seq 1310:1391, ack 2237, win 1387, options [nop,nop,TS val 2680123514 ecr 2680123514], length 81
E.....@.@..-...........8....M@.R...k.......
..pz..pz....L..{..........!...*.$YPF.+.RZ(.E..aJCLk.._.T....gc..i..."F..z.....8-Z}...^Q'.
00:24:56.987919 IP asrockcentos8.34700 > asrockcentos8.postgres: Flags [S], seq 4105024797, win 43690, options [mss 65495,sackOK,TS val 2680123514 ecr 0,nop,wscale 7], length 0
E..<.3@.@..............8.......................
..pz........
00:24:56.987932 IP asrockcentos8.34700 > asrockcentos8.postgres: Flags [.], ack 305407910, win 342, options [nop,nop,TS val 2680123514 ecr 2680123514], length 0
E..4.4@.@..&...........8.....4'....V.......
..pz..pz
00:24:56.987997 IP asrockcentos8.34700 > asrockcentos8.postgres: Flags [P.], seq 0:8, ack 1, win 342, options [nop,nop,TS val 2680123515 ecr 2680123514], length 8
E..<.5@.@..............8.....4'....V.......
..p{..pz......./
00:24:56.988270 IP asrockcentos8.34700 > asrockcentos8.postgres: Flags [.], ack 2, win 342, options [nop,nop,TS val 2680123515 ecr 2680123515], length 0
E..4.6@.@..$...........8...&.4'....V.......
..p{..p{
00:24:56.989363 IP asrockcentos8.34700 > asrockcentos8.postgres: Flags [P.], seq 8:343, ack 2, win 342, options [nop,nop,TS val 2680123516 ecr 2680123515], length 335
E....7@.@..............8...&.4'....V.......
..p|..p{....J...F...S..LtK5..b0..4...@...g.Dk*....t .....oV#.r.,.P~...
..K+........M.>.......,.+...0.../.......$.(.#.'.k.g.
...     ...9.3.....=.<.5./................
.................................". .............       .
.................2.". .............     .
...................     ..............+........-.....3.&.$... .6.....W..
....Tp...h0.>.......W
00:24:56.990172 IP asrockcentos8.34700 > asrockcentos8.postgres: Flags [P.], seq 343:711, ack 101, win 342, options [nop,nop,TS val 2680123517 ecr 2680123516], length 368
E....8@.@..............8...u.4(
...V.......
..p}..p|....k...g...S..LtK5..b0..4...@...g.Dk*....t .....oV#.r.,.P~...
..K+........M.>.......,.+...0.../.......$.(.#.'.k.g.
...     ...9.3.....=.<.5./................
.................................". .............       .
.................2.". .............     .
...................     ..............+........-.....3.G.E...A...*.e..M..z|=i*..LU.j1.....*......z...4.L.j&].8...;.+.P....w...Q
00:24:56.991080 IP asrockcentos8.34700 > asrockcentos8.postgres: Flags [.], ack 1515, win 1365, options [nop,nop,TS val 2680123518 ecr 2680123518], length 0
E..4.9@.@..!...........8.....4-....U.......
..p~..p~
00:24:56.992464 IP asrockcentos8.34700 > asrockcentos8.postgres: Flags [P.], seq 711:717, ack 1515, win 1365, options [nop,nop,TS val 2680123519 ecr 2680123518], length 6
E..:.:@.@..............8.....4-....U.......
..p...p~......
00:24:56.992991 IP asrockcentos8.34652 > asrockcentos8.postgres: Flags [.], ack 2287, win 1387, options [nop,nop,TS val 2680123520 ecr 2680123479], length 0
E..4`.@.@.V..........\.8.....!.....k.......
..p...pW
00:24:56.993654 IP asrockcentos8.34700 > asrockcentos8.postgres: Flags [P.], seq 717:807, ack 1515, win 1365, options [nop,nop,TS val 2680123520 ecr 2680123518], length 90
E....;@.@..............8.....4-....U.......
..p...p~....U.....:\W....>*Y....'..P."T!..d...i.c.C...].........=.e8v.-..52.|v....vm.. .x.9!5...!.
00:24:56.993726 IP asrockcentos8.34700 > asrockcentos8.postgres: Flags [P.], seq 807:959, ack 1673, win 1365, options [nop,nop,TS val 2680123520 ecr 2680123520], length 152
E....<@.@..............8...E.4.....U.'.....
..p...p......:.......b(.f.....v.lx.... ..k..F...*Y.R.....c.....K.....9.AA..-...h3.#s.....       G.`....v.s/..X .U^@.`.B....".[.s......].LJm./.].`..ZKy...W6...SU(.d).!
00:24:56.994028 IP asrockcentos8.34700 > asrockcentos8.postgres: Flags [P.], seq 959:1007, ack 1704, win 1365, options [nop,nop,TS val 2680123521 ecr 2680123520], length 48
E..d.=@.@..............8.....4.M...U.......
..p...p.....+ ......e.J<.,_..6.s.../.^B..b..S..'....~.+.
00:24:56.995390 IP asrockcentos8.34700 > asrockcentos8.postgres: Flags [P.], seq 1007:1087, ack 2049, win 1387, options [nop,nop,TS val 2680123522 ecr 2680123522], length 80
E....>@.@..............8.....4/....k.......
..p...p.....K+4.3.h+.\..y...8.U<.enZy.N..=.......>....,.E..3....}%....  -.Cs...5..s29..;:
00:24:56.995502 IP asrockcentos8.34700 > asrockcentos8.postgres: Flags [P.], seq 1087:1188, ack 2098, win 1387, options [nop,nop,TS val 2680123522 ecr 2680123522], length 101
E....?@.@..............8...].4/....k.......
..p...p.....`....1k..x.....<l.h9..ec.X...H.s%...I..../.n.L...ss..[1D.<. ...E.2m;aN..gj....")E^..`o.3y(J.-.tI.
00:24:56.995625 IP asrockcentos8.34700 > asrockcentos8.postgres: Flags [P.], seq 1188:1310, ack 2145, win 1387, options [nop,nop,TS val 2680123522 ecr 2680123522], length 122
E....@@.@..............8.....40....k.   .....
..p...p.....u3....^'...D...vu..?\.`.%...L..J.v.A.....m...l.....k.\y..G../.I..orn*+.*..i...A....o0...}...i.n.w.7;..7....\i..n..IK..
00:24:56.995725 IP asrockcentos8.34700 > asrockcentos8.postgres: Flags [P.], seq 1310:1391, ack 2237, win 1387, options [nop,nop,TS val 2680123522 ecr 2680123522], length 81
E....A@.@..............8...<.40b...k.......
..p...p.....L..G~...:...C..L...!...G...S.;.........qz...[.i......'... ..bR..;mV&;.....S.%
00:24:56.996060 IP asrockcentos8.34704 > asrockcentos8.postgres: Flags [S], seq 2019881296, win 43690, options [mss 65495,sackOK,TS val 2680123523 ecr 0,nop,wscale 7], length 0
E..<.1@.@.."...........8xd.P...................
..p.........
00:24:56.996072 IP asrockcentos8.34704 > asrockcentos8.postgres: Flags [.], ack 830142598, win 342, options [nop,nop,TS val 2680123523 ecr 2680123523], length 0
E..4.2@.@..)...........8xd.Q1z.....V.......
..p...p.
00:24:56.996129 IP asrockcentos8.34704 > asrockcentos8.postgres: Flags [P.], seq 0:8, ack 1, win 342, options [nop,nop,TS val 2680123523 ecr 2680123523], length 8
E..<.3@.@.. ...........8xd.Q1z.....V.......
..p...p......../
00:24:56.996405 IP asrockcentos8.34704 > asrockcentos8.postgres: Flags [.], ack 2, win 342, options [nop,nop,TS val 2680123523 ecr 2680123523], length 0
E..4.4@.@..'...........8xd.Y1z.....V.......
..p...p.
00:24:56.997501 IP asrockcentos8.34704 > asrockcentos8.postgres: Flags [P.], seq 8:343, ack 2, win 342, options [nop,nop,TS val 2680123524 ecr 2680123523], length 335
E....5@.@..............8xd.Y1z.....V.......
..p...p.....J...F..,{..^y..~......6...QV......S\.*. ...7.....@{..C/........6.....m.I.>.......,.+...0.../.......$.(.#.'.k.g.
...     ...9.3.....=.<.5./................
.................................". .............       .
.................2.". .............     .
...................     ..............+........-.....3.&.$... a...(U.*epY..>.S.._+).j...Mh...W
00:24:56.998295 IP asrockcentos8.34704 > asrockcentos8.postgres: Flags [P.], seq 343:711, ack 101, win 342, options [nop,nop,TS val 2680123525 ecr 2680123524], length 368
E....6@.@..............8xd..1z.....V.......
..p...p.....k...g..,{..^y..~......6...QV......S\.*. ...7.....@{..C/........6.....m.I.>.......,.+...0.../.......$.(.#.'.k.g.
...     ...9.3.....=.<.5./................
.................................". .............       .
.................2.". .............     .
...................     ..............+........-.....3.G.E...A.p~.9..P......a.4."..X.r.>.P+.....        .F/.#.......(^E...w...R.9...E.
00:24:56.999197 IP asrockcentos8.34704 > asrockcentos8.postgres: Flags [.], ack 1515, win 1365, options [nop,nop,TS val 2680123526 ecr 2680123526], length 0
E..4.7@.@..$...........8xd..1z.p...U.......
..p...p.
00:24:57.000571 IP asrockcentos8.34704 > asrockcentos8.postgres: Flags [P.], seq 711:717, ack 1515, win 1365, options [nop,nop,TS val 2680123527 ecr 2680123526], length 6
E..:.8@.@..............8xd..1z.p...U.......
..p...p.......
00:24:57.001738 IP asrockcentos8.34704 > asrockcentos8.postgres: Flags [P.], seq 717:807, ack 1515, win 1365, options [nop,nop,TS val 2680123528 ecr 2680123526], length 90
E....9@.@..............8xd..1z.p...U.......
..p...p.....U.|.DH...k'.        +.O.........k.H9@....g.@.T.=.a.#.....M0WP.B..I......x].f.s.....N.!...   ..Q
00:24:57.001810 IP asrockcentos8.34704 > asrockcentos8.postgres: Flags [P.], seq 807:959, ack 1673, win 1365, options [nop,nop,TS val 2680123528 ecr 2680123528], length 152
E....:@.@..............8xd.x1z.....U.'.....
..p...p.......n4..R%......_..:._.%oA...D.v....._@..2Lq..S\..I).....v;IzIGi.>.....\.n.&...~.=n..=..n.....h......doN..p%2.1....<&.V."/|.......k.4..\..D.....=|3l..
00:24:57.001990 IP asrockcentos8.34662 > asrockcentos8.postgres: Flags [.], ack 2287, win 1387, options [nop,nop,TS val 2680123529 ecr 2680123488], length 0
E..4$.@.@..t.........f.8...........k.......
..p...p`
00:24:57.002117 IP asrockcentos8.34704 > asrockcentos8.postgres: Flags [P.], seq 959:1007, ack 1704, win 1365, options [nop,nop,TS val 2680123529 ecr 2680123529], length 48
E..d.;@.@..............8xd..1z.-...U.......
..p...p.....+.{7.N..u/t......6.........5..:.J..-..-..u]Y
00:24:57.003477 IP asrockcentos8.34704 > asrockcentos8.postgres: Flags [P.], seq 1007:1087, ack 2049, win 1387, options [nop,nop,TS val 2680123530 ecr 2680123530], length 80
E....<@.@..............8xd.@1{.....k.......
..p...p.....K'...........=....I.J.&.,.~F....E0......]...G.N...U..ej..V..y..}.....fh...`h
00:24:57.003595 IP asrockcentos8.34704 > asrockcentos8.postgres: Flags [P.], seq 1087:1188, ack 2098, win 1387, options [nop,nop,TS val 2680123530 ecr 2680123530], length 101
E....=@.@..............8xd..1{.....k.......
..p...p.....`..
.P....1.:D      Dz.g....|...U.Ct.H74l>i!{....W..v.<T.;....+.....m.'..)Vd.>R.DQ..l..QVdpXc..+....G.
00:24:57.003717 IP asrockcentos8.34704 > asrockcentos8.postgres: Flags [P.], seq 1188:1310, ack 2145, win 1387, options [nop,nop,TS val 2680123530 ecr 2680123530], length 122
E....>@.@..............8xd..1{.....k.   .....
..p...p.....u.{..p.[|......}..li .(.>..'.qH.._.,zl..wY.W...u.]E...fs&{..K...mH.q...#<N".y....x.E..?$.\,.2........x.Fr..?| ...a<It.
00:24:57.003814 IP asrockcentos8.34704 > asrockcentos8.postgres: Flags [P.], seq 1310:1391, ack 2237, win 1387, options [nop,nop,TS val 2680123530 ecr 2680123530], length 81
E....?@.@..............8xd.o1{.B...k.......
..p...p.....L1.T.D.I..0FJ.6.!.7...v._.H
K...c<d/.U.Kd...v..yl...D?....Q.z7L.bH
...i.G.V.J
00:24:57.004138 IP asrockcentos8.34712 > asrockcentos8.postgres: Flags [S], seq 2258650839, win 43690, options [mss 65495,sackOK,TS val 2680123531 ecr 0,nop,wscale 7], length 0
E..<.3@.@.. ...........8..F....................
..p.........
00:24:57.004151 IP asrockcentos8.34712 > asrockcentos8.postgres: Flags [.], ack 41861514, win 342, options [nop,nop,TS val 2680123531 ecr 2680123531], length 0
E..4.4@.@..'...........8..F..~.....V.......
..p...p.
00:24:57.004208 IP asrockcentos8.34712 > asrockcentos8.postgres: Flags [P.], seq 0:8, ack 1, win 342, options [nop,nop,TS val 2680123531 ecr 2680123531], length 8
E..<.5@.@..............8..F..~.....V.......
..p...p......../
00:24:57.004469 IP asrockcentos8.34712 > asrockcentos8.postgres: Flags [.], ack 2, win 342, options [nop,nop,TS val 2680123531 ecr 2680123531], length 0
E..4.6@.@..%...........8..F..~.....V.......
..p...p.
00:24:57.005520 IP asrockcentos8.34712 > asrockcentos8.postgres: Flags [P.], seq 8:343, ack 2, win 342, options [nop,nop,TS val 2680123532 ecr 2680123531], length 335
E....7@.@..............8..F..~.....V.......
..p...p.....J...F....C..L'.f>..o...._}.Z....Z..&... f..l....."......f...T]
Bd.)n\
.j.>.......,.+...0.../.......$.(.#.'.k.g.
...     ...9.3.....=.<.5./................
.................................". .............       .
.................2.". .............     .
...................     ..............+........-.....3.&.$... bZz.[.<.....^...q.....S2...S[..g
00:24:57.006281 IP asrockcentos8.34712 > asrockcentos8.postgres: Flags [P.], seq 343:711, ack 101, win 342, options [nop,nop,TS val 2680123533 ecr 2680123532], length 368
E....8@.@..............8..H/.~.....V.......
..p...p.....k...g....C..L'.f>..o...._}.Z....Z..&... f..l....."......f...T]
Bd.)n\
.j.>.......,.+...0.../.......$.(.#.'.k.g.
...     ...9.3.....=.<.5./................
.................................". .............       .
.................2.". .............     .
...................     ..............+........-.....3.G.E...A...}...Z.....P9.p..@....:.n.?....H@.....  ?..N.H.....D.%..+......E
00:24:57.007192 IP asrockcentos8.34712 > asrockcentos8.postgres: Flags [.], ack 1515, win 1365, options [nop,nop,TS val 2680123534 ecr 2680123534], length 0
E..4.9@.@.."...........8..I..~.t...U.......
..p...p.
00:24:57.008557 IP asrockcentos8.34712 > asrockcentos8.postgres: Flags [P.], seq 711:717, ack 1515, win 1365, options [nop,nop,TS val 2680123535 ecr 2680123534], length 6
E..:.:@.@..............8..I..~.t...U.......
..p...p.......
00:24:57.009612 IP asrockcentos8.34712 > asrockcentos8.postgres: Flags [P.], seq 717:807, ack 1515, win 1365, options [nop,nop,TS val 2680123536 ecr 2680123534], length 90
E....;@.@..............8..I..~.t...U.......
..p...p.....U....$.........CG.\....>....Nx...T.EH.Z8.5.S><d....}....<$x..U.......(b.k.h@F1...u.V.
00:24:57.009683 IP asrockcentos8.34712 > asrockcentos8.postgres: Flags [P.], seq 807:959, ack 1673, win 1365, options [nop,nop,TS val 2680123536 ecr 2680123536], length 152
E....<@.@..............8..I..~.....U.'.....
..p...p.......j..
.\..ey..m.Ts8R......8p.u......8....BAH.H.[g.X....BbP.......f......f....1
....7.T..../.......Ph..i.`..B..f....:d...X
....%.~s
....\.?....Z.....
00:24:57.009976 IP asrockcentos8.34712 > asrockcentos8.postgres: Flags [P.], seq 959:1007, ack 1704, win 1365, options [nop,nop,TS val 2680123536 ecr 2680123536], length 48
E..d.=@.@..............8..J..~.1...U.......
..p...p.....+f..<..f.j...9h...Z..OD..8y..A......u..[~.ua
00:24:57.011336 IP asrockcentos8.34712 > asrockcentos8.postgres: Flags [P.], seq 1007:1087, ack 2049, win 1387, options [nop,nop,TS val 2680123538 ecr 2680123538], length 80
E....>@.@..............8..J..~.....k.......
..p...p.....K.r./.S.....nm.g.......?#..!i.....2W..........>.V.....?f.....l.f.O......-*.7
00:24:57.011445 IP asrockcentos8.34712 > asrockcentos8.postgres: Flags [P.], seq 1087:1188, ack 2098, win 1387, options [nop,nop,TS val 2680123538 ecr 2680123538], length 101
E....?@.@..............8..K..~.....k.......
..p...p.....`(....{=.........y.#.E.....IV...#.{..L?....P...Y~t.3..k..l&%.zN.....rm....j..8.'.A...P.a.........
00:24:57.011567 IP asrockcentos8.34712 > asrockcentos8.postgres: Flags [P.], seq 1188:1310, ack 2145, win 1387, options [nop,nop,TS val 2680123538 ecr 2680123538], length 122
E....@@.@..............8..K|.~.....k.   .....
..p...p.....u].........9........X..M........P...,...~}~L.<7.E....}.X..[/..eH.f ......B......>b.
.d...m.....w...Ea%. ..>.8.'6.g..k.
00:24:57.011660 IP asrockcentos8.34712 > asrockcentos8.postgres: Flags [P.], seq 1310:1391, ack 2237, win 1387, options [nop,nop,TS val 2680123538 ecr 2680123538], length 81
E....A@.@..............8..K..~.F...k.......
..p...p.....L..... .Lc..        .........9.,.aC{.....)3...|1........8..wB...D..].       .\{Z...T_...".
00:24:57.011990 IP asrockcentos8.34670 > asrockcentos8.postgres: Flags [.], ack 2287, win 1387, options [nop,nop,TS val 2680123539 ecr 2680123497], length 0
E..4..@.@..k.........n.8..6.-......k.......
..p...pi
00:24:57.020989 IP asrockcentos8.34680 > asrockcentos8.postgres: Flags [.], ack 2287, win 1387, options [nop,nop,TS val 2680123548 ecr 2680123506], length 0
E..4..@.@............x.8        &./"......k.......
..p...pr
00:24:57.027995 IP asrockcentos8.34690 > asrockcentos8.postgres: Flags [.], ack 2287, win 1387, options [nop,nop,TS val 2680123555 ecr 2680123514], length 0
E..4..@.@..}...........8...8M@.....k.......
..p...pz
00:24:57.035989 IP asrockcentos8.34700 > asrockcentos8.postgres: Flags [.], ack 2287, win 1387, options [nop,nop,TS val 2680123563 ecr 2680123522], length 0
E..4.B@.@..............8.....40....k.......
..p...p.
00:24:57.043990 IP asrockcentos8.34704 > asrockcentos8.postgres: Flags [.], ack 2287, win 1387, options [nop,nop,TS val 2680123571 ecr 2680123530], length 0
E..4.@@.@..............8xd..1{.t...k.......
..p...p.
00:24:57.051989 IP asrockcentos8.34712 > asrockcentos8.postgres: Flags [.], ack 2287, win 1387, options [nop,nop,TS val 2680123579 ecr 2680123538], length 0
E..4.B@.@..............8..LG.~.x...k.......
..p...p.


