[dai@asrockcentos8 ~]$ sudo tcpdump -i lo -A dst port 5432
[sudo] dai のパスワード:
dropped privs to tcpdump
tcpdump: verbose output suppressed, use -v or -vv for full protocol decode
listening on lo, link-type EN10MB (Ethernet), capture size 262144 bytes
23:33:50.722805 IP asrockcentos8.37036 > asrockcentos8.postgres: Flags [S], seq 3421669093, win 43690, options [mss 65495,sackOK,TS val 2677057249 ecr 0,nop,wscale 7], length 0
E..<..@.@.1............8.......................
............
23:33:50.722825 IP asrockcentos8.37036 > asrockcentos8.postgres: Flags [.], ack 3287288165, win 342, options [nop,nop,TS val 2677057249 ecr 2677057249], length 0
E..4..@.@.1............8......  e...V.......
........
23:33:50.723994 IP asrockcentos8.37036 > asrockcentos8.postgres: Flags [P.], seq 0:8, ack 1, win 342, options [nop,nop,TS val 2677057250 ecr 2677057249], length 8
E..<..@.@.1............8......  e...V.......
.............../
23:33:50.724025 IP asrockcentos8.37036 > asrockcentos8.postgres: Flags [.], ack 2, win 342, options [nop,nop,TS val 2677057251 ecr 2677057251], length 0
E..4..@.@.1............8......  f...V.......
........
23:33:50.752190 IP asrockcentos8.37036 > asrockcentos8.postgres: Flags [P.], seq 8:343, ack 2, win 342, options [nop,nop,TS val 2677057279 ecr 2677057251], length 335
E.....@.@.0............8......  f...V.......
............J...F.......`..K.q.9...nKC.T;y...oR2.)
 .....k...9.~.L..E^...V.2.....x...>.......,.+...0.../.......$.(.#.'.k.g.
...     ...9.3.....=.<.5./................
.................................". .............       .
.................2.". .............     .
...................     ..............+........-.....3.&.$... rtp
o.......C..;......`..tW.M.wz
23:33:50.757343 IP asrockcentos8.37036 > asrockcentos8.postgres: Flags [P.], seq 343:711, ack 101, win 342, options [nop,nop,TS val 2677057284 ecr 2677057279], length 368
E.....@.@.0a...........8...=..  ....V.......
............k...g.......`..K.q.9...nKC.T;y...oR2.)
 .....k...9.~.L..E^...V.2.....x...>.......,.+...0.../.......$.(.#.'.k.g.
...     ...9.3.....=.<.5./................
.................................". .............       .
.................2.". .............     .
...................     ..............+........-.....3.G.E...A...;.(a...l..>.h{....w.Nx..A..{.8.....F....6M3!.-q.$1..1..e.Vn.j.
23:33:50.758279 IP asrockcentos8.37036 > asrockcentos8.postgres: Flags [.], ack 1515, win 1365, options [nop,nop,TS val 2677057285 ecr 2677057285], length 0
E..4..@.@.1............8.......O...U.......
........
23:33:50.762387 IP asrockcentos8.37036 > asrockcentos8.postgres: Flags [P.], seq 711:717, ack 1515, win 1365, options [nop,nop,TS val 2677057289 ecr 2677057285], length 6
E..:..@.@.1............8.......O...U.......
...     ..........
23:33:50.774135 IP asrockcentos8.37036 > asrockcentos8.postgres: Flags [P.], seq 717:807, ack 1515, win 1365, options [nop,nop,TS val 2677057301 ecr 2677057285], length 90
E.....@.@.1t...........8.......O...U.......
............U..N.       ...a<?_1..np...A...~c......F..%..;.;..n......}.>.......6Q?....<..y../.XK..O.....
23:33:50.775150 IP asrockcentos8.37036 > asrockcentos8.postgres: Flags [P.], seq 807:962, ack 1673, win 1365, options [nop,nop,TS val 2677057302 ecr 2677057301], length 155
E.....@.@.12...........8...........U.*.....
..............~|.R.....o<U.\L_6...........\...Z.ZV...8  .....2P..8.vW..(7...?r...R.x.Hk..o...y;. ....{i).n&...A...c.c...`...\I........L.(.~';[....<Y..M.!7...M.==.K4
23:33:50.778929 IP asrockcentos8.37036 > asrockcentos8.postgres: Flags [P.], seq 962:1056, ack 1738, win 1365, options [nop,nop,TS val 2677057305 ecr 2677057302], length 94
E.....@.@.1n...........8...........U.......
............Y.X....s...4e#) pc......z.].....b..ChK..(.....N.m|...A..Y[.ur..I._..]ot.*.Ac.Y
......04]..
23:33:50.793933 IP asrockcentos8.37036 > asrockcentos8.postgres: Flags [P.], seq 1056:1203, ack 1853, win 1365, options [nop,nop,TS val 2677057320 ecr 2677057305], length 147
E.....@.@.18...........8...........U.".....
...(.........."..e". ...J.F{..J..%V...t./`...o......4..M[......~-....'M.........&.&...|.u..]..+..?.Tr[..Y....
xY;(.....HV.N_.,....$....c`>0nmW...O8M...QT4.
23:33:50.801155 IP asrockcentos8.37036 > asrockcentos8.postgres: Flags [P.], seq 1203:1283, ack 2255, win 1387, options [nop,nop,TS val 2677057328 ecr 2677057321], length 80
E.....@.@.1z...........8.......3...k.......
...0...)....K..Z..b.1W.].c..]{.m.+.3}.<..%q......yxd.a.t...{..]..r.........r.f......c...
23:33:50.801362 IP asrockcentos8.37036 > asrockcentos8.postgres: Flags [P.], seq 1283:1384, ack 2304, win 1387, options [nop,nop,TS val 2677057328 ecr 2677057328], length 101
E.....@.@.1d...........8.......d...k.......
...0...0....`6."e...........TK...~......X.z.o. ~..WV..l...$H......Sp..cH...E}.| .AS..........*Xvk..g.....r{..
23:33:50.801557 IP asrockcentos8.37036 > asrockcentos8.postgres: Flags [P.], seq 1384:1506, ack 2351, win 1387, options [nop,nop,TS val 2677057328 ecr 2677057328], length 122
E.....@.@.1N...........8...N.......k.   .....
...0...0....u.}.9.an...i..s.-...S..b...Y.'.4.....9*n!..i....7(V,P..T......E|.*s...0{....l=.~.c...g.6...,.R|=~,.p\.3..a......Z)-...
23:33:50.801697 IP asrockcentos8.37036 > asrockcentos8.postgres: Flags [P.], seq 1506:1587, ack 2443, win 1387, options [nop,nop,TS val 2677057328 ecr 2677057328], length 81
E.....@.@.1v...........8...........k.......
...0...0....L...M...Ft.~.f..Yy..6.d..C...Cz1m....3............... .#4.F..?.J*...r....._..
23:33:50.805093 IP asrockcentos8.37036 > asrockcentos8.postgres: Flags [P.], seq 1587:1669, ack 2493, win 1387, options [nop,nop,TS val 2677057332 ecr 2677057328], length 82
E.....@.@.1t...........8.......!...k.......
...4...0....M2:E.t...RV.,.A....M%.      52......p.E...v.\>R.j.(.vL.E..x.*@.jY.j`..7.....aX..B+U
23:33:50.805305 IP asrockcentos8.37036 > asrockcentos8.postgres: Flags [P.], seq 1669:1783, ack 2541, win 1387, options [nop,nop,TS val 2677057332 ecr 2677057332], length 114
E.....@.@.1S...........8...k...Q...k.......
...4...4....m.......6..j.9.......,W.    ...n...qs..^2.M<..(]..&...C3.8.v.....=..z...H....h...N8\u. .... .G.e.0V.j........J;N.
23:33:50.810030 IP asrockcentos8.37036 > asrockcentos8.postgres: Flags [P.], seq 1783:1909, ack 2661, win 1387, options [nop,nop,TS val 2677057337 ecr 2677057332], length 126
E.....@.@.1F...........8...........k.......
...9...4....y..d....&%\[...0.f.E.Q...xZ.k`g
..........W.M.R.............]e.7.3.     ...M.4e.t....n.....]....9S.Aa!Z6kz'........b....W!20..
23:33:50.851000 IP asrockcentos8.37036 > asrockcentos8.postgres: Flags [.], ack 2783, win 1387, options [nop,nop,TS val 2677057378 ecr 2677057337], length 0
E..4..@.@.1............8...[...C...k.......
...b...9
23:33:50.908249 IP asrockcentos8.37044 > asrockcentos8.postgres: Flags [S], seq 3498578521, win 43690, options [mss 65495,sackOK,TS val 2677057435 ecr 0,nop,wscale 7], length 0
E..<y1@.@.>"...........8...Y...................
............
23:33:50.908266 IP asrockcentos8.37044 > asrockcentos8.postgres: Flags [.], ack 855134420, win 342, options [nop,nop,TS val 2677057435 ecr 2677057435], length 0
E..4y2@.@.>)...........8...Z2.P....V.......
........
23:33:50.908356 IP asrockcentos8.37044 > asrockcentos8.postgres: Flags [P.], seq 0:8, ack 1, win 342, options [nop,nop,TS val 2677057435 ecr 2677057435], length 8
E..<y3@.@.> ...........8...Z2.P....V.......
.............../
23:33:50.908646 IP asrockcentos8.37044 > asrockcentos8.postgres: Flags [.], ack 2, win 342, options [nop,nop,TS val 2677057435 ecr 2677057435], length 0
E..4y4@.@.>'...........8...b2.P....V.......
........
23:33:50.910098 IP asrockcentos8.37044 > asrockcentos8.postgres: Flags [P.], seq 8:343, ack 2, win 342, options [nop,nop,TS val 2677057437 ecr 2677057435], length 335
E...y5@.@.<............8...b2.P....V.......
............J...F...N.2.9I...H...0..Ac....D.{b.p... u........x......pvTnV..E.....FB0.>.......,.+...0.../.......$.(.#.'.k.g.
...     ...9.3.....=.<.5./................
.................................". .............       .
.................2.". .............     .
...................     ..............+........-.....3.&.$... .r..h...mq.]...:.!.....v.......I
23:33:50.911129 IP asrockcentos8.37044 > asrockcentos8.postgres: Flags [P.], seq 343:711, ack 101, win 342, options [nop,nop,TS val 2677057438 ecr 2677057437], length 368
E...y6@.@.<............8....2.Q8...V.......
............k...g...N.2.9I...H...0..Ac....D.{b.p... u........x......pvTnV..E.....FB0.>.......,.+...0.../.......$.(.#.'.k.g.
...     ...9.3.....=.<.5./................
.................................". .............       .
.................2.". .............     .
...................     ..............+........-.....3.G.E...A.j..'..F:.:.h.Tg.1...y@S....B..Sk..1".zF..w.d._Q...E}.Y8z..zL..\.
23:33:50.912074 IP asrockcentos8.37044 > asrockcentos8.postgres: Flags [.], ack 1515, win 1365, options [nop,nop,TS val 2677057439 ecr 2677057439], length 0
E..4y7@.@.>$...........8...!2.V....U.......
........
23:33:50.913993 IP asrockcentos8.37044 > asrockcentos8.postgres: Flags [P.], seq 711:717, ack 1515, win 1365, options [nop,nop,TS val 2677057441 ecr 2677057439], length 6
E..:y8@.@.>............8...!2.V....U.......
..............
23:33:50.915818 IP asrockcentos8.37044 > asrockcentos8.postgres: Flags [P.], seq 717:807, ack 1515, win 1365, options [nop,nop,TS val 2677057442 ecr 2677057439], length 90
E...y9@.@.=............8...'2.V....U.......
............Ur3j...i..7J...S....:7......?j.x.....Y
v..B.=.$....g0...vWs...b...].K..U......Nn*y/..D
23:33:50.915912 IP asrockcentos8.37044 > asrockcentos8.postgres: Flags [P.], seq 807:962, ack 1673, win 1365, options [nop,nop,TS val 2677057442 ecr 2677057442], length 155
E...y:@.@.=............8....2.W\...U.*.....
...............VL.......*......i.....$x.:eI......u..C...&...1c~..].j^..`7..x..R.J.s...f..V.Nv.....%.[...._?....[...Go.....l..(._.x......H...z..{.s6Wk..).L..6[..Mj.
23:33:50.916394 IP asrockcentos8.37044 > asrockcentos8.postgres: Flags [P.], seq 962:1056, ack 1738, win 1365, options [nop,nop,TS val 2677057443 ecr 2677057443], length 94
E...y;@.@.=............8....2.W....U.......
............Y..........@C].d
...H.S.Q.....w.3.._.^...!.{U'...<.f?D...3.:~...6`t.qJ.."@.../..p%.....s..
23:33:50.924126 IP asrockcentos8.37044 > asrockcentos8.postgres: Flags [P.], seq 1056:1203, ack 1853, win 1365, options [nop,nop,TS val 2677057451 ecr 2677057443], length 147
E...y<@.@.=............8...z2.X....U.".....
..............I.........k=[3....X.d.......R.g...|.V..<.|...L.f[x.b.^.F.6.....2.....8
|.C....],..Q.R.s...2......t.9....@]Q.K......:./.A..v.....#..... ....v.
23:33:50.924857 IP asrockcentos8.37044 > asrockcentos8.postgres: Flags [P.], seq 1203:1283, ack 2255, win 1387, options [nop,nop,TS val 2677057451 ecr 2677057451], length 80
E...y=@.@.=............8....2.Y....k.......
............Kl..n.N.b@...f.M.1R"..{T....l... .....|.PM]1.(o....M.!.*i.].        &.....&/....u*.
23:33:50.925038 IP asrockcentos8.37044 > asrockcentos8.postgres: Flags [P.], seq 1283:1384, ack 2304, win 1387, options [nop,nop,TS val 2677057452 ecr 2677057451], length 101
E...y>@.@.=............8...]2.Y....k.......
............`.u.\.T..
D.)..9]...k...j.^..}..g3=.y..Io..g.>.$%2.'n>...b..RMJ#..E.-......Qw.....W.....k.YM.h'n.
23:33:50.925207 IP asrockcentos8.37044 > asrockcentos8.postgres: Flags [P.], seq 1384:1506, ack 2351, win 1387, options [nop,nop,TS val 2677057452 ecr 2677057452], length 122
E...y?@.@.=............8....2.Z....k.   .....
............u.;..f........m.5g...#...~...K.&}.a.....Ne...uaM..F...,fs.6../@f.*$.lo'l.p...u...*.=..ry..&..?\....vI.....4.qr....2...
23:33:50.925341 IP asrockcentos8.37044 > asrockcentos8.postgres: Flags [P.], seq 1506:1587, ack 2443, win 1387, options [nop,nop,TS val 2677057452 ecr 2677057452], length 81
E...y@@.@.=............8...<2.Z^...k.......
............L.....x..Q.o.q.j..$...vj..W.y.-e.sJ1...W..n<QL....'g.zL^%...y?..P.\.._...F...
23:33:50.925780 IP asrockcentos8.37058 > asrockcentos8.postgres: Flags [S], seq 3812396409, win 43690, options [mss 65495,sackOK,TS val 2677057452 ecr 0,nop,wscale 7], length 0
E..<..@.@..:...........8.<.y...................
............
23:33:50.925797 IP asrockcentos8.37058 > asrockcentos8.postgres: Flags [.], ack 1008647522, win 342, options [nop,nop,TS val 2677057452 ecr 2677057452], length 0
E..4..@.@..A...........8.<.z<..b...V.......
........
23:33:50.925870 IP asrockcentos8.37058 > asrockcentos8.postgres: Flags [P.], seq 0:8, ack 1, win 342, options [nop,nop,TS val 2677057452 ecr 2677057452], length 8
E..<..@.@..8...........8.<.z<..b...V.......
.............../
23:33:50.926128 IP asrockcentos8.37058 > asrockcentos8.postgres: Flags [.], ack 2, win 342, options [nop,nop,TS val 2677057453 ecr 2677057453], length 0
E..4..@.@..?...........8.<..<..c...V.......
........
23:33:50.927353 IP asrockcentos8.37058 > asrockcentos8.postgres: Flags [P.], seq 8:343, ack 2, win 342, options [nop,nop,TS val 2677057454 ecr 2677057453], length 335
E.....@.@..............8.<..<..c...V.......
............J...F..,...[..`.A.b.....T.C............ gs........|....gy....:..I.@>h....>.......,.+...0.../.......$.(.#.'.k.g.
...     ...9.3.....=.<.5./................
.................................". .............       .
.................2.". .............     .
...................     ..............+........-.....3.&.$... 8....H3ZJr.l...hG......XH.....    .
23:33:50.928213 IP asrockcentos8.37058 > asrockcentos8.postgres: Flags [P.], seq 343:711, ack 101, win 342, options [nop,nop,TS val 2677057455 ecr 2677057454], length 368
E.....@.@..............8.<..<......V.......
............k...g..,...[..`.A.b.....T.C............ gs........|....gy....:..I.@>h....>.......,.+...0.../.......$.(.#.'.k.g.
...     ...9.3.....=.<.5./................
.................................". .............       .
.................2.". .............     .
...................     ..............+........-.....3.G.E...A....5....{M...>..............I8......n.W.#t.!..p.H..+.._.J....U.F
23:33:50.929165 IP asrockcentos8.37058 > asrockcentos8.postgres: Flags [.], ack 1515, win 1365, options [nop,nop,TS val 2677057456 ecr 2677057456], length 0
E..4..@.@..<...........8.<.A<..L...U.......
........
23:33:50.930745 IP asrockcentos8.37058 > asrockcentos8.postgres: Flags [P.], seq 711:717, ack 1515, win 1365, options [nop,nop,TS val 2677057457 ecr 2677057456], length 6
E..:..@.@..5...........8.<.A<..L...U.......
..............
23:33:50.932203 IP asrockcentos8.37058 > asrockcentos8.postgres: Flags [P.], seq 717:807, ack 1515, win 1365, options [nop,nop,TS val 2677057459 ecr 2677057456], length 90
E.... @.@..............8.<.G<..L...U.......
............U}......3Jnh.n..).HX(. ..4.Z.....p...6...=.o.*.7.Vr...<....L........$.b.}..,'.6.5.....
23:33:50.932291 IP asrockcentos8.37058 > asrockcentos8.postgres: Flags [P.], seq 807:962, ack 1673, win 1365, options [nop,nop,TS val 2677057459 ecr 2677057459], length 155
E....!@.@..............8.<..<......U.*.....
...............*K..e.I.";V.I.T.9..>.=
        {2....$u......Q.{=j........'.
h@...y....y3.y.......b ...+....B...P.+AXo..... .........^.....j<........`..^W.+....2C(J..8.$.Y
23:33:50.932737 IP asrockcentos8.37058 > asrockcentos8.postgres: Flags [P.], seq 962:1056, ack 1738, win 1365, options [nop,nop,TS val 2677057459 ecr 2677057459], length 94
E...."@.@..............8.<.<<..+...U.......
............Y.7.>...2.......[.&.?`......Q...7..(.p<O.V..ig...rm4.'.xI....13.......a..V..hi..Y..#Nc.g'.
23:33:50.940430 IP asrockcentos8.37058 > asrockcentos8.postgres: Flags [P.], seq 1056:1203, ack 1853, win 1365, options [nop,nop,TS val 2677057467 ecr 2677057459], length 147
E....#@.@..............8.<..<......U.".....
..............h....x......}.?.I.Zn      I F..*@.1v....N...v..,y^..G...3...E.~.7.e../.Q....      .z..w..bX.-c<<......M:mH....2...rU....@....r..@_6..|.c. l.a...@.,.S}O
23:33:50.941035 IP asrockcentos8.37058 > asrockcentos8.postgres: Flags [P.], seq 1203:1283, ack 2255, win 1387, options [nop,nop,TS val 2677057468 ecr 2677057467], length 80
E....$@.@..............8.<.-<..0...k.......
............K..s....S.V23U.']A.9...A......3Y.QE.'".e.. .......0......SF.s..A.8&(....<j{}
23:33:50.941178 IP asrockcentos8.37058 > asrockcentos8.postgres: Flags [P.], seq 1283:1384, ack 2304, win 1387, options [nop,nop,TS val 2677057468 ecr 2677057468], length 101
E....%@.@..............8.<.}<..a...k.......
............`...o..c"I....,..4Z..........9.......iv..Q. ..Bf}..i.b..j&qEj...1Y.......}....V.f..._.......7e...
23:33:50.941318 IP asrockcentos8.37058 > asrockcentos8.postgres: Flags [P.], seq 1384:1506, ack 2351, win 1387, options [nop,nop,TS val 2677057468 ecr 2677057468], length 122
E....&@.@..............8.<..<......k.   .....
............u..2.`z-.w#.G.d...y\.!x..!+;u.......#H.1.....a...a:z....".ct.m.y..}^.w `....s...+.7.:...X.3.Z".y.G...p....y.Y/@X....c.
23:33:50.941438 IP asrockcentos8.37058 > asrockcentos8.postgres: Flags [P.], seq 1506:1587, ack 2443, win 1387, options [nop,nop,TS val 2677057468 ecr 2677057468], length 81
E....'@.@..............8.<.\<......k.......
............L...r.VDp.r.......h......+).j..$.L..i..6.2..d...G.,%TO..."..+.".<6..:N.YN.1.`
23:33:50.941785 IP asrockcentos8.37070 > asrockcentos8.postgres: Flags [S], seq 2409217759, win 43690, options [mss 65495,sackOK,TS val 2677057468 ecr 0,nop,wscale 7], length 0
E..<%.@.@..c...........8.......................
............
23:33:50.941798 IP asrockcentos8.37070 > asrockcentos8.postgres: Flags [.], ack 1882603593, win 342, options [nop,nop,TS val 2677057468 ecr 2677057468], length 0
E..4%.@.@..j...........8....p6@I...V.......
........
23:33:50.941867 IP asrockcentos8.37070 > asrockcentos8.postgres: Flags [P.], seq 0:8, ack 1, win 342, options [nop,nop,TS val 2677057468 ecr 2677057468], length 8
E..<%.@.@..a...........8....p6@I...V.......
.............../
23:33:50.942115 IP asrockcentos8.37070 > asrockcentos8.postgres: Flags [.], ack 2, win 342, options [nop,nop,TS val 2677057469 ecr 2677057469], length 0
E..4%.@.@..h...........8....p6@J...V.......
........
23:33:50.943273 IP asrockcentos8.37070 > asrockcentos8.postgres: Flags [P.], seq 8:343, ack 2, win 342, options [nop,nop,TS val 2677057470 ecr 2677057469], length 335
E...%.@.@..............8....p6@J...V.......
............J...F.......4....F`... :.>
o.....$:.... .R....9..>O....t8...L(.].y*.l..c.>.......,.+...0.../.......$.(.#.'.k.g.
...     ...9.3.....=.<.5./................
.................................". .............       .
.................2.". .............     .
...................     ..............+........-.....3.&.$... Pg.:.9....J.!...=.x..I5e.].....J
23:33:50.944129 IP asrockcentos8.37070 > asrockcentos8.postgres: Flags [P.], seq 343:711, ack 101, win 342, options [nop,nop,TS val 2677057471 ecr 2677057470], length 368
E...%.@.@..............8...7p6@....V.......
............k...g.......4....F`... :.>
o.....$:.... .R....9..>O....t8...L(.].y*.l..c.>.......,.+...0.../.......$.(.#.'.k.g.
...     ...9.3.....=.<.5./................
.................................". .............       .
.................2.". .............     .
...................     ..............+........-.....3.G.E...A....z....h..ms...C......SA..'
.a...{[.Y.}.r..mRI.l..Tt.x....lu.(.
23:33:50.945060 IP asrockcentos8.37070 > asrockcentos8.postgres: Flags [.], ack 1515, win 1365, options [nop,nop,TS val 2677057472 ecr 2677057472], length 0
E..4%.@.@..e...........8....p6F3...U.......
........
23:33:50.946600 IP asrockcentos8.37070 > asrockcentos8.postgres: Flags [P.], seq 711:717, ack 1515, win 1365, options [nop,nop,TS val 2677057473 ecr 2677057472], length 6
E..:%.@.@..^...........8....p6F3...U.......
..............
23:33:50.947943 IP asrockcentos8.37070 > asrockcentos8.postgres: Flags [P.], seq 717:807, ack 1515, win 1365, options [nop,nop,TS val 2677057474 ecr 2677057472], length 90
E...%.@.@..     ...........8....p6F3...U.......
............U.....w.m#.....1.%......@..b......B....`.D..z..]...DB..@._}d..~...48..EH.c{....j...!.e
23:33:50.948024 IP asrockcentos8.37070 > asrockcentos8.postgres: Flags [P.], seq 807:962, ack 1673, win 1365, options [nop,nop,TS val 2677057475 ecr 2677057474], length 155
E...%.@.@..............8....p6F....U.*.....
..............cB&......A....<.<.....X..i........k8..U......'..  .Y.......'/.J....x..}&+....H.............e.Ec...L.&.F....\9....-H.&...P,..X...H.[...I....L.)m,.h...q
23:33:50.948580 IP asrockcentos8.37070 > asrockcentos8.postgres: Flags [P.], seq 962:1056, ack 1738, win 1365, options [nop,nop,TS val 2677057475 ecr 2677057475], length 94
E...%.@.@..............8....p6G....U.......
............Y....*Y.L^..W....,f.X.g.O .......F..lB..c.)C.3...Gp....pD..."..V7B......x...KjjD.:..d       .y..
23:33:50.956370 IP asrockcentos8.37070 > asrockcentos8.postgres: Flags [P.], seq 1056:1203, ack 1853, win 1365, options [nop,nop,TS val 2677057483 ecr 2677057475], length 147
E...%.@.@..............8....p6G....U.".....
.............m.W.j.:.aHV.....,..n.;wv..Y..KA .'..,w.Y.1....5..(Y.h..%...........6.......1.>     ....;3.>.....q.y.l.o...gq].x_.K#.......V*;....&.. ......=.I..@.
23:33:50.956928 IP asrockcentos8.37070 > asrockcentos8.postgres: Flags [P.], seq 1203:1283, ack 2255, win 1387, options [nop,nop,TS val 2677057483 ecr 2677057483], length 80
E...%.@.@..............8....p6I....k.......
............KJ+P.>..T..I.Q..8.E............e....V8.p..[!Z.4.p..............Z......tf..Id
23:33:50.957059 IP asrockcentos8.37070 > asrockcentos8.postgres: Flags [P.], seq 1283:1384, ack 2304, win 1387, options [nop,nop,TS val 2677057484 ecr 2677057483], length 101
E...%.@.@..............8....p6IH...k.......
............`...vL=..;..@.1b....Xj../..e..V..t...P..(\..B.@'x1.ht.!..aA....44...dl.....3......q...F.U.i.B.OT.
23:33:50.957190 IP asrockcentos8.37070 > asrockcentos8.postgres: Flags [P.], seq 1384:1506, ack 2351, win 1387, options [nop,nop,TS val 2677057484 ecr 2677057484], length 122
E...%.@.@..............8...Hp6Iw...k.   .....
............uH8lZ..>N...O.(..v.....|w..0.=...1..~W.).k....=......l._........%.Z..H.$#$...K{&.....@,|..o*_3u...L.......<.w...Yi....
23:33:50.957300 IP asrockcentos8.37070 > asrockcentos8.postgres: Flags [P.], seq 1506:1587, ack 2443, win 1387, options [nop,nop,TS val 2677057484 ecr 2677057484], length 81
E...%.@.@..............8....p6I....k.......
............LEv.O..$.2.
.....C..K...wk..-.t..u...       ..`..S.K...O.*..*....s5.9... q....      8.z.
23:33:50.957645 IP asrockcentos8.37076 > asrockcentos8.postgres: Flags [S], seq 3054907237, win 43690, options [mss 65495,sackOK,TS val 2677057484 ecr 0,nop,wscale 7], length 0
E..<o.@.@.G............8../e...................
............
23:33:50.957658 IP asrockcentos8.37076 > asrockcentos8.postgres: Flags [.], ack 861950978, win 342, options [nop,nop,TS val 2677057484 ecr 2677057484], length 0
E..4o.@.@.G............8../f3`T....V.......
........
23:33:50.957723 IP asrockcentos8.37076 > asrockcentos8.postgres: Flags [P.], seq 0:8, ack 1, win 342, options [nop,nop,TS val 2677057484 ecr 2677057484], length 8
E..<o.@.@.G............8../f3`T....V.......
.............../
23:33:50.957976 IP asrockcentos8.37076 > asrockcentos8.postgres: Flags [.], ack 2, win 342, options [nop,nop,TS val 2677057484 ecr 2677057484], length 0
E..4o.@.@.G............8../n3`T....V.......
........
23:33:50.959073 IP asrockcentos8.37076 > asrockcentos8.postgres: Flags [P.], seq 8:343, ack 2, win 342, options [nop,nop,TS val 2677057486 ecr 2677057484], length 335
E...o.@.@.F=...........8../n3`T....V.......
............J...F.....9U.J...UE-g.o.'.<....-._..n.. ..  .....3&......\........n.C.....>.......,.+...0.../.......$.(.#.'.k.g.
...     ...9.3.....=.<.5./................
.................................". .............       .
.................2.". .............     .
...................     ..............+........-.....3.&.$... =.T...9..*.....cT7V.x.V+y.(}.y\N
23:33:50.959894 IP asrockcentos8.37076 > asrockcentos8.postgres: Flags [P.], seq 343:711, ack 101, win 342, options [nop,nop,TS val 2677057486 ecr 2677057486], length 368
E...o.@.@.F............8..0.3`Tf...V.......
............k...g.....9U.J...UE-g.o.'.<....-._..n.. ..  .....3&......\........n.C.....>.......,.+...0.../.......$.(.#.'.k.g.
...     ...9.3.....=.<.5./................
.................................". .............       .
.................2.". .............     .
...................     ..............+........-.....3.G.E...A..pP..5.C.+g`:Cb.j.."KTm 7..-..->.V....R.....yU+`.3.\........d...
23:33:50.960822 IP asrockcentos8.37076 > asrockcentos8.postgres: Flags [.], ack 1515, win 1365, options [nop,nop,TS val 2677057487 ecr 2677057487], length 0
E..4o.@.@.G............8..2-3`Y....U.......
........
23:33:50.962263 IP asrockcentos8.37076 > asrockcentos8.postgres: Flags [P.], seq 711:717, ack 1515, win 1365, options [nop,nop,TS val 2677057489 ecr 2677057487], length 6
E..:o.@.@.G............8..2-3`Y....U.......
..............
23:33:50.963538 IP asrockcentos8.37076 > asrockcentos8.postgres: Flags [P.], seq 717:807, ack 1515, win 1365, options [nop,nop,TS val 2677057490 ecr 2677057487], length 90
E...o.@.@.G............8..233`Y....U.......
............U..C....$1..........~v.qV.-.".?.}m^...>4K/.j8GU&..%%o..x...{.n..Ju..*%._D.....T.>..n..
23:33:50.963615 IP asrockcentos8.37076 > asrockcentos8.postgres: Flags [P.], seq 807:962, ack 1673, win 1365, options [nop,nop,TS val 2677057490 ecr 2677057490], length 155
E...o.@.@.F............8..2.3`Z....U.*.....
.............GG...9.r..W.2..L}....#.nG..(..A..
P. ....qZ.mE....04jb.0@e.-...cro.Tf#6.b..w]...+.._.....1t.r..^f.!/.4...z...a....j.B.q...        `.
..iG..yS..3..m .....
.p(
23:33:50.964042 IP asrockcentos8.37076 > asrockcentos8.postgres: Flags [P.], seq 962:1056, ack 1738, win 1365, options [nop,nop,TS val 2677057491 ecr 2677057490], length 94
E...o.@.@.G(...........8..3(3`Z....U.......
............Y.......
.|..{..b!..U....VI..+.$t.(l....v.b].L...eJ..X..+RD..S.;#.>....o.L]..e.....'x..e|.
23:33:50.965991 IP asrockcentos8.37044 > asrockcentos8.postgres: Flags [.], ack 2493, win 1387, options [nop,nop,TS val 2677057493 ecr 2677057452], length 0
E..4yA@.@.>............8....2.Z....k.......
........
23:33:50.971706 IP asrockcentos8.37076 > asrockcentos8.postgres: Flags [P.], seq 1056:1203, ack 1853, win 1365, options [nop,nop,TS val 2677057498 ecr 2677057491], length 147
E...o.@.@.F............8..3.3`[>...U.".....
..............^.z.....0p.L&}%.....P.......LU...0......L}.....0.*.CGHPG.pb.Ghy..dGr..1G.pNJJ.~.........^..v.H......>.....P.88.d..bm..RT.6..D....j..T.Pd.IwEg
23:33:50.972255 IP asrockcentos8.37076 > asrockcentos8.postgres: Flags [P.], seq 1203:1283, ack 2255, win 1387, options [nop,nop,TS val 2677057499 ecr 2677057499], length 80
E...o.@.@.G4...........8..4.3`\....k.......
............K~@E..H..J...tE..'R.....Y.......T.a...w"...=..J.|i).ZG.........W.....d...K<?
23:33:50.972392 IP asrockcentos8.37076 > asrockcentos8.postgres: Flags [P.], seq 1283:1384, ack 2304, win 1387, options [nop,nop,TS val 2677057499 ecr 2677057499], length 101
E...o.@.@.G............8..4i3`]....k.......
............`>..V....m..n........VZ.....03.q.-.l]7.k......N@....%....%..mjcS...MV.P...m...`.w`[;..&.^R.......
23:33:50.972529 IP asrockcentos8.37076 > asrockcentos8.postgres: Flags [P.], seq 1384:1506, ack 2351, win 1387, options [nop,nop,TS val 2677057499 ecr 2677057499], length 122
E...o.@.@.G............8..4.3`]0...k.   .....
............u.......=.....PXj..U.j....ul.......M.Q....y......Y.Q..
>M....%"..!c".D..FL.Wo..h.p<S............x.......(.\D..t...5.t.
23:33:50.972638 IP asrockcentos8.37076 > asrockcentos8.postgres: Flags [P.], seq 1506:1587, ack 2443, win 1387, options [nop,nop,TS val 2677057499 ecr 2677057499], length 81
E...o.@.@.G0...........8..5H3`]....k.......
............L..-.G...a...N%..+...}q.|6.....<X....... ..r..<;B...1......K:d{d2..).........
23:33:50.972960 IP asrockcentos8.37092 > asrockcentos8.postgres: Flags [S], seq 3043181294, win 43690, options [mss 65495,sackOK,TS val 2677057499 ecr 0,nop,wscale 7], length 0
E..<a.@.@.U............8.cB....................
............
23:33:50.972974 IP asrockcentos8.37092 > asrockcentos8.postgres: Flags [.], ack 3215206394, win 342, options [nop,nop,TS val 2677057499 ecr 2677057499], length 0
E..4a.@.@.U............8.cB...'....V.......
........
23:33:50.973040 IP asrockcentos8.37092 > asrockcentos8.postgres: Flags [P.], seq 0:8, ack 1, win 342, options [nop,nop,TS val 2677057500 ecr 2677057499], length 8
E..<a.@.@.U............8.cB...'....V.......
.............../
23:33:50.973298 IP asrockcentos8.37092 > asrockcentos8.postgres: Flags [.], ack 2, win 342, options [nop,nop,TS val 2677057500 ecr 2677057500], length 0
E..4a.@.@.U............8.cB...'....V.......
........
23:33:50.974371 IP asrockcentos8.37092 > asrockcentos8.postgres: Flags [P.], seq 8:343, ack 2, win 342, options [nop,nop,TS val 2677057501 ecr 2677057500], length 335
E...a.@.@.TD...........8.cB...'....V.......
............J...F....].....u..!A..9fn'I.3.G...?.hg. .4.tt.}'....O..9.:...
....e:qM&..>.......,.+...0.../.......$.(.#.'.k.g.
...     ...9.3.....=.<.5./................
.................................". .............       .
.................2.". .............     .
...................     ..............+........-.....3.&.$... .iCl.?.....j.
}n.Y.T|...I...ckZ4
23:33:50.975180 IP asrockcentos8.37092 > asrockcentos8.postgres: Flags [P.], seq 343:711, ack 101, win 342, options [nop,nop,TS val 2677057502 ecr 2677057501], length 368
E...a.@.@.T"...........8.cDF..(^...V.......
............k...g....].....u..!A..9fn'I.3.G...?.hg. .4.tt.}'....O..9.:...
....e:qM&..>.......,.+...0.../.......$.(.#.'.k.g.
...     ...9.3.....=.<.5./................
.................................". .............       .
.................2.". .............     .
...................     ..............+........-.....3.G.E...A....$...j.....Zx  .(Td......3.9.G...._^.i.....yi........%../,U..$n
23:33:50.976101 IP asrockcentos8.37092 > asrockcentos8.postgres: Flags [.], ack 1515, win 1365, options [nop,nop,TS val 2677057503 ecr 2677057503], length 0
E..4a.@.@.U............8.cE...-....U.......
........
23:33:50.977525 IP asrockcentos8.37092 > asrockcentos8.postgres: Flags [P.], seq 711:717, ack 1515, win 1365, options [nop,nop,TS val 2677057504 ecr 2677057503], length 6
E..:a.@.@.U............8.cE...-....U.......
..............
23:33:50.978674 IP asrockcentos8.37092 > asrockcentos8.postgres: Flags [P.], seq 717:807, ack 1515, win 1365, options [nop,nop,TS val 2677057505 ecr 2677057503], length 90
E...a.@.@.U5...........8.cE...-....U.......
............UI..=..x....j..........0...,..."{.m.."...3......>.G.oL~._...c...{...T9.9d..........V..
23:33:50.978747 IP asrockcentos8.37092 > asrockcentos8.postgres: Flags [P.], seq 807:962, ack 1673, win 1365, options [nop,nop,TS val 2677057505 ecr 2677057505], length 155
E...a.@.@.T............8.cF........U.*.....
..............9f        p_....!.ZM.......{.g#....Bm.....j8..w.p.2e.a....\.._.c..T.).:Y.V.B...S...-.".I...........)..(Z.5U....R9.w..~......5...a.I....s..0.,E(].8..I.....        .
23:33:50.979164 IP asrockcentos8.37092 > asrockcentos8.postgres: Flags [P.], seq 962:1056, ack 1738, win 1365, options [nop,nop,TS val 2677057506 ecr 2677057506], length 94
E...a.@.@.U/...........8.cF........U.......
............Y...+g..w.G...p..&t:.B.
        ..b..U.6.b..t.Y..xy...O.
.......j.w.^........-/./.b<..7d.<F..E
..
23:33:50.981990 IP asrockcentos8.37058 > asrockcentos8.postgres: Flags [.], ack 2493, win 1387, options [nop,nop,TS val 2677057509 ecr 2677057468], length 0
E..4.(@.@..2...........8.<..<......k.......
........
23:33:50.986835 IP asrockcentos8.37092 > asrockcentos8.postgres: Flags [P.], seq 1056:1203, ack 1853, win 1365, options [nop,nop,TS val 2677057513 ecr 2677057506], length 147
E...a.@.@.T............8.cG.../6...U.".....
..............6BO'7i..S5.rn.U..bX.....bb...........uA....@.oF..>.y....x.S...JbO.xR.l-....d.......!m....8.nD.....Sd=o.:.\B.%{...=..qb.?..#..5..../..`.kH5Ut~
23:33:50.987377 IP asrockcentos8.37092 > asrockcentos8.postgres: Flags [P.], seq 1203:1283, ack 2255, win 1387, options [nop,nop,TS val 2677057514 ecr 2677057514], length 80
E...a.@.@.U;...........8.cG...0....k.......
............K..e....4.P{.b...i.$...R..........R..Cv.....|.S_.....$7VZ.P.M...N...
.y..qCF
23:33:50.987499 IP asrockcentos8.37092 > asrockcentos8.postgres: Flags [P.], seq 1283:1384, ack 2304, win 1387, options [nop,nop,TS val 2677057514 ecr 2677057514], length 101
E...a.@.@.U%...........8.cG...0....k.......
............`...'.J...\/....0...f...l..A5.........].e.L.[.c......z......oM.t..oc.....K.G.T.!DZ.jz.0...8.D.L,-
23:33:50.987634 IP asrockcentos8.37092 > asrockcentos8.postgres: Flags [P.], seq 1384:1506, ack 2351, win 1387, options [nop,nop,TS val 2677057514 ecr 2677057514], length 122
E...a.@.@.U............8.cHW..1(...k.   .....
............u.......%.F...mE........?...3....I.{.*Qe5#...2.=.sJ*.]...l..s...7...v...{b... a...J..
.>.g..E..>...p9 .......w..G..P.:
23:33:50.987738 IP asrockcentos8.37092 > asrockcentos8.postgres: Flags [P.], seq 1506:1587, ack 2443, win 1387, options [nop,nop,TS val 2677057514 ecr 2677057514], length 81
E...a.@.@.U7...........8.cH...1....k.......
............L..z...N.C..M...(...0...8..cnlx..&.
jX..n.f.....t~.....l...7\.....a......g...
23:33:50.988099 IP asrockcentos8.37106 > asrockcentos8.postgres: Flags [S], seq 1100517315, win 43690, options [mss 65495,sackOK,TS val 2677057515 ecr 0,nop,wscale 7], length 0
E..<.J@.@..     ...........8A......................
............
23:33:50.988113 IP asrockcentos8.37106 > asrockcentos8.postgres: Flags [.], ack 1439053648, win 342, options [nop,nop,TS val 2677057515 ecr 2677057515], length 0
E..4.K@.@..............8A...U.7P...V.......
........
23:33:50.988175 IP asrockcentos8.37106 > asrockcentos8.postgres: Flags [P.], seq 0:8, ack 1, win 342, options [nop,nop,TS val 2677057515 ecr 2677057515], length 8
E..<.L@.@..............8A...U.7P...V.......
.............../
23:33:50.988430 IP asrockcentos8.37106 > asrockcentos8.postgres: Flags [.], ack 2, win 342, options [nop,nop,TS val 2677057515 ecr 2677057515], length 0
E..4.M@.@..............8A...U.7Q...V.......
........
23:33:50.989639 IP asrockcentos8.37106 > asrockcentos8.postgres: Flags [P.], seq 8:343, ack 2, win 342, options [nop,nop,TS val 2677057516 ecr 2677057515], length 335
E....N@.@..............8A...U.7Q...V.......
............J...F...+1._.z[.u?.:a_oZ    .._^.....bk.%G .... ....m.u...y....wy..Z........>.......,.+...0.../.......$.(.#.'.k.g.
...     ...9.3.....=.<.5./................
.................................". .............       .
.................2.". .............     .
...................     ..............+........-.....3.&.$... ...V..S..q....w.x4/..,...')..xd+
23:33:50.990470 IP asrockcentos8.37106 > asrockcentos8.postgres: Flags [P.], seq 343:711, ack 101, win 342, options [nop,nop,TS val 2677057517 ecr 2677057516], length 368
E....O@.@..............8A...U.7....V.......
............k...g...+1._.z[.u?.:a_oZ    .._^.....bk.%G .... ....m.u...y....wy..Z........>.......,.+...0.../.......$.(.#.'.k.g.
...     ...9.3.....=.<.5./................
.................................". .............       .
.................2.". .............     .
...................     ..............+........-.....3.G.E...A.P. ...s..k9z....qZ.@.:Q.....).,#:..X.m+*..Y..+..i.........x..?+e
23:33:50.991392 IP asrockcentos8.37106 > asrockcentos8.postgres: Flags [.], ack 1515, win 1365, options [nop,nop,TS val 2677057518 ecr 2677057518], length 0
E..4.P@.@..............8A...U.=:...U.......
........
23:33:50.992899 IP asrockcentos8.37106 > asrockcentos8.postgres: Flags [P.], seq 711:717, ack 1515, win 1365, options [nop,nop,TS val 2677057519 ecr 2677057518], length 6
E..:.Q@.@..............8A...U.=:...U.......
..............
23:33:50.993972 IP asrockcentos8.37106 > asrockcentos8.postgres: Flags [P.], seq 717:807, ack 1515, win 1365, options [nop,nop,TS val 2677057520 ecr 2677057518], length 90
E....R@.@..............8A...U.=:...U.......
............U.{........H..I.t..y......6V..c....SV.Ho.J,x....)..x4...
.z
..x..q.P,..!....7.z......&
23:33:50.994048 IP asrockcentos8.37106 > asrockcentos8.postgres: Flags [P.], seq 807:962, ack 1673, win 1365, options [nop,nop,TS val 2677057521 ecr 2677057521], length 155
E....S@.@..m...........8A...U.=....U.*.....
............._.d#..4....0.8....GS.9.:.t....<....{.{. ...........^X...   .[.%4...6_.....a.....'.Z#... .....(.....n......d......).[../|U[..g.."("T.........E]....L.^9\.
23:33:50.994445 IP asrockcentos8.37106 > asrockcentos8.postgres: Flags [P.], seq 962:1056, ack 1738, win 1365, options [nop,nop,TS val 2677057521 ecr 2677057521], length 94
E....T@.@..............8A...U.>....U.......
............Y.F.M...X...........7t.b.....I.Do.aeq.:..&..T.W...jf....f....g.6....j.....u...f...jo.~..pS
23:33:50.997990 IP asrockcentos8.37070 > asrockcentos8.postgres: Flags [.], ack 2493, win 1387, options [nop,nop,TS val 2677057525 ecr 2677057484], length 0
E..4&.@.@..[...........8....p6J....k.......
........
23:33:51.002085 IP asrockcentos8.37106 > asrockcentos8.postgres: Flags [P.], seq 1056:1203, ack 1853, win 1365, options [nop,nop,TS val 2677057529 ecr 2677057521], length 147
E....U@.@..s...........8A...U.>....U.".....
..............OM.j8...h........#_.f.mE..[..0).....$tW.M.......R3;.U..Z%a......<...........)C.t...UA5T.....U:....,..t..@..,...t.......?...d.p./v.Wv.....a.P.
23:33:51.002680 IP asrockcentos8.37106 > asrockcentos8.postgres: Flags [P.], seq 1203:1283, ack 2255, win 1387, options [nop,nop,TS val 2677057529 ecr 2677057529], length 80
E....V@.@..............8A..wU.@....k.......
............K.CM....T..b..,L..XN....r...R... 3.<_..P......0..W..k.$..}r.....N.*^z.....).
23:33:51.002854 IP asrockcentos8.37106 > asrockcentos8.postgres: Flags [P.], seq 1283:1384, ack 2304, win 1387, options [nop,nop,TS val 2677057529 ecr 2677057529], length 101
E....W@.@..............8A...U.@O...k.......
............`....q<.]..6....
..!....>.x...0>... /.L.......0....B>$..G..93..z^........3F@.&9..UCM..g..g.&.Ob.s
23:33:51.002994 IP asrockcentos8.37106 > asrockcentos8.postgres: Flags [P.], seq 1384:1506, ack 2351, win 1387, options [nop,nop,TS val 2677057530 ecr 2677057529], length 122
E....X@.@..............8A..,U.@~...k.   .....
............uq....>.r....qo.i.aX.G....3GSME....U.. ..2|.0vQp.c>..4 ."2....ko.2...t....p...vO..\..0.....H..6?k.....9rm_.m.9f..g....
23:33:51.003102 IP asrockcentos8.37106 > asrockcentos8.postgres: Flags [P.], seq 1506:1587, ack 2443, win 1387, options [nop,nop,TS val 2677057530 ecr 2677057530], length 81
E....Y@.@..............8A...U.@....k.......
............L.G......._....6En/....Oi..[......g)..^...#.....@&.<.b~OO....?Nm.lN<.m..g..w.
23:33:51.003449 IP asrockcentos8.37118 > asrockcentos8.postgres: Flags [S], seq 3641508360, win 43690, options [mss 65495,sackOK,TS val 2677057530 ecr 0,nop,wscale 7], length 0
E..<."@.@..1...........8.......................
............
23:33:51.003464 IP asrockcentos8.37118 > asrockcentos8.postgres: Flags [.], ack 2738187911, win 342, options [nop,nop,TS val 2677057530 ecr 2677057530], length 0
E..4.#@.@..8...........8...     .5n....V.......
........
23:33:51.003528 IP asrockcentos8.37118 > asrockcentos8.postgres: Flags [P.], seq 0:8, ack 1, win 342, options [nop,nop,TS val 2677057530 ecr 2677057530], length 8
E..<.$@.@../...........8...     .5n....V.......
.............../
23:33:51.003787 IP asrockcentos8.37118 > asrockcentos8.postgres: Flags [.], ack 2, win 342, options [nop,nop,TS val 2677057530 ecr 2677057530], length 0
E..4.%@.@..6...........8.....5n....V.......
........
23:33:51.004823 IP asrockcentos8.37118 > asrockcentos8.postgres: Flags [P.], seq 8:343, ack 2, win 342, options [nop,nop,TS val 2677057531 ecr 2677057530], length 335
E....&@.@..............8.....5n....V.......
............J...F..P....T{!V...T.%...r...n.*.>..}.. .k.o..
....-<..bK#..K[hX.s...d...>.......,.+...0.../.......$.(.#.'.k.g.
...     ...9.3.....=.<.5./................
.................................". .............       .
.................2.". .............     .
...................     ..............+........-.....3.&.$... ...5YX......Y..<x.k..P....J'p {D
23:33:51.005605 IP asrockcentos8.37118 > asrockcentos8.postgres: Flags [P.], seq 343:711, ack 101, win 342, options [nop,nop,TS val 2677057532 ecr 2677057531], length 368
E....'@.@..............8...`.5n....V.......
............k...g..P....T{!V...T.%...r...n.*.>..}.. .k.o..
....-<..bK#..K[hX.s...d...>.......,.+...0.../.......$.(.#.'.k.g.
...     ...9.3.....=.<.5./................
.................................". .............       .
.................2.". .............     .
...................     ..............+........-.....3.G.E...A....u....Ui\O....I!..K..-...m............B.P..%......
.u.z.k$gXOz
23:33:51.006528 IP asrockcentos8.37118 > asrockcentos8.postgres: Flags [.], ack 1515, win 1365, options [nop,nop,TS val 2677057533 ecr 2677057533], length 0
E..4.(@.@..3...........8.....5tq...U.......
........
23:33:51.007883 IP asrockcentos8.37118 > asrockcentos8.postgres: Flags [P.], seq 711:717, ack 1515, win 1365, options [nop,nop,TS val 2677057534 ecr 2677057533], length 6
E..:.)@.@..,...........8.....5tq...U.......
..............
23:33:51.008938 IP asrockcentos8.37118 > asrockcentos8.postgres: Flags [P.], seq 717:807, ack 1515, win 1365, options [nop,nop,TS val 2677057535 ecr 2677057533], length 90
E....*@.@..............8.....5tq...U.......
............U..).mb..~..,..n|..D8
08"..pP.0I..)j...E....#....W.rr.G0u+.S6.#.3...Y....E=Kw./x.....m
23:33:51.009013 IP asrockcentos8.37118 > asrockcentos8.postgres: Flags [P.], seq 807:962, ack 1673, win 1365, options [nop,nop,TS val 2677057536 ecr 2677057535], length 155
E....+@.@..............8...0.5u....U.*.....
..............q\..|j$...p....;..5zZ k..$=...s...]..r..0........r6l.e..'........3|(...@.....^.K_v...sidXK.9...A.............Slt.....]/.[+.i.     n..)(..8...-UY.].`...0.
23:33:51.009388 IP asrockcentos8.37118 > asrockcentos8.postgres: Flags [P.], seq 962:1056, ack 1738, win 1365, options [nop,nop,TS val 2677057536 ecr 2677057536], length 94
E....,@.@..............8.....5uP...U.......
............Y.}...r.=i->F.S.../.....f..2..P..td.L^6]iW.1K.J.:...^....(...-..@.  .[...(....A.4.L#..$...W
23:33:51.013989 IP asrockcentos8.37076 > asrockcentos8.postgres: Flags [.], ack 2493, win 1387, options [nop,nop,TS val 2677057541 ecr 2677057499], length 0
E..4o.@.@.G............8..5.3`]....k.......
........
23:33:51.017052 IP asrockcentos8.37118 > asrockcentos8.postgres: Flags [P.], seq 1056:1203, ack 1853, win 1365, options [nop,nop,TS val 2677057544 ecr 2677057536], length 147
E....-@.@..............8...).5u....U.".....
.................w./..a.B..7...C.}.`..R....Q^K.-.%{..../....F...?.W.a.T.G..     .Pb.l=..A_f....~a..,...X=.V.$..q...P...]...l...P......9#B...[U......r1>.......!
23:33:51.017586 IP asrockcentos8.37118 > asrockcentos8.postgres: Flags [P.], seq 1203:1283, ack 2255, win 1387, options [nop,nop,TS val 2677057544 ecr 2677057544], length 80
E.....@.@..............8.....5wU...k.......
............K.]..&.S.?I;.a..Q.jG....z&...t..b..C...#h....G.l....>......h...%6..r..M.Q..H
23:33:51.017707 IP asrockcentos8.37118 > asrockcentos8.postgres: Flags [P.], seq 1283:1384, ack 2304, win 1387, options [nop,nop,TS val 2677057544 ecr 2677057544], length 101
E..../@.@..............8.....5w....k.......
............`R.....w...>=...~7`....}Q..{.R|........_x..G....C..H.Og..........v...(b.z..bs.@m........:..j.1.r.
23:33:51.017833 IP asrockcentos8.37118 > asrockcentos8.postgres: Flags [P.], seq 1384:1506, ack 2351, win 1387, options [nop,nop,TS val 2677057544 ecr 2677057544], length 122
E....0@.@..............8...q.5w....k.   .....
............uQ  .....Cn...*..G...       ........k0........b.......S.jr4.}...OpHHr...L..Z.,.m.g6B."..@2....I.'Z....2q.Ai^......Y...(.-H.k.
23:33:51.017936 IP asrockcentos8.37118 > asrockcentos8.postgres: Flags [P.], seq 1506:1587, ack 2443, win 1387, options [nop,nop,TS val 2677057544 ecr 2677057544], length 81
E....1@.@..............8.....5x....k.......
............L....b(..F....lB6."/80W.:..#....;`.i...Q9..gkR...'...................z..>W;[.
23:33:51.018280 IP asrockcentos8.37128 > asrockcentos8.postgres: Flags [S], seq 2675565305, win 43690, options [mss 65495,sackOK,TS val 2677057545 ecr 0,nop,wscale 7], length 0
E..<FZ@.@.p............8.y.....................
...     ........
23:33:51.018295 IP asrockcentos8.37128 > asrockcentos8.postgres: Flags [.], ack 964074405, win 342, options [nop,nop,TS val 2677057545 ecr 2677057545], length 0
E..4F[@.@.q............8.y..9v.....V.......
...     ...
23:33:51.018357 IP asrockcentos8.37128 > asrockcentos8.postgres: Flags [P.], seq 0:8, ack 1, win 342, options [nop,nop,TS val 2677057545 ecr 2677057545], length 8
E..<F\@.@.p............8.y..9v.....V.......
...     ...     ......./
23:33:51.018605 IP asrockcentos8.37128 > asrockcentos8.postgres: Flags [.], ack 2, win 342, options [nop,nop,TS val 2677057545 ecr 2677057545], length 0
E..4F]@.@.p............8.y..9v.....V.......
...     ...
23:33:51.019633 IP asrockcentos8.37128 > asrockcentos8.postgres: Flags [P.], seq 8:343, ack 2, win 342, options [nop,nop,TS val 2677057546 ecr 2677057545], length 335
E...F^@.@.o............8.y..9v.....V.......
...
...     ....J...F..... .......+;2......Y".x^u....r\ .8zv4
P..Pr.....U. U......e}...l.>.......,.+...0.../.......$.(.#.'.k.g.
...     ...9.3.....=.<.5./................
.................................". .............       .
.................2.". .............     .
...................     ..............+........-.....3.&.$... ....LOh....(..p7.Lu*V.x.\.......
23:33:51.020387 IP asrockcentos8.37128 > asrockcentos8.postgres: Flags [P.], seq 343:711, ack 101, win 342, options [nop,nop,TS val 2677057547 ecr 2677057546], length 368
E...F_@.@.o............8.y.Q9v. ...V.......
.......
....k...g..... .......+;2......Y".x^u....r\ .8zv4
P..Pr.....U. U......e}...l.>.......,.+...0.../.......$.(.#.'.k.g.
...     ...9.3.....=.<.5./................
.................................". .............       .
.................2.". .............     .
...................     ..............+........-.....3.G.E...A.CK...!..w.z..I...Y.p..d.....Q/A.1..mG.....%[..08.% .j|>*.&......
23:33:51.021293 IP asrockcentos8.37128 > asrockcentos8.postgres: Flags [.], ack 1515, win 1365, options [nop,nop,TS val 2677057548 ecr 2677057548], length 0
E..4F`@.@.p............8.y..9v.....U.......
........
23:33:51.022647 IP asrockcentos8.37128 > asrockcentos8.postgres: Flags [P.], seq 711:717, ack 1515, win 1365, options [nop,nop,TS val 2677057549 ecr 2677057548], length 6
E..:Fa@.@.p............8.y..9v.....U.......
..............
23:33:51.023677 IP asrockcentos8.37128 > asrockcentos8.postgres: Flags [P.], seq 717:807, ack 1515, win 1365, options [nop,nop,TS val 2677057550 ecr 2677057548], length 90
E...Fb@.@.p............8.y..9v.....U.......
............U\N.wc).....aG.........Y......x0._.f.;..+=.E!N...........M...E.."........P..U...z.B..D
23:33:51.023748 IP asrockcentos8.37128 > asrockcentos8.postgres: Flags [P.], seq 807:962, ack 1673, win 1365, options [nop,nop,TS val 2677057550 ecr 2677057550], length 155
E...Fc@.@.p]...........8.y.!9v.-...U.*.....
.............}|.=r.F.....e.bI.S*BG.;.....Q..*......#....*..7.'P.Y.h...........F*.-..9y^.Ii..T.s....5+iw.p.[.D)a........_.....uC>:.Y......L.jP.~ .k.7....\..F..r"k.R
23:33:51.024108 IP asrockcentos8.37128 > asrockcentos8.postgres: Flags [P.], seq 962:1056, ack 1738, win 1365, options [nop,nop,TS val 2677057551 ecr 2677057550], length 94
E...Fd@.@.p............8.y..9v.n...U.......
............Y.C...B8h..6...2lhTf.......=,\ZO...N....A.%.................:-.r.O.4..tQ.P..." p(....A.z..
23:33:51.028991 IP asrockcentos8.37092 > asrockcentos8.postgres: Flags [.], ack 2493, win 1387, options [nop,nop,TS val 2677057556 ecr 2677057514], length 0
E..4a.@.@.U............8.cI"..1....k.......
........
23:33:51.031790 IP asrockcentos8.37128 > asrockcentos8.postgres: Flags [P.], seq 1056:1203, ack 1853, win 1365, options [nop,nop,TS val 2677057558 ecr 2677057551], length 147
E...Fe@.@.pc...........8.y..9v.....U.".....
.............[E.)....\Ge.'........!...>.c@..3..v..);<D.H#.....2...Z..".;Ls..Vfvhi.......*..U..#L!...c...]]L2Wb...re.t..()'owe.7..A. .......9p.:-W....M....2
23:33:51.032302 IP asrockcentos8.37128 > asrockcentos8.postgres: Flags [P.], seq 1203:1283, ack 2255, win 1387, options [nop,nop,TS val 2677057559 ecr 2677057559], length 80
E...Ff@.@.p............8.y..9v.s...k.......
............K..x..8.....M)....kH.UM.2.*.`...g`~...\.j.......14...._/6.;..+3...A}r..l...x
23:33:51.032417 IP asrockcentos8.37128 > asrockcentos8.postgres: Flags [P.], seq 1283:1384, ack 2304, win 1387, options [nop,nop,TS val 2677057559 ecr 2677057559], length 101
E...Fg@.@.p............8.y..9v.....k.......
............`...r$\GM%.......D..t.'.
u.2=................R./Oz..^.}D...Sq..gh....0....UF
vZ.(.s....O=F   I.y.c\
23:33:51.032543 IP asrockcentos8.37128 > asrockcentos8.postgres: Flags [P.], seq 1384:1506, ack 2351, win 1387, options [nop,nop,TS val 2677057559 ecr 2677057559], length 122
E...Fh@.@.py...........8.y.b9v.....k.   .....
............u.......p..b.t.%....R.2...].Q..z]...<!2q<j6..}..c..T....H...Q.^.:I=.rs.^..F....3..Mn.f.".Q\.j$4...W+...w....t.|.Q....
23:33:51.032642 IP asrockcentos8.37128 > asrockcentos8.postgres: Flags [P.], seq 1506:1587, ack 2443, win 1387, options [nop,nop,TS val 2677057559 ecr 2677057559], length 81
E...Fi@.@.p............8.y..9v./...k.......
............L....Ae....`IB..Eg..H.....&$..oc.8[....g./....KR.=....q..+..... ...>...#<..M.
23:33:51.032960 IP asrockcentos8.37132 > asrockcentos8.postgres: Flags [S], seq 3490916636, win 43690, options [mss 65495,sackOK,TS val 2677057559 ecr 0,nop,wscale 7], length 0
E..<..@.@..............8..)....................
............
23:33:51.032972 IP asrockcentos8.37132 > asrockcentos8.postgres: Flags [.], ack 3352597083, win 342, options [nop,nop,TS val 2677057559 ecr 2677057559], length 0
E..4..@.@..............8..)....[...V.......
........
23:33:51.033037 IP asrockcentos8.37132 > asrockcentos8.postgres: Flags [P.], seq 0:8, ack 1, win 342, options [nop,nop,TS val 2677057560 ecr 2677057559], length 8
E..<..@.@..............8..)....[...V.......
.............../
23:33:51.033326 IP asrockcentos8.37132 > asrockcentos8.postgres: Flags [.], ack 2, win 342, options [nop,nop,TS val 2677057560 ecr 2677057560], length 0
E..4..@.@..............8..)%...\...V.......
........
23:33:51.034317 IP asrockcentos8.37132 > asrockcentos8.postgres: Flags [P.], seq 8:343, ack 2, win 342, options [nop,nop,TS val 2677057561 ecr 2677057560], length 335
E.....@.@..f...........8..)%...\...V.......
............J...F..     !.......=.w....+.....#.....<H'} . ....
Zt`a'....:R=vB.u..........>.......,.+...0.../.......$.(.#.'.k.g.
...     ...9.3.....=.<.5./................
.................................". .............       .
.................2.". .............     .
...................     ..............+........-.....3.&.$... .-E.Q.m..#..o5.....6.+..{..*-.EK
23:33:51.035057 IP asrockcentos8.37132 > asrockcentos8.postgres: Flags [P.], seq 343:711, ack 101, win 342, options [nop,nop,TS val 2677057562 ecr 2677057561], length 368
E.....@.@..D...........8..*t.......V.......
............k...g..     !.......=.w....+.....#.....<H'} . ....
Zt`a'....:R=vB.u..........>.......,.+...0.../.......$.(.#.'.k.g.
...     ...9.3.....=.<.5./................
.................................". .............       .
.................2.". .............     .
...................     ..............+........-.....3.G.E...A...[..Y...J.D.l....)..)..\Y...5.&.&oqo.;......P..d...F-....,.....
23:33:51.035953 IP asrockcentos8.37132 > asrockcentos8.postgres: Flags [.], ack 1515, win 1365, options [nop,nop,TS val 2677057562 ecr 2677057562], length 0
E..4..@.@..............8..+....E...U.......
........
23:33:51.037313 IP asrockcentos8.37132 > asrockcentos8.postgres: Flags [P.], seq 711:717, ack 1515, win 1365, options [nop,nop,TS val 2677057564 ecr 2677057562], length 6
E..:..@.@..............8..+....E...U.......
..............
23:33:51.038325 IP asrockcentos8.37132 > asrockcentos8.postgres: Flags [P.], seq 717:807, ack 1515, win 1365, options [nop,nop,TS val 2677057565 ecr 2677057562], length 90
E.....@.@..W...........8..+....E...U.......
............U....C.u....LA.t....b.cV...-A.^n61.-D..%G2..R.gs....'.Z....^.9..p.....k..W.0.W....J...
23:33:51.038392 IP asrockcentos8.37132 > asrockcentos8.postgres: Flags [P.], seq 807:962, ack 1673, win 1365, options [nop,nop,TS val 2677057565 ecr 2677057565], length 155
E.....@.@..............8..,D.......U.*.....
.............).....3.....D:..V....ys..x.a?...$>%..eG..c..4.y.'.E@]..D#....6l.q....h..L..v...T3
....".J.I!...1..........sz..n...L.A...E....KQ!._5.{.Vg......A...
.ZY
23:33:51.038731 IP asrockcentos8.37132 > asrockcentos8.postgres: Flags [P.], seq 962:1056, ack 1738, win 1365, options [nop,nop,TS val 2677057565 ecr 2677057565], length 94
E.....@.@..Q...........8..,....$...U.......
............Y>.5.N.1`...:.......'g.     eP..]....?.z.-# .kr4..S...aX...q!.nl+{......rN!...^.MT@Y..;..U.z9.
23:33:51.043996 IP asrockcentos8.37106 > asrockcentos8.postgres: Flags [.], ack 2493, win 1387, options [nop,nop,TS val 2677057571 ecr 2677057530], length 0
E..4.Z@.@..............8A...U.A....k.......
...#....
23:33:51.046368 IP asrockcentos8.37132 > asrockcentos8.postgres: Flags [P.], seq 1056:1203, ack 1853, win 1365, options [nop,nop,TS val 2677057573 ecr 2677057565], length 147
E.....@.@..............8..-=.......U.".....
...%.........VA].L%.M...."./=..!.c........Y%....+.H=.2...T`.+...$.....7....Nd6/..;Df.....y.Hf.."bK.%.*..j.E>...T.5.............Q-B{7..1yS...|..."...+.*.5.*
23:33:51.046870 IP asrockcentos8.37132 > asrockcentos8.postgres: Flags [P.], seq 1203:1283, ack 2255, win 1387, options [nop,nop,TS val 2677057573 ecr 2677057573], length 80
E.....@.@..]...........8..-....)...k.......
...%...%....K
0G..p0.q{
`.Jvu.zq.D.&]....A.....K..K.hi.%...QP...z{.}Q..,T.q...:J.....N.u
23:33:51.046982 IP asrockcentos8.37132 > asrockcentos8.postgres: Flags [P.], seq 1283:1384, ack 2304, win 1387, options [nop,nop,TS val 2677057573 ecr 2677057573], length 101
E.....@.@..G...........8... ...Z...k.......
...%...%....`L.-..J.),C.z.B..p..k..f}.6=E......j.......2.X...Y...^r.zN..A..t.<...SM...N7.u*....f.........xC=.
23:33:51.047103 IP asrockcentos8.37132 > asrockcentos8.postgres: Flags [P.], seq 1384:1506, ack 2351, win 1387, options [nop,nop,TS val 2677057574 ecr 2677057574], length 122
E.....@.@..1...........8...........k.   .....
...&...&....u.=..4.\i..%XMZ.t....'....Cm....?.&b.J.........;%.".....).V.....}......'......cp.$......)...{..E.-5+.\..#.l.]'*"p..aF.
23:33:51.047193 IP asrockcentos8.37132 > asrockcentos8.postgres: Flags [P.], seq 1506:1587, ack 2443, win 1387, options [nop,nop,TS val 2677057574 ecr 2677057574], length 81
E.....@.@..Y...........8...........k.......
...&...&....L...QG....T'M..M[[#_....*.S...r&....BY.1n....;pE    B..[.....p?...a..F.7~D.....v
23:33:51.057989 IP asrockcentos8.37118 > asrockcentos8.postgres: Flags [.], ack 2493, win 1387, options [nop,nop,TS val 2677057585 ecr 2677057544], length 0
E..4.2@.@..)...........8...<.5xC...k.......
...1....
23:33:51.072990 IP asrockcentos8.37128 > asrockcentos8.postgres: Flags [.], ack 2493, win 1387, options [nop,nop,TS val 2677057600 ecr 2677057559], length 0
E..4Fj@.@.p............8.y.-9v.a...k.......
...@....
23:33:51.087990 IP asrockcentos8.37132 > asrockcentos8.postgres: Flags [.], ack 2493, win 1387, options [nop,nop,TS val 2677057615 ecr 2677057574], length 0
E..4..@.@..............8../P.......k.......
...O...&











